arxiv_id,title,authors,year,published,updated,primary_category,categories,abstract,url,pdf_url,topic,technical_tags,technical_role,relevance,status,ai_rating,human_checked,notes,match_terms
1803.10701,Enriching the Symphony of Gravitational Waves from Binary Black Holes by Tuning Higher Harmonics,Roberto Cotesta; Alessandra Buonanno; Alejandro Bohé; Andrea Taracchini; Ian Hinder; Serguei Ossokine,2018,2018-03-28,,gr-qc,gr-qc,,https://arxiv.org/abs/1803.10701,https://arxiv.org/pdf/1803.10701,EOB,foundations_hamiltonian_pn_pm;resummation_flux_waveform;nr_calibration_eobnr_seobnr_teobresums;spin_precession;data_analysis_lvkc,foundations_hamiltonian_pn_pm,candidate; needs human triage,candidate,X,no,preserved from data/eob_arxiv_candidates.csv; match_terms=effective-one-body,effective-one-body
1804.02235,Matter imprints in waveform models for neutron star binaries: tidal and self-spin effects,Tim Dietrich; Sebastian Khan; Reetika Dudi; Shasvath J. Kapadia; Prayush Kumar; Alessandro Nagar; Frank Ohme; Francesco Pannarale; Anuradha Samajdar; Sebastiano Bernuzzi; Gregorio Carullo; Walter Del Pozzo; et al.,2018,2018-04-06,,gr-qc,gr-qc;astro-ph.HE,,https://arxiv.org/abs/1804.02235,https://arxiv.org/pdf/1804.02235,EOB,foundations_hamiltonian_pn_pm;nr_calibration_eobnr_seobnr_teobresums;spin_precession;tides_neutron_stars,foundations_hamiltonian_pn_pm,candidate; needs human triage,candidate,X,no,preserved from data/eob_arxiv_candidates.csv; match_terms=effective-one-body;SEOBNR;TEOBResumS,effective-one-body;SEOBNR;TEOBResumS
1805.00293,Black-hole Spectroscopy by Making Full Use of Gravitational-Wave Modeling,Richard Brito; Alessandra Buonanno; Vivien Raymond,2018,2018-05-01,,gr-qc,gr-qc,,https://arxiv.org/abs/1805.00293,https://arxiv.org/pdf/1805.00293,EOB,resummation_flux_waveform;nr_calibration_eobnr_seobnr_teobresums;spin_precession;data_analysis_lvkc,resummation_flux_waveform,candidate; needs human triage,candidate,X,no,preserved from data/eob_arxiv_candidates.csv; match_terms=effective-one-body;EOBNR,effective-one-body;EOBNR
1805.03891,Rush the inspiral: efficient Effective One Body time-domain gravitational waveforms,Alessandro Nagar; Piero Rettegno,2018,2018-05-10,,gr-qc,gr-qc,,https://arxiv.org/abs/1805.03891,https://arxiv.org/pdf/1805.03891,EOB,foundations_hamiltonian_pn_pm;resummation_flux_waveform;nr_calibration_eobnr_seobnr_teobresums;spin_precession;tides_neutron_stars;data_analysis_lvkc,foundations_hamiltonian_pn_pm,candidate; needs human triage,candidate,X,no,preserved from data/eob_arxiv_candidates.csv; match_terms=effective-one-body;EOB;TEOBResumS,effective-one-body;EOB;TEOBResumS
1805.10809,Gravitational spin-orbit coupling in binary systems at the second post-Minkowskian approximation,Donato Bini; Thibault Damour,2018,2018-05-28,,gr-qc,gr-qc;hep-th,,https://arxiv.org/abs/1805.10809,https://arxiv.org/pdf/1805.10809,EOB,foundations_hamiltonian_pn_pm;resummation_flux_waveform;spin_precession;eccentric_hyperbolic_scattering,foundations_hamiltonian_pn_pm,candidate; needs human triage,candidate,X,no,preserved from data/eob_arxiv_candidates.csv; match_terms=effective-one-body;EOB,effective-one-body;EOB
1806.01625,CoRe database of binary neutron star merger waveforms and its application in waveform development,Tim Dietrich; David Radice; Sebastiano Bernuzzi; Francesco Zappa; Albino Perego; Bernd Brueugmann; Swami Vivekanandji Chaurasia; Reetika Dudi; Wolfgang Tichy; Maximiliano Ujevic,2018,2018-06-05,,gr-qc,gr-qc;astro-ph.HE,,https://arxiv.org/abs/1806.01625,https://arxiv.org/pdf/1806.01625,EOB,nr_calibration_eobnr_seobnr_teobresums;spin_precession;tides_neutron_stars;eccentric_hyperbolic_scattering;data_analysis_lvkc,nr_calibration_eobnr_seobnr_teobresums,candidate; needs human triage,candidate,X,no,preserved from data/eob_arxiv_candidates.csv; match_terms=effective-one-body,effective-one-body
1806.01772,"Time-domain effective-one-body gravitational waveforms for coalescing compact binaries with nonprecessing spins, tides and self-spin effects",Alessandro Nagar; Sebastiano Bernuzzi; Walter Del Pozzo; Gunnar Riemenschneider; Sarp Akcay; Gregorio Carullo; Philipp Fleig; Stanislav Babak; Ka Wa Tsang; Marta Colleoni; Francesco Messina; Geraint Pratten; et al.,2018,2018-06-05,,gr-qc,gr-qc,,https://arxiv.org/abs/1806.01772,https://arxiv.org/pdf/1806.01772,EOB,foundations_hamiltonian_pn_pm;resummation_flux_waveform;nr_calibration_eobnr_seobnr_teobresums;gsf_gauge_invariants;spin_precession;tides_neutron_stars;eccentric_hyperbolic_scattering;data_analysis_lvkc,foundations_hamiltonian_pn_pm,candidate; needs human triage,candidate,X,no,preserved from data/eob_arxiv_candidates.csv; match_terms=effective-one-body;EOB;TEOBResumS,effective-one-body;EOB;TEOBResumS
1808.06582,Hamiltonians and canonical coordinates for spinning particles in curved space-time,Vojtěch Witzany; Jan Steinhoff; Georgios Lukes-Gerakopoulos,2018,2018-08-20,,gr-qc,gr-qc;astro-ph.HE,,https://arxiv.org/abs/1808.06582,https://arxiv.org/pdf/1808.06582,EOB,foundations_hamiltonian_pn_pm;spin_precession;eccentric_hyperbolic_scattering;emri_test_mass_teukolsky,foundations_hamiltonian_pn_pm,candidate; needs human triage,candidate,X,no,preserved from data/eob_arxiv_candidates.csv; match_terms=effective-one-body,effective-one-body
1808.09749,Relevance of tidal effects and post-merger dynamics for binary neutron star parameter estimation,Reetika Dudi; Francesco Pannarale; Tim Dietrich; Mark Hannam; Sebastiano Bernuzzi; Frank Ohme; Bernd Bruegmann,2018,2018-08-29,,gr-qc,gr-qc,,https://arxiv.org/abs/1808.09749,https://arxiv.org/pdf/1808.09749,EOB,nr_calibration_eobnr_seobnr_teobresums;spin_precession;tides_neutron_stars;data_analysis_lvkc,nr_calibration_eobnr_seobnr_teobresums,candidate; needs human triage,candidate,X,no,preserved from data/eob_arxiv_candidates.csv; match_terms=effective-one-body,effective-one-body
1809.03109,Hairy binary black holes in Einstein-Maxwell-dilaton theory and their effective-one-body description,Mohammed Khalil; Noah Sennett; Jan Steinhoff; Justin Vines; Alessandra Buonanno,2018,2018-09-03,,gr-qc,gr-qc;astro-ph.HE;hep-th,,https://arxiv.org/abs/1809.03109,https://arxiv.org/pdf/1809.03109,EOB,foundations_hamiltonian_pn_pm;nr_calibration_eobnr_seobnr_teobresums;data_analysis_lvkc,foundations_hamiltonian_pn_pm,candidate; needs human triage,candidate,X,no,preserved from data/eob_arxiv_candidates.csv; match_terms=effective-one-body;EOB,effective-one-body;EOB
1809.02516,Gravitational self-force corrections to gyroscope precession along circular orbits in the Kerr spacetime,Donato Bini; Thibault Damour; Andrea Geralico; Chris Kavanagh; Maarten van de Meent,2018,2018-09-07,,gr-qc,gr-qc,,https://arxiv.org/abs/1809.02516,https://arxiv.org/pdf/1809.02516,EOB,foundations_hamiltonian_pn_pm;nr_calibration_eobnr_seobnr_teobresums;gsf_gauge_invariants;spin_precession,foundations_hamiltonian_pn_pm,candidate; needs human triage,candidate,X,no,preserved from data/eob_arxiv_candidates.csv; match_terms=effective-one-body,effective-one-body
1809.04349,Systematic effects from black hole-neutron star waveform model uncertainties on the neutron star equation of state,Kabir Chakravarti; Anuradha Gupta; Sukanta Bose; Matthew D. Duez; Jesus Caro; Wyatt Brege; Francois Foucart; Shaon Ghosh; Koutarou Kyutoku; Benjamin D. Lackey; Masaru Shibata; Daniel A. Hemberger; et al.,2018,2018-09-12,,gr-qc,gr-qc;astro-ph.SR,,https://arxiv.org/abs/1809.04349,https://arxiv.org/pdf/1809.04349,EOB,foundations_hamiltonian_pn_pm;nr_calibration_eobnr_seobnr_teobresums;spin_precession;tides_neutron_stars;data_analysis_lvkc,foundations_hamiltonian_pn_pm,candidate; needs human triage,candidate,X,no,preserved from data/eob_arxiv_candidates.csv; match_terms=effective-one-body;EOB,effective-one-body;EOB
1809.05041,Gravitational radiation from compact binary systems in Einstein-Maxwell-dilaton theories,Félix-Louis Julié,2018,2018-09-13,,gr-qc,gr-qc,,https://arxiv.org/abs/1809.05041,https://arxiv.org/pdf/1809.05041,EOB,resummation_flux_waveform;nr_calibration_eobnr_seobnr_teobresums,resummation_flux_waveform,candidate; needs human triage,candidate,X,no,preserved from data/eob_arxiv_candidates.csv; match_terms=effective-one-body;EOB,effective-one-body;EOB
1812.00956,Spinning-black-hole scattering and the test-black-hole limit at second post-Minkowskian order,Justin Vines; Jan Steinhoff; Alessandra Buonanno,2018,2018-12-03,,gr-qc,gr-qc,,https://arxiv.org/abs/1812.00956,https://arxiv.org/pdf/1812.00956,EOB,foundations_hamiltonian_pn_pm;spin_precession;eccentric_hyperbolic_scattering,foundations_hamiltonian_pn_pm,candidate; needs human triage,candidate,X,no,preserved from data/eob_arxiv_candidates.csv; match_terms=effective-one-body,effective-one-body
1812.02744,Effective-one-body multipolar waveform for tidally interacting binary neutron stars up to merger,Sarp Akcay; Sebastiano Bernuzzi; Francesco Messina; Alessandro Nagar; Néstor Ortiz; Piero Rettegno,2018,2018-12-06,,gr-qc,gr-qc,,https://arxiv.org/abs/1812.02744,https://arxiv.org/pdf/1812.02744,EOB,foundations_hamiltonian_pn_pm;resummation_flux_waveform;nr_calibration_eobnr_seobnr_teobresums;gsf_gauge_invariants;spin_precession;tides_neutron_stars;eccentric_hyperbolic_scattering,foundations_hamiltonian_pn_pm,candidate; needs human triage,candidate,X,no,preserved from data/eob_arxiv_candidates.csv; match_terms=effective-one-body;EOB,effective-one-body;EOB
1812.07865,Surrogate model of hybridized numerical relativity binary black hole waveforms,Vijay Varma; Scott E. Field; Mark A. Scheel; Jonathan Blackman; Lawrence E. Kidder; Harald P. Pfeiffer,2018,2018-12-19,,gr-qc,gr-qc,,https://arxiv.org/abs/1812.07865,https://arxiv.org/pdf/1812.07865,EOB,foundations_hamiltonian_pn_pm;nr_calibration_eobnr_seobnr_teobresums;spin_precession;data_analysis_lvkc,foundations_hamiltonian_pn_pm,candidate; needs human triage,candidate,X,no,preserved from data/eob_arxiv_candidates.csv; match_terms=effective-one-body,effective-one-body
1812.07923,"Nonlinear-in-spin effects in effective-one-body waveform models of spin-aligned, inspiralling, neutron star binaries",Alessandro Nagar; Francesco Messina; Piero Rettegno; Donato Bini; Thibault Damour; Andrea Geralico; Sarp Akcay; Sebastiano Bernuzzi,2018,2018-12-19,,gr-qc,gr-qc,,https://arxiv.org/abs/1812.07923,https://arxiv.org/pdf/1812.07923,EOB,foundations_hamiltonian_pn_pm;nr_calibration_eobnr_seobnr_teobresums;gsf_gauge_invariants;spin_precession;tides_neutron_stars,foundations_hamiltonian_pn_pm,candidate; needs human triage,candidate,X,no,preserved from data/eob_arxiv_candidates.csv; match_terms=effective-one-body;EOB;TEOBResumS,effective-one-body;EOB;TEOBResumS
1812.08643,Surrogate model for an aligned-spin effective one body waveform model of binary neutron star inspirals using Gaussian process regression,Benjamin D. Lackey; Michael Pürrer; Andrea Taracchini; Sylvain Marsat,2018,2018-12-20,,gr-qc,gr-qc,,https://arxiv.org/abs/1812.08643,https://arxiv.org/pdf/1812.08643,EOB,nr_calibration_eobnr_seobnr_teobresums;spin_precession;tides_neutron_stars;data_analysis_lvkc,nr_calibration_eobnr_seobnr_teobresums,candidate; needs human triage,candidate,X,no,preserved from data/eob_arxiv_candidates.csv; match_terms=effective-one-body;SEOBNR,effective-one-body;SEOBNR
1901.07102,Energetics of two-body Hamiltonians in post-Minkowskian gravity,Andrea Antonelli; Alessandra Buonanno; Jan Steinhoff; Maarten van de Meent; Justin Vines,2019,2019-01-21,,gr-qc,gr-qc;hep-th,,https://arxiv.org/abs/1901.07102,https://arxiv.org/pdf/1901.07102,EOB,foundations_hamiltonian_pn_pm;resummation_flux_waveform;nr_calibration_eobnr_seobnr_teobresums;eccentric_hyperbolic_scattering;data_analysis_lvkc,foundations_hamiltonian_pn_pm,candidate; needs human triage,candidate,X,no,preserved from data/eob_arxiv_candidates.csv; match_terms=effective-one-body;EOB,effective-one-body;EOB
1904.09550,A Multipolar Effective One Body Model for Non-Spinning Black Hole Binaries,Alessandro Nagar; Geraint Pratten; Gunnar Riemenschneider; Rossella Gamba,2019,2019-04-21,,gr-qc,gr-qc,,https://arxiv.org/abs/1904.09550,https://arxiv.org/pdf/1904.09550,EOB,foundations_hamiltonian_pn_pm;resummation_flux_waveform;nr_calibration_eobnr_seobnr_teobresums;spin_precession;emri_test_mass_teukolsky,foundations_hamiltonian_pn_pm,candidate; needs human triage,candidate,X,no,preserved from data/eob_arxiv_candidates.csv; match_terms=effective-one-body;EOB,effective-one-body;EOB
1904.09558,Quasi-5.5PN TaylorF2 approximant for compact binaries: point-mass phasing and impact on the tidal polarizability inference,Francesco Messina; Reetika Dudi; Alessandro Nagar; Sebastiano Bernuzzi,2019,2019-04-21,,gr-qc,gr-qc,,https://arxiv.org/abs/1904.09558,https://arxiv.org/pdf/1904.09558,EOB,foundations_hamiltonian_pn_pm;resummation_flux_waveform;nr_calibration_eobnr_seobnr_teobresums;gsf_gauge_invariants;spin_precession;tides_neutron_stars;data_analysis_lvkc,foundations_hamiltonian_pn_pm,candidate; needs human triage,candidate,X,no,preserved from data/eob_arxiv_candidates.csv; match_terms=effective-one-body;EOB,effective-one-body;EOB
1905.00818,Frequency domain model of $f$-mode dynamic tides in gravitational waveforms from compact binary inspirals,Patricia Schmidt; Tanja Hinderer,2019,2019-05-02,,gr-qc,gr-qc;astro-ph.HE,,https://arxiv.org/abs/1905.00818,https://arxiv.org/pdf/1905.00818,EOB,nr_calibration_eobnr_seobnr_teobresums;spin_precession;tides_neutron_stars;eccentric_hyperbolic_scattering,nr_calibration_eobnr_seobnr_teobresums,candidate; needs human triage,candidate,X,no,preserved from data/eob_arxiv_candidates.csv; match_terms=effective-one-body,effective-one-body
1905.06011,Improving the NRTidal model for binary neutron star systems,Tim Dietrich; Anuradha Samajdar; Sebastian Khan; Nathan K. Johnson-McDaniel; Reetika Dudi; Wolfgang Tichy,2019,2019-05-15,,gr-qc,gr-qc;astro-ph.HE,,https://arxiv.org/abs/1905.06011,https://arxiv.org/pdf/1905.06011,EOB,foundations_hamiltonian_pn_pm;nr_calibration_eobnr_seobnr_teobresums;spin_precession;tides_neutron_stars,foundations_hamiltonian_pn_pm,candidate; needs human triage,candidate,X,no,preserved from data/eob_arxiv_candidates.csv; match_terms=effective-one-body;SEOBNR,effective-one-body;SEOBNR
1905.07340,The two-body potential of Vainshtein screened theories,Adrien Kuntz,2019,2019-05-17,,gr-qc,gr-qc;astro-ph.CO;hep-ph,,https://arxiv.org/abs/1905.07340,https://arxiv.org/pdf/1905.07340,EOB,foundations_hamiltonian_pn_pm;nr_calibration_eobnr_seobnr_teobresums,foundations_hamiltonian_pn_pm,candidate; needs human triage,candidate,X,no,preserved from data/eob_arxiv_candidates.csv; match_terms=effective-one-body,effective-one-body
1907.11597,Quasi-circular inspirals and plunges from non-spinning effective-one-body Hamiltonians with gravitational self-force information,Andrea Antonelli; Maarten van de Meent; Alessandra Buonanno; Jan Steinhoff; Justin Vines,2019,2019-07-26,,gr-qc,gr-qc,,https://arxiv.org/abs/1907.11597,https://arxiv.org/pdf/1907.11597,EOB,foundations_hamiltonian_pn_pm;resummation_flux_waveform;nr_calibration_eobnr_seobnr_teobresums;gsf_gauge_invariants;spin_precession,foundations_hamiltonian_pn_pm,candidate; needs human triage,candidate,X,no,preserved from data/eob_arxiv_candidates.csv; match_terms=effective-one-body;EOB,effective-one-body;EOB
1907.12233,Factorization and resummation: A new paradigm to improve gravitational wave amplitudes. III: the spinning test-body terms,Alessandro Nagar; Francesco Messina; Chris Kavanagh; Georgios Lukes-Gerakopoulos; Niels Warburton; Sebastiano Bernuzzi; Enno Harms,2019,2019-07-29,,gr-qc,gr-qc,,https://arxiv.org/abs/1907.12233,https://arxiv.org/pdf/1907.12233,EOB,foundations_hamiltonian_pn_pm;resummation_flux_waveform;nr_calibration_eobnr_seobnr_teobresums;spin_precession;emri_test_mass_teukolsky,foundations_hamiltonian_pn_pm,candidate; needs human triage,candidate,X,no,preserved from data/eob_arxiv_candidates.csv; match_terms=effective-one-body,effective-one-body
1908.11418,kiloHertz gravitational waves from binary neutron star remnants: time-domain model and constraints on extreme matter,Matteo Breschi; Sebastiano Bernuzzi; Francesco Zappa; Michalis Agathos; Albino Perego; David Radice; Alessandro Nagar,2019,2019-08-29,,gr-qc,gr-qc;astro-ph.HE,,https://arxiv.org/abs/1908.11418,https://arxiv.org/pdf/1908.11418,EOB,nr_calibration_eobnr_seobnr_teobresums;spin_precession;tides_neutron_stars,nr_calibration_eobnr_seobnr_teobresums,candidate; needs human triage,candidate,X,no,preserved from data/eob_arxiv_candidates.csv; match_terms=effective-one-body,effective-one-body
1909.02375,Novel approach to binary dynamics: application to the fifth post-Newtonian level,Donato Bini; Thibault Damour; Andrea Geralico,2019,2019-09-05,,gr-qc,gr-qc,,https://arxiv.org/abs/1909.02375,https://arxiv.org/pdf/1909.02375,EOB,foundations_hamiltonian_pn_pm;resummation_flux_waveform;gsf_gauge_invariants,foundations_hamiltonian_pn_pm,candidate; needs human triage,candidate,X,no,preserved from data/eob_arxiv_candidates.csv; match_terms=effective-one-body,effective-one-body
1909.05466,Searching for Eccentricity: Signatures of Dynamical Formation in the First Gravitational-Wave Transient Catalogue of LIGO and Virgo,Isobel M. Romero-Shaw; Paul D. Lasky; Eric Thrane,2019,2019-09-12,,astro-ph.HE,astro-ph.HE;astro-ph.IM,,https://arxiv.org/abs/1909.05466,https://arxiv.org/pdf/1909.05466,EOB,nr_calibration_eobnr_seobnr_teobresums;spin_precession;eccentric_hyperbolic_scattering;data_analysis_lvkc,nr_calibration_eobnr_seobnr_teobresums,candidate; needs human triage,candidate,X,no,preserved from data/eob_arxiv_candidates.csv; match_terms=SEOBNR,SEOBNR
1909.06103,Self-force effects on the marginally bound zoom-whirl orbit in Schwarzschild spacetime,Leor Barack; Marta Colleoni; Thibault Damour; Soichiro Isoyama; Norichika Sago,2019,2019-09-13,,gr-qc,gr-qc;astro-ph.HE,,https://arxiv.org/abs/1909.06103,https://arxiv.org/pdf/1909.06103,EOB,foundations_hamiltonian_pn_pm;nr_calibration_eobnr_seobnr_teobresums;gsf_gauge_invariants;eccentric_hyperbolic_scattering,foundations_hamiltonian_pn_pm,candidate; needs human triage,candidate,X,no,preserved from data/eob_arxiv_candidates.csv; match_terms=effective-one-body,effective-one-body
1909.10010,Parameter Estimation with a spinning multi-mode waveform model: IMRPhenomHM,Chinmay Kalaghatgi; Mark Hannam; Vivien Raymond,2019,2019-09-22,,gr-qc,gr-qc,,https://arxiv.org/abs/1909.10010,https://arxiv.org/pdf/1909.10010,EOB,nr_calibration_eobnr_seobnr_teobresums;spin_precession;data_analysis_lvkc,nr_calibration_eobnr_seobnr_teobresums,candidate; needs human triage,candidate,X,no,preserved from data/eob_arxiv_candidates.csv; match_terms=EOB,EOB
1910.00784,Validating the Effective-One-Body Numerical-Relativity Waveform Models for Spin-aligned Binary Black Holes along Eccentric Orbits,Xiaolin Liu; Zhoujian Cao; Lijing Shao,2019,2019-10-02,,gr-qc,gr-qc;astro-ph.GA;astro-ph.HE,,https://arxiv.org/abs/1910.00784,https://arxiv.org/pdf/1910.00784,EOB,nr_calibration_eobnr_seobnr_teobresums;spin_precession;eccentric_hyperbolic_scattering;data_analysis_lvkc,nr_calibration_eobnr_seobnr_teobresums,candidate; needs human triage,candidate,X,no,preserved from data/eob_arxiv_candidates.csv; match_terms=effective-one-body;EOB;SEOBNR,effective-one-body;EOB;SEOBNR
1911.10818,Comparing Effective One Body Hamiltonians for spin-aligned coalescing binaries,Piero Rettegno; Fabio Martinetti; Alessandro Nagar; Donato Bini; Gunnar Riemenschneider; Thibault Damour,2019,2019-11-25,,gr-qc,gr-qc,,https://arxiv.org/abs/1911.10818,https://arxiv.org/pdf/1911.10818,EOB,foundations_hamiltonian_pn_pm;resummation_flux_waveform;nr_calibration_eobnr_seobnr_teobresums;gsf_gauge_invariants;spin_precession,foundations_hamiltonian_pn_pm,candidate; needs human triage,candidate,X,no,preserved from data/eob_arxiv_candidates.csv; match_terms=effective-one-body;EOB;SEOBNR;TEOBResumS,effective-one-body;EOB;SEOBNR;TEOBResumS
1912.01920,Tidal effects in the equations of motion of compact binary systems to next-to-next-to-leading post-Newtonian order,Quentin Henry; Guillaume Faye; Luc Blanchet,2019,2019-12-04,,gr-qc,gr-qc,,https://arxiv.org/abs/1912.01920,https://arxiv.org/pdf/1912.01920,EOB,foundations_hamiltonian_pn_pm;resummation_flux_waveform;spin_precession;tides_neutron_stars,foundations_hamiltonian_pn_pm,candidate; needs human triage,candidate,X,no,preserved from data/eob_arxiv_candidates.csv; match_terms=effective-one-body;EOB,effective-one-body;EOB
1912.02139,Classical and quantum scattering in post-Minkowskian gravity,Thibault Damour,2019,2019-12-04,,gr-qc,gr-qc,,https://arxiv.org/abs/1912.02139,https://arxiv.org/pdf/1912.02139,EOB,foundations_hamiltonian_pn_pm;nr_calibration_eobnr_seobnr_teobresums;gsf_gauge_invariants;eccentric_hyperbolic_scattering,foundations_hamiltonian_pn_pm,candidate; needs human triage,candidate,X,no,preserved from data/eob_arxiv_candidates.csv; match_terms=effective-one-body;EOB,effective-one-body;EOB
2001.06763,Analytical effective-one-body formalism for extreme-mass-ratio inspirals: eccentric orbits,Chen Zhang; Wen-Biao Han; Shu-Cheng Yang,2020,2020-01-19,,gr-qc,gr-qc,,https://arxiv.org/abs/2001.06763,https://arxiv.org/pdf/2001.06763,EOB,foundations_hamiltonian_pn_pm;resummation_flux_waveform;nr_calibration_eobnr_seobnr_teobresums;eccentric_hyperbolic_scattering;emri_test_mass_teukolsky;data_analysis_lvkc,foundations_hamiltonian_pn_pm,candidate; needs human triage,candidate,X,no,preserved from data/eob_arxiv_candidates.csv; match_terms=effective-one-body,effective-one-body
2001.09082,A multipolar effective one body waveform model for spin-aligned black hole binaries,Alessandro Nagar; Gunnar Riemenschneider; Geraint Pratten; Piero Rettegno; Francesco Messina,2020,2020-01-24,,gr-qc,gr-qc,,https://arxiv.org/abs/2001.09082,https://arxiv.org/pdf/2001.09082,EOB,resummation_flux_waveform;nr_calibration_eobnr_seobnr_teobresums;spin_precession;emri_test_mass_teukolsky;data_analysis_lvkc,resummation_flux_waveform,candidate; needs human triage,candidate,X,no,preserved from data/eob_arxiv_candidates.csv; match_terms=effective-one-body;EOB;TEOBResumS,effective-one-body;EOB;TEOBResumS
2001.10914,IMRPhenomXHM: A multi-mode frequency-domain model for the gravitational wave signal from non-precessing black-hole binaries,Cecilio García-Quirós; Marta Colleoni; Sascha Husa; Héctor Estellés; Geraint Pratten; Antoni Ramos-Buades; Maite Mateu-Lucena; Rafel Jaume,2020,2020-01-29,,gr-qc,gr-qc,,https://arxiv.org/abs/2001.10914,https://arxiv.org/pdf/2001.10914,EOB,foundations_hamiltonian_pn_pm;nr_calibration_eobnr_seobnr_teobresums;spin_precession;emri_test_mass_teukolsky,foundations_hamiltonian_pn_pm,candidate; needs human triage,candidate,X,no,preserved from data/eob_arxiv_candidates.csv; match_terms=effective-one-body,effective-one-body
2001.11470,Distinguishing high-mass binary neutron stars from binary black holes with second- and third-generation gravitational wave observatories,An Chen; Nathan K. Johnson-McDaniel; Tim Dietrich; Reetika Dudi,2020,2020-01-30,,astro-ph.HE,astro-ph.HE;astro-ph.SR;gr-qc,,https://arxiv.org/abs/2001.11470,https://arxiv.org/pdf/2001.11470,EOB,nr_calibration_eobnr_seobnr_teobresums;spin_precession;tides_neutron_stars;data_analysis_lvkc,nr_calibration_eobnr_seobnr_teobresums,candidate; needs human triage,candidate,X,no,preserved from data/eob_arxiv_candidates.csv; match_terms=effective-one-body,effective-one-body
2001.11736,"A faithful analytical effective one body waveform model for spin-aligned, moderately eccentric, coalescing black hole binaries",Danilo Chiaramello; Alessandro Nagar,2020,2020-01-31,,gr-qc,gr-qc,,https://arxiv.org/abs/2001.11736,https://arxiv.org/pdf/2001.11736,EOB,foundations_hamiltonian_pn_pm;resummation_flux_waveform;nr_calibration_eobnr_seobnr_teobresums;spin_precession;eccentric_hyperbolic_scattering;data_analysis_lvkc,foundations_hamiltonian_pn_pm,candidate; needs human triage,candidate,X,no,preserved from data/eob_arxiv_candidates.csv; match_terms=effective-one-body;EOB;TEOBResumS,effective-one-body;EOB;TEOBResumS
2002.08682,Investigating eccentricities of the binary black hole signals from the LIGO-Virgo catalog GWTC-1,Qian-Yun Yun; Wen-Biao Han; Gang Wang; Shu-Cheng Yang,2020,2020-02-20,,gr-qc,gr-qc,,https://arxiv.org/abs/2002.08682,https://arxiv.org/pdf/2002.08682,EOB,nr_calibration_eobnr_seobnr_teobresums;spin_precession;eccentric_hyperbolic_scattering;data_analysis_lvkc,nr_calibration_eobnr_seobnr_teobresums,candidate; needs human triage,candidate,X,no,preserved from data/eob_arxiv_candidates.csv; match_terms=SEOBNR,SEOBNR
2003.01692,Fourth post-Newtonian Hamiltonian dynamics of two-body systems from an effective field theory approach,J. Blümlein; A. Maier; P. Marquard; G. Schäfer,2020,2020-03-03,,gr-qc,gr-qc;astro-ph.HE;hep-th,,https://arxiv.org/abs/2003.01692,https://arxiv.org/pdf/2003.01692,EOB,foundations_hamiltonian_pn_pm;nr_calibration_eobnr_seobnr_teobresums,foundations_hamiltonian_pn_pm,candidate; needs human triage,candidate,X,no,preserved from data/eob_arxiv_candidates.csv; match_terms=effective-one-body;EOB,effective-one-body;EOB
2003.04469,Fourth post-Newtonian effective-one-body Hamiltonians with generic spins,Mohammed Khalil; Jan Steinhoff; Justin Vines; Alessandra Buonanno,2020,2020-03-10,,gr-qc,gr-qc,,https://arxiv.org/abs/2003.04469,https://arxiv.org/pdf/2003.04469,EOB,foundations_hamiltonian_pn_pm;nr_calibration_eobnr_seobnr_teobresums;spin_precession;tides_neutron_stars;data_analysis_lvkc,foundations_hamiltonian_pn_pm,candidate; needs human triage,candidate,X,no,preserved from data/eob_arxiv_candidates.csv; match_terms=effective-one-body;EOB,effective-one-body;EOB
