arxiv_id,title,authors,year,published,updated,primary_category,categories,abstract,url,pdf_url,topic,technical_tags,technical_role,relevance,status,ai_rating,human_checked,notes,match_terms
2306.03148,Numerical relativity surrogate model with memory effects and post-Newtonian hybridization,Jooheon Yoo; Keefe Mitman; Vijay Varma; Michael Boyle; Scott E. Field; Nils Deppe; François Hébert; Lawrence E. Kidder; Jordan Moxon; Harald P. Pfeiffer; Mark A. Scheel; Leo C. Stein; et al.,2023,2023-06-05,,gr-qc,gr-qc,,https://arxiv.org/abs/2306.03148,https://arxiv.org/pdf/2306.03148,EOB,foundations_hamiltonian_pn_pm;nr_calibration_eobnr_seobnr_teobresums;spin_precession;eccentric_hyperbolic_scattering;data_analysis_lvkc,foundations_hamiltonian_pn_pm,candidate; needs human triage,candidate,X,no,preserved from data/eob_arxiv_candidates.csv; match_terms=effective-one-body;EOB,effective-one-body;EOB
2306.15277,Upgraded waveform model of eccentric binary black hole based on effective-one-body-numerical-relativity for spin-aligned binary black holes,Xiaolin Liu; Zhoujian Cao; Lijing Shao,2023,2023-06-27,,gr-qc,gr-qc,,https://arxiv.org/abs/2306.15277,https://arxiv.org/pdf/2306.15277,EOB,nr_calibration_eobnr_seobnr_teobresums;spin_precession;eccentric_hyperbolic_scattering,nr_calibration_eobnr_seobnr_teobresums,candidate; needs human triage,candidate,X,no,preserved from data/eob_arxiv_candidates.csv; match_terms=effective-one-body;SEOBNR,effective-one-body;SEOBNR
2306.16488,"The gravitational eikonal: from particle, string and brane collisions to black-hole encounters",Paolo Di Vecchia; Carlo Heissenberg; Rodolfo Russo; Gabriele Veneziano,2023,2023-06-28,,hep-th,hep-th;gr-qc;hep-ph,,https://arxiv.org/abs/2306.16488,https://arxiv.org/pdf/2306.16488,EOB,foundations_hamiltonian_pn_pm;nr_calibration_eobnr_seobnr_teobresums,foundations_hamiltonian_pn_pm,candidate; needs human triage,candidate,X,no,preserved from data/eob_arxiv_candidates.csv; match_terms=effective-one-body,effective-one-body
2307.05971,Effective metric of spinless binaries with radiation-reaction effect up to fourth Post-Minkowskian order in effective-one-body theory,Jiliang Jing; Weike Deng; Sheng Long; Jieci Wang,2023,2023-07-12,,gr-qc,gr-qc;hep-th,,https://arxiv.org/abs/2307.05971,https://arxiv.org/pdf/2307.05971,EOB,foundations_hamiltonian_pn_pm;spin_precession;eccentric_hyperbolic_scattering,foundations_hamiltonian_pn_pm,candidate; needs human triage,candidate,X,no,preserved from data/eob_arxiv_candidates.csv; match_terms=effective-one-body,effective-one-body
2307.06999,Strong-field scattering of two spinning black holes: Numerical Relativity versus post-Minkowskian gravity,Piero Rettegno; Geraint Pratten; Lucy Thomas; Patricia Schmidt; Thibault Damour,2023,2023-07-13,,gr-qc,gr-qc;hep-th,,https://arxiv.org/abs/2307.06999,https://arxiv.org/pdf/2307.06999,EOB,foundations_hamiltonian_pn_pm;resummation_flux_waveform;nr_calibration_eobnr_seobnr_teobresums;spin_precession;eccentric_hyperbolic_scattering,foundations_hamiltonian_pn_pm,candidate; needs human triage,candidate,X,no,preserved from data/eob_arxiv_candidates.csv; match_terms=effective-one-body,effective-one-body
2307.08697,Towards numerical-relativity informed effective-one-body waveforms for dynamical capture black hole binaries,Tomas Andrade; Juan Trenado; Simone Albanesi; Rossella Gamba; Sebastiano Bernuzzi; Alessandro Nagar; Juan Calderon-Bustillo; Nicolas Sanchis-Gual; Jose A. Font; William Cook; Boris Daszuta; Francesco Zappa; et al.,2023,2023-07-17,,gr-qc,gr-qc;astro-ph.HE,,https://arxiv.org/abs/2307.08697,https://arxiv.org/pdf/2307.08697,EOB,nr_calibration_eobnr_seobnr_teobresums;spin_precession;eccentric_hyperbolic_scattering,nr_calibration_eobnr_seobnr_teobresums,candidate; needs human triage,candidate,X,no,preserved from data/eob_arxiv_candidates.csv; match_terms=effective-one-body;EOB;EOBNR;TEOBResumS,effective-one-body;EOB;EOBNR;TEOBResumS
2307.15086,Measuring source properties and quasi-normal-mode frequencies of heavy massive black-hole binaries with LISA,Alexandre Toubiana; Lorenzo Pompili; Alessandra Buonanno; Jonathan R. Gair; Michael L. Katz,2023,2023-07-26,,gr-qc,gr-qc,,https://arxiv.org/abs/2307.15086,https://arxiv.org/pdf/2307.15086,EOB,resummation_flux_waveform;nr_calibration_eobnr_seobnr_teobresums;spin_precession,resummation_flux_waveform,candidate; needs human triage,candidate,X,no,preserved from data/eob_arxiv_candidates.csv; match_terms=effective-one-body;SEOBNR,effective-one-body;SEOBNR
2307.15125,Analytically improved and numerical-relativity informed effective-one-body model for coalescing binary neutron stars,Rossella Gamba; Matteo Breschi; Sebastiano Bernuzzi; Alessandro Nagar; William Cook; Georgios Doulis; Francesco Fabbri; Néstor Ortiz; Amit Poudel; Alireza Rashti; Wolfgang Tichy; Maximiliano Ujevic,2023,2023-07-27,,gr-qc,gr-qc;astro-ph.HE,,https://arxiv.org/abs/2307.15125,https://arxiv.org/pdf/2307.15125,EOB,foundations_hamiltonian_pn_pm;resummation_flux_waveform;nr_calibration_eobnr_seobnr_teobresums;spin_precession;tides_neutron_stars;eccentric_hyperbolic_scattering;data_analysis_lvkc,foundations_hamiltonian_pn_pm,candidate; needs human triage,candidate,X,no,preserved from data/eob_arxiv_candidates.csv; match_terms=effective-one-body;EOB;TEOBResumS,effective-one-body;EOB;TEOBResumS
2309.07228,Unveiling the merger structure of black hole binaries in generic planar orbits,Gregorio Carullo; Simone Albanesi; Alessandro Nagar; Rossella Gamba; Sebastiano Bernuzzi; Tomas Andrade; Juan Trenado,2023,2023-09-13,,gr-qc,gr-qc;astro-ph.HE,,https://arxiv.org/abs/2309.07228,https://arxiv.org/pdf/2309.07228,EOB,foundations_hamiltonian_pn_pm;nr_calibration_eobnr_seobnr_teobresums;gsf_gauge_invariants;eccentric_hyperbolic_scattering;emri_test_mass_teukolsky,foundations_hamiltonian_pn_pm,candidate; needs human triage,candidate,X,no,preserved from data/eob_arxiv_candidates.csv; match_terms=effective-one-body,effective-one-body
2309.12505,Balance Laws as Test of Gravitational Waveforms,Lavinia Heisenberg,2023,2023-09-21,,gr-qc,gr-qc;astro-ph.CO;astro-ph.HE;hep-ph;hep-th,,https://arxiv.org/abs/2309.12505,https://arxiv.org/pdf/2309.12505,EOB,foundations_hamiltonian_pn_pm;nr_calibration_eobnr_seobnr_teobresums;data_analysis_lvkc,foundations_hamiltonian_pn_pm,candidate; needs human triage,candidate,X,no,preserved from data/eob_arxiv_candidates.csv; match_terms=effective-one-body,effective-one-body
2309.15528,Bayesian inference of binary black holes with inspiral-merger-ringdown waveforms using two eccentric parameters,Antoni Ramos-Buades; Alessandra Buonanno; Jonathan Gair,2023,2023-09-27,,gr-qc,gr-qc;astro-ph.HE;astro-ph.IM,,https://arxiv.org/abs/2309.15528,https://arxiv.org/pdf/2309.15528,EOB,resummation_flux_waveform;nr_calibration_eobnr_seobnr_teobresums;spin_precession;eccentric_hyperbolic_scattering;data_analysis_lvkc,resummation_flux_waveform,candidate; needs human triage,candidate,X,no,preserved from data/eob_arxiv_candidates.csv; match_terms=effective-one-body;EOB;SEOBNR,effective-one-body;EOB;SEOBNR
2309.16638,Blind spots and biases: the dangers of ignoring eccentricity in gravitational-wave signals from binary black holes, Divyajyoti; Sumit Kumar; Snehal Tibrewal; Isobel M. Romero-Shaw; Chandra Kant Mishra,2023,2023-09-28,,gr-qc,gr-qc,,https://arxiv.org/abs/2309.16638,https://arxiv.org/pdf/2309.16638,EOB,nr_calibration_eobnr_seobnr_teobresums;spin_precession;eccentric_hyperbolic_scattering;data_analysis_lvkc,nr_calibration_eobnr_seobnr_teobresums,candidate; needs human triage,candidate,X,no,preserved from data/eob_arxiv_candidates.csv; match_terms=EOB;TEOBResumS,EOB;TEOBResumS
2310.04552,Effective-One-Body Numerical-Relativity waveform model for Eccentric spin-precessing binary black hole coalescence,Xiaolin Liu; Zhoujian Cao; Zong-Hong Zhu,2023,2023-10-06,,gr-qc,gr-qc,,https://arxiv.org/abs/2310.04552,https://arxiv.org/pdf/2310.04552,EOB,nr_calibration_eobnr_seobnr_teobresums;spin_precession;eccentric_hyperbolic_scattering;data_analysis_lvkc,nr_calibration_eobnr_seobnr_teobresums,candidate; needs human triage,candidate,X,no,preserved from data/eob_arxiv_candidates.csv; match_terms=effective-one-body;EOB;SEOBNR,effective-one-body;EOB;SEOBNR
2310.13578,Effective-one-body waveforms for extreme-mass-ratio binaries: Consistency with second-order gravitational self-force quasicircular results and extension to nonprecessing spins and eccentricity,Angelica Albertini; Rossella Gamba; Alessandro Nagar; Sebastiano Bernuzzi,2023,2023-10-20,,gr-qc,gr-qc,,https://arxiv.org/abs/2310.13578,https://arxiv.org/pdf/2310.13578,EOB,foundations_hamiltonian_pn_pm;resummation_flux_waveform;nr_calibration_eobnr_seobnr_teobresums;gsf_gauge_invariants;spin_precession;eccentric_hyperbolic_scattering;emri_test_mass_teukolsky,foundations_hamiltonian_pn_pm,candidate; needs human triage,candidate,X,no,preserved from data/eob_arxiv_candidates.csv; match_terms=effective-one-body;EOB;TEOBResumS,effective-one-body;EOB;TEOBResumS
2311.11311,Actively Learning Numerical Relativity,Tomas Andrade; Rossella Gamba; Juan Trenado,2023,2023-11-19,,gr-qc,gr-qc;hep-th,,https://arxiv.org/abs/2311.11311,https://arxiv.org/pdf/2311.11311,EOB,nr_calibration_eobnr_seobnr_teobresums;data_analysis_lvkc,nr_calibration_eobnr_seobnr_teobresums,candidate; needs human triage,candidate,X,no,preserved from data/eob_arxiv_candidates.csv; match_terms=TEOBResumS,TEOBResumS
2311.11764,Microscopic State of BHs and an Exact One Body Method for Binary Dynamics in General Relativity,Ding-fang Zeng,2023,2023-11-20,,gr-qc,gr-qc;hep-th,,https://arxiv.org/abs/2311.11764,https://arxiv.org/pdf/2311.11764,EOB,foundations_hamiltonian_pn_pm;nr_calibration_eobnr_seobnr_teobresums,foundations_hamiltonian_pn_pm,candidate; needs human triage,candidate,X,no,preserved from data/eob_arxiv_candidates.csv; match_terms=effective-one-body,effective-one-body
2312.01478,"Double copy, Kerr-Schild gauges and the Effective-One-Body formalism",Anna Ceresole; Thibault Damour; Alessandro Nagar; Piero Rettegno,2023,2023-12-03,,gr-qc,gr-qc;hep-th,,https://arxiv.org/abs/2312.01478,https://arxiv.org/pdf/2312.01478,EOB,foundations_hamiltonian_pn_pm;eccentric_hyperbolic_scattering,foundations_hamiltonian_pn_pm,candidate; needs human triage,candidate,X,no,preserved from data/eob_arxiv_candidates.csv; match_terms=effective-one-body,effective-one-body
2401.12290,Gravitational spin-orbit coupling through the third-subleading post-Newtonian order: exploring spin-gauge flexibility,Andrea Placidi; Piero Rettegno; Alessandro Nagar,2024,2024-01-22,,gr-qc,gr-qc,,https://arxiv.org/abs/2401.12290,https://arxiv.org/pdf/2401.12290,EOB,foundations_hamiltonian_pn_pm;resummation_flux_waveform;gsf_gauge_invariants;spin_precession,foundations_hamiltonian_pn_pm,candidate; needs human triage,candidate,X,no,preserved from data/eob_arxiv_candidates.csv; match_terms=effective-one-body;EOB,effective-one-body;EOB
2402.06781,A Survey of Four Precessing Waveform Models for Binary Black Hole Systems,Jake Mac Uilliam; Sarp Akcay; Jonathan E. Thompson,2024,2024-02-09,,gr-qc,gr-qc;astro-ph.IM,,https://arxiv.org/abs/2402.06781,https://arxiv.org/pdf/2402.06781,EOB,foundations_hamiltonian_pn_pm;nr_calibration_eobnr_seobnr_teobresums;spin_precession;data_analysis_lvkc,foundations_hamiltonian_pn_pm,candidate; needs human triage,candidate,X,no,preserved from data/eob_arxiv_candidates.csv; match_terms=SEOBNR;TEOBResumS,SEOBNR;TEOBResumS
2402.08039,Parameter Estimation for Low-Mass Eccentric Black Hole Binaries,Katelyn J. Wagner; Richard O'Shaughnessy,2024,2024-02-12,,gr-qc,gr-qc;astro-ph.IM,,https://arxiv.org/abs/2402.08039,https://arxiv.org/pdf/2402.08039,EOB,nr_calibration_eobnr_seobnr_teobresums;spin_precession;eccentric_hyperbolic_scattering;data_analysis_lvkc,nr_calibration_eobnr_seobnr_teobresums,candidate; needs human triage,candidate,X,no,preserved from data/eob_arxiv_candidates.csv; match_terms=TEOBResumS,TEOBResumS
2402.08883,Analytical model of precessing binaries using post-Newtonian theory in the extreme mass-ratio limit I: General Formalism,Nicholas Loutrel; Sajal Mukherjee; Andrea Maselli; Paolo Pani,2024,2024-02-14,,gr-qc,gr-qc,,https://arxiv.org/abs/2402.08883,https://arxiv.org/pdf/2402.08883,EOB,foundations_hamiltonian_pn_pm;nr_calibration_eobnr_seobnr_teobresums;gsf_gauge_invariants;spin_precession;emri_test_mass_teukolsky,foundations_hamiltonian_pn_pm,candidate; needs human triage,candidate,X,no,preserved from data/eob_arxiv_candidates.csv; match_terms=effective-one-body,effective-one-body
2402.12342,Post-Minkowskian Theory Meets the Spinning Effective-One-Body Approach for Two-Body Scattering,Alessandra Buonanno; Gustav Uhre Jakobsen; Gustav Mogull,2024,2024-02-19,,gr-qc,gr-qc;hep-th,,https://arxiv.org/abs/2402.12342,https://arxiv.org/pdf/2402.12342,EOB,foundations_hamiltonian_pn_pm;resummation_flux_waveform;nr_calibration_eobnr_seobnr_teobresums;gsf_gauge_invariants;spin_precession;eccentric_hyperbolic_scattering;emri_test_mass_teukolsky;data_analysis_lvkc,foundations_hamiltonian_pn_pm,candidate; needs human triage,candidate,X,no,preserved from data/eob_arxiv_candidates.csv; match_terms=effective-one-body;EOB,effective-one-body;EOB
2402.19397,Testing gravitational waveforms in full General Relativity,Fabio D'Ambrosio; Francesco Gozzini; Lavinia Heisenberg; Henri Inchauspé; David Maibach; Jann Zosso,2024,2024-02-29,,gr-qc,gr-qc;astro-ph.CO;hep-ph;hep-th,,https://arxiv.org/abs/2402.19397,https://arxiv.org/pdf/2402.19397,EOB,nr_calibration_eobnr_seobnr_teobresums;spin_precession,nr_calibration_eobnr_seobnr_teobresums,candidate; needs human triage,candidate,X,no,preserved from data/eob_arxiv_candidates.csv; match_terms=EOB,EOB
2403.09211,Energy flux and waveforms by coalescing spinless binary system in effective one-body theory,Sheng Long; Weike Deng; Jiliang Jing,2024,2024-03-14,,gr-qc,gr-qc;hep-th,,https://arxiv.org/abs/2403.09211,https://arxiv.org/pdf/2403.09211,EOB,foundations_hamiltonian_pn_pm;resummation_flux_waveform;nr_calibration_eobnr_seobnr_teobresums;gsf_gauge_invariants;spin_precession,foundations_hamiltonian_pn_pm,candidate; needs human triage,candidate,X,no,preserved from data/eob_arxiv_candidates.csv; match_terms=effective-one-body,effective-one-body
2404.05288,"Effective-one-body waveform model for non-circularized, planar, coalescing black hole binaries: the importance of radiation reaction",Alessandro Nagar; Rossella Gamba; Piero Rettegno; Veronica Fantini; Sebastiano Bernuzzi,2024,2024-04-08,,gr-qc,gr-qc,,https://arxiv.org/abs/2404.05288,https://arxiv.org/pdf/2404.05288,EOB,foundations_hamiltonian_pn_pm;resummation_flux_waveform;nr_calibration_eobnr_seobnr_teobresums;spin_precession;eccentric_hyperbolic_scattering;data_analysis_lvkc,foundations_hamiltonian_pn_pm,candidate; needs human triage,candidate,X,no,preserved from data/eob_arxiv_candidates.csv; match_terms=effective-one-body;EOB;EOBNR;TEOBResumS,effective-one-body;EOB;EOBNR;TEOBResumS
2404.15408,"Towards efficient Effective One Body models for generic, non-planar orbits",Rossella Gamba; Danilo Chiaramello; Sayan Neogi,2024,2024-04-23,,gr-qc,gr-qc,,https://arxiv.org/abs/2404.15408,https://arxiv.org/pdf/2404.15408,EOB,foundations_hamiltonian_pn_pm;nr_calibration_eobnr_seobnr_teobresums;spin_precession;eccentric_hyperbolic_scattering,foundations_hamiltonian_pn_pm,candidate; needs human triage,candidate,X,no,preserved from data/eob_arxiv_candidates.csv; match_terms=effective-one-body;EOB,effective-one-body;EOB
2404.16599,Waveform systematics in gravitational-wave inference of signals from binary neutron star merger models incorporating higher order modes information,A. B. Yelikar; R. O' Shaughnessy; J. Lange; A. Z. Jan,2024,2024-04-25,,gr-qc,gr-qc,,https://arxiv.org/abs/2404.16599,https://arxiv.org/pdf/2404.16599,EOB,nr_calibration_eobnr_seobnr_teobresums;tides_neutron_stars;data_analysis_lvkc,nr_calibration_eobnr_seobnr_teobresums,candidate; needs human triage,candidate,X,no,preserved from data/eob_arxiv_candidates.csv; match_terms=TEOBResumS,TEOBResumS
2404.18875,Mapping eccentricity evolutions between numerical relativity and effective-one-body gravitational waveforms,Alice Bonino; Patricia Schmidt; Geraint Pratten,2024,2024-04-29,,gr-qc,gr-qc,,https://arxiv.org/abs/2404.18875,https://arxiv.org/pdf/2404.18875,EOB,foundations_hamiltonian_pn_pm;nr_calibration_eobnr_seobnr_teobresums;spin_precession;eccentric_hyperbolic_scattering,foundations_hamiltonian_pn_pm,candidate; needs human triage,candidate,X,no,preserved from data/eob_arxiv_candidates.csv; match_terms=effective-one-body,effective-one-body
2405.00170,Self-force framework for transition-to-plunge waveforms,Lorenzo Küchler; Geoffrey Compère; Leanne Durkan; Adam Pound,2024,2024-04-30,,gr-qc,gr-qc,,https://arxiv.org/abs/2405.00170,https://arxiv.org/pdf/2405.00170,EOB,nr_calibration_eobnr_seobnr_teobresums;gsf_gauge_invariants;spin_precession;data_analysis_lvkc,nr_calibration_eobnr_seobnr_teobresums,candidate; needs human triage,candidate,X,no,preserved from data/eob_arxiv_candidates.csv; match_terms=effective-one-body,effective-one-body
2405.01991,Gaussian orbital perturbation theory in Schwarzschild space-time in terms of elliptic functions,Oleksii Yanchyshen; Claus Lämmerzahl,2024,2024-05-03,,gr-qc,gr-qc,,https://arxiv.org/abs/2405.01991,https://arxiv.org/pdf/2405.01991,EOB,foundations_hamiltonian_pn_pm;gsf_gauge_invariants,foundations_hamiltonian_pn_pm,candidate; needs human triage,candidate,X,no,preserved from data/eob_arxiv_candidates.csv; match_terms=effective-one-body,effective-one-body
2405.15087,"Comparing eccentric waveform models based on post-Newtonian and effective-one-body approaches, over an observationally relevant parameter space",Balázs Kacskovics; Dániel Barta,2024,2024-05-23,,gr-qc,gr-qc,,https://arxiv.org/abs/2405.15087,https://arxiv.org/pdf/2405.15087,EOB,foundations_hamiltonian_pn_pm;nr_calibration_eobnr_seobnr_teobresums;spin_precession;eccentric_hyperbolic_scattering,foundations_hamiltonian_pn_pm,candidate; needs human triage,candidate,X,no,preserved from data/eob_arxiv_candidates.csv; match_terms=effective-one-body;SEOBNR,effective-one-body;SEOBNR
2405.16423,Energy flux and waveform of gravitational wave generated by coalescing slow-spinning binary system in effective one-body theory,Weike Deng; Sheng Long; Jiliang Jing,2024,2024-05-26,,gr-qc,gr-qc,,https://arxiv.org/abs/2405.16423,https://arxiv.org/pdf/2405.16423,EOB,resummation_flux_waveform;spin_precession;data_analysis_lvkc,resummation_flux_waveform,candidate; needs human triage,candidate,X,no,preserved from data/eob_arxiv_candidates.csv; match_terms=effective-one-body,effective-one-body
2405.19006,Testing eccentric corrections to the radiation-reaction force in the test-mass limit of effective-one-body models,Guglielmo Faggioli; Maarten van de Meent; Alessandra Buonanno; Aldo Gamboa; Mohammed Khalil; Gaurav Khanna,2024,2024-05-29,,gr-qc,gr-qc,,https://arxiv.org/abs/2405.19006,https://arxiv.org/pdf/2405.19006,EOB,foundations_hamiltonian_pn_pm;resummation_flux_waveform;spin_precession;eccentric_hyperbolic_scattering;emri_test_mass_teukolsky,foundations_hamiltonian_pn_pm,candidate; needs human triage,candidate,X,no,preserved from data/eob_arxiv_candidates.csv; match_terms=effective-one-body,effective-one-body
2405.19181,Post-Minkowskian Theory Meets the Spinning Effective-One-Body Approach for Bound-Orbit Waveforms,Alessandra Buonanno; Gustav Mogull; Raj Patil; Lorenzo Pompili,2024,2024-05-29,,gr-qc,gr-qc;hep-th,,https://arxiv.org/abs/2405.19181,https://arxiv.org/pdf/2405.19181,EOB,foundations_hamiltonian_pn_pm;nr_calibration_eobnr_seobnr_teobresums;spin_precession;eccentric_hyperbolic_scattering;data_analysis_lvkc,foundations_hamiltonian_pn_pm,candidate; needs human triage,candidate,X,no,preserved from data/eob_arxiv_candidates.csv; match_terms=effective-one-body;EOB;SEOBNR,effective-one-body;EOB;SEOBNR
2405.20398,Scattering and dynamical capture of two black holes: synergies between numerical and analytical methods,Simone Albanesi; Alireza Rashti; Francesco Zappa; Rossella Gamba; William Cook; Boris Daszuta; Sebastiano Bernuzzi; Alessandro Nagar; David Radice,2024,2024-05-30,,gr-qc,gr-qc,,https://arxiv.org/abs/2405.20398,https://arxiv.org/pdf/2405.20398,EOB,foundations_hamiltonian_pn_pm;nr_calibration_eobnr_seobnr_teobresums;spin_precession;eccentric_hyperbolic_scattering;emri_test_mass_teukolsky;data_analysis_lvkc,foundations_hamiltonian_pn_pm,candidate; needs human triage,candidate,X,no,preserved from data/eob_arxiv_candidates.csv; match_terms=effective-one-body;EOB;TEOBResumS,effective-one-body;EOB;TEOBResumS
2406.04108,"Comparing second-order gravitational self-force and effective-one-body waveforms from inspiralling, quasi-circular black hole binaries with a non-spinning primary and a spinning secondary",Angelica Albertini; Alessandro Nagar; Josh Mathews; Georgios Lukes-Gerakopoulos,2024,2024-06-06,,gr-qc,gr-qc,,https://arxiv.org/abs/2406.04108,https://arxiv.org/pdf/2406.04108,EOB,nr_calibration_eobnr_seobnr_teobresums;gsf_gauge_invariants;spin_precession;eccentric_hyperbolic_scattering;emri_test_mass_teukolsky,nr_calibration_eobnr_seobnr_teobresums,candidate; needs human triage,candidate,X,no,preserved from data/eob_arxiv_candidates.csv; match_terms=effective-one-body;EOB;TEOBResumS,effective-one-body;EOB;TEOBResumS
2406.04878,Fourth Post-Minkowskian Local-in-Time Conservative Dynamics of Binary Systems,Donato Bini; Thibault Damour,2024,2024-06-07,,gr-qc,gr-qc;hep-th,,https://arxiv.org/abs/2406.04878,https://arxiv.org/pdf/2406.04878,EOB,foundations_hamiltonian_pn_pm;gsf_gauge_invariants;eccentric_hyperbolic_scattering,foundations_hamiltonian_pn_pm,candidate; needs human triage,candidate,X,no,preserved from data/eob_arxiv_candidates.csv; match_terms=effective-one-body,effective-one-body
2406.13654,Inspiral-merger-ringdown waveforms in Einstein-scalar-Gauss-Bonnet gravity within the effective-one-body formalism,Félix-Louis Julié; Lorenzo Pompili; Alessandra Buonanno,2024,2024-06-19,,gr-qc,gr-qc,,https://arxiv.org/abs/2406.13654,https://arxiv.org/pdf/2406.13654,EOB,foundations_hamiltonian_pn_pm;resummation_flux_waveform;nr_calibration_eobnr_seobnr_teobresums;spin_precession;data_analysis_lvkc,foundations_hamiltonian_pn_pm,candidate; needs human triage,candidate,X,no,preserved from data/eob_arxiv_candidates.csv; match_terms=effective-one-body;EOB;SEOBNR,effective-one-body;EOB;SEOBNR
2406.13737,The Born regime of gravitational amplitudes,Miguel Correia; Giulia Isabella,2024,2024-06-19,,hep-th,hep-th;gr-qc;hep-ph,,https://arxiv.org/abs/2406.13737,https://arxiv.org/pdf/2406.13737,EOB,nr_calibration_eobnr_seobnr_teobresums;spin_precession;eccentric_hyperbolic_scattering;emri_test_mass_teukolsky,nr_calibration_eobnr_seobnr_teobresums,candidate; needs human triage,candidate,X,no,preserved from data/eob_arxiv_candidates.csv; match_terms=effective-one-body;EOB,effective-one-body;EOB
2407.04762,"Effective-one-body waveform model for noncircularized, planar, coalescing black hole binaries II:high accuracy by improving logarithmic terms in resummations",Alessandro Nagar; Danilo Chiaramello; Rossella Gamba; Simone Albanesi; Sebastiano Bernuzzi; Veronica Fantini; Mattia Panzeri; Piero Rettegno,2024,2024-07-05,,gr-qc,gr-qc;astro-ph.HE,,https://arxiv.org/abs/2407.04762,https://arxiv.org/pdf/2407.04762,EOB,resummation_flux_waveform;nr_calibration_eobnr_seobnr_teobresums;spin_precession;eccentric_hyperbolic_scattering;data_analysis_lvkc,resummation_flux_waveform,candidate; needs human triage,candidate,X,no,preserved from data/eob_arxiv_candidates.csv; match_terms=effective-one-body;EOB;EOBNR;TEOBResumS,effective-one-body;EOB;EOBNR;TEOBResumS
2407.08538,Phenomenological model of gravitational self-force enhanced tides in inspiralling binary neutron stars,Natalie Williams; Patricia Schmidt; Geraint Pratten,2024,2024-07-11,,gr-qc,gr-qc;astro-ph.HE,,https://arxiv.org/abs/2407.08538,https://arxiv.org/pdf/2407.08538,EOB,nr_calibration_eobnr_seobnr_teobresums;gsf_gauge_invariants;tides_neutron_stars;eccentric_hyperbolic_scattering,nr_calibration_eobnr_seobnr_teobresums,candidate; needs human triage,candidate,X,no,preserved from data/eob_arxiv_candidates.csv; match_terms=effective-one-body;TEOBResumS,effective-one-body;TEOBResumS
2408.13917,A Mass-Shell Model of Compact Binary Coalescence,Noah M. MacKay,2024,2024-08-25,,gr-qc,gr-qc;hep-th,,https://arxiv.org/abs/2408.13917,https://arxiv.org/pdf/2408.13917,EOB,nr_calibration_eobnr_seobnr_teobresums;spin_precession;data_analysis_lvkc,nr_calibration_eobnr_seobnr_teobresums,candidate; needs human triage,candidate,X,no,preserved from data/eob_arxiv_candidates.csv; match_terms=effective-one-body,effective-one-body
2408.15322,"Spin the black circle: horizon absorption on non-circular, planar binary black hole dynamics",Danilo Chiaramello; Rossella Gamba,2024,2024-08-27,,gr-qc,gr-qc,,https://arxiv.org/abs/2408.15322,https://arxiv.org/pdf/2408.15322,EOB,resummation_flux_waveform;nr_calibration_eobnr_seobnr_teobresums;spin_precession;tides_neutron_stars;eccentric_hyperbolic_scattering,resummation_flux_waveform,candidate; needs human triage,candidate,X,no,preserved from data/eob_arxiv_candidates.csv; match_terms=effective-one-body;TEOBResumS,effective-one-body;TEOBResumS
2409.10672,Improved inspiral-merger-ringdown model for BBHs on elliptical orbits,Pratul Manna; Tamal RoyChowdhury; Chandra Kant Mishra,2024,2024-09-16,,gr-qc,gr-qc;astro-ph.HE,,https://arxiv.org/abs/2409.10672,https://arxiv.org/pdf/2409.10672,EOB,resummation_flux_waveform;nr_calibration_eobnr_seobnr_teobresums;spin_precession;eccentric_hyperbolic_scattering;data_analysis_lvkc,resummation_flux_waveform,candidate; needs human triage,candidate,X,no,preserved from data/eob_arxiv_candidates.csv; match_terms=TEOBResumS,TEOBResumS
