arxiv_id,title,authors,year,published,updated,primary_category,categories,abstract,url,pdf_url,topic,technical_tags,technical_role,relevance,status,ai_rating,human_checked,notes,match_terms
1311.2565,Stability of nonspinning effective-one-body model in approximating two-body dynamics and gravitational-wave emission,Yi Pan; Alessandra Buonanno; Andrea Taracchini; Michael Boyle; Lawrence E. Kidder; Abdul H. Mroue; Harald P. Pfeiffer; Mark A. Scheel; Bela Szilagyi; Anil Zenginoglu,2013,2013-11-11,,gr-qc,gr-qc,,https://arxiv.org/abs/1311.2565,https://arxiv.org/pdf/1311.2565,EOB,foundations_hamiltonian_pn_pm;nr_calibration_eobnr_seobnr_teobresums;spin_precession;data_analysis_lvkc,foundations_hamiltonian_pn_pm,candidate; needs human triage,candidate,X,no,preserved from data/eob_arxiv_candidates.csv; match_terms=effective-one-body;EOB,effective-one-body;EOB
1312.2503,High-order post-Newtonian contributions to the two-body gravitational interaction potential from analytical gravitational self-force calculations,Donato Bini; Thibault Damour,2013,2013-12-09,,gr-qc,gr-qc,,https://arxiv.org/abs/1312.2503,https://arxiv.org/pdf/1312.2503,EOB,foundations_hamiltonian_pn_pm;nr_calibration_eobnr_seobnr_teobresums;gsf_gauge_invariants,foundations_hamiltonian_pn_pm,candidate; needs human triage,candidate,X,no,preserved from data/eob_arxiv_candidates.csv; match_terms=effective-one-body,effective-one-body
1312.3505,The general relativistic two body problem,Thibault Damour,2013,2013-12-12,,gr-qc,gr-qc,,https://arxiv.org/abs/1312.3505,https://arxiv.org/pdf/1312.3505,EOB,foundations_hamiltonian_pn_pm;nr_calibration_eobnr_seobnr_teobresums;gsf_gauge_invariants;tides_neutron_stars;data_analysis_lvkc,foundations_hamiltonian_pn_pm,candidate; needs human triage,candidate,X,no,preserved from data/eob_arxiv_candidates.csv; match_terms=effective-one-body;EOB,effective-one-body;EOB
1401.7038,A sparse representation of gravitational waves from precessing compact binaries,Jonathan Blackman; Bela Szilagyi; Chad R. Galley; Manuel Tiglio,2014,2014-01-27,,gr-qc,gr-qc,,https://arxiv.org/abs/1401.7038,https://arxiv.org/pdf/1401.7038,EOB,nr_calibration_eobnr_seobnr_teobresums;spin_precession,nr_calibration_eobnr_seobnr_teobresums,candidate; needs human triage,candidate,X,no,preserved from data/eob_arxiv_candidates.csv; match_terms=effective-one-body,effective-one-body
1402.4146,Frequency domain reduced order models for gravitational waves from aligned-spin compact binaries,Michael Pürrer,2014,2014-02-17,,gr-qc,gr-qc,,https://arxiv.org/abs/1402.4146,https://arxiv.org/pdf/1402.4146,EOB,nr_calibration_eobnr_seobnr_teobresums;spin_precession;data_analysis_lvkc,nr_calibration_eobnr_seobnr_teobresums,candidate; needs human triage,candidate,X,no,preserved from data/eob_arxiv_candidates.csv; match_terms=effective-one-body;EOB;SEOBNR,effective-one-body;EOB;SEOBNR
1402.6244,Quasiuniversal properties of neutron star mergers,Sebastiano Bernuzzi; Alessandro Nagar; Simone Balmelli; Tim Dietrich; Maximiliano Ujevic,2014,2014-02-25,,gr-qc,gr-qc;astro-ph.HE,,https://arxiv.org/abs/1402.6244,https://arxiv.org/pdf/1402.6244,EOB,nr_calibration_eobnr_seobnr_teobresums;spin_precession;tides_neutron_stars,nr_calibration_eobnr_seobnr_teobresums,candidate; needs human triage,candidate,X,no,preserved from data/eob_arxiv_candidates.csv; match_terms=effective-one-body;EOB,effective-one-body;EOB
1402.7307,Strong-Field Scattering of Two Black Holes: Numerics Versus Analytics,Thibault Damour; Federico Guercilena; Ian Hinder; Seth Hopper; Alessandro Nagar; Luciano Rezzolla,2014,2014-02-28,,gr-qc,gr-qc,,https://arxiv.org/abs/1402.7307,https://arxiv.org/pdf/1402.7307,EOB,foundations_hamiltonian_pn_pm;nr_calibration_eobnr_seobnr_teobresums;eccentric_hyperbolic_scattering,foundations_hamiltonian_pn_pm,candidate; needs human triage,candidate,X,no,preserved from data/eob_arxiv_candidates.csv; match_terms=effective-one-body,effective-one-body
1403.0561,Self-forced evolutions of an implicit rotating source: A natural framework to model comparable and intermediate mass-ratio systems from inspiral through ringdown,E. A. Huerta; Prayush Kumar; Jonathan R. Gair; Sean T. McWilliams,2014,2014-03-03,,gr-qc,gr-qc,,https://arxiv.org/abs/1403.0561,https://arxiv.org/pdf/1403.0561,EOB,foundations_hamiltonian_pn_pm;resummation_flux_waveform;nr_calibration_eobnr_seobnr_teobresums;gsf_gauge_invariants;tides_neutron_stars;emri_test_mass_teukolsky,foundations_hamiltonian_pn_pm,candidate; needs human triage,candidate,X,no,preserved from data/eob_arxiv_candidates.csv; match_terms=effective-one-body,effective-one-body
1403.2366,Analytic determination of the eight-and-a-half post-Newtonian self-force contributions to the two-body gravitational interaction potential,Donato Bini; Thibault Damour,2014,2014-03-10,,gr-qc,gr-qc,,https://arxiv.org/abs/1403.2366,https://arxiv.org/pdf/1403.2366,EOB,foundations_hamiltonian_pn_pm;gsf_gauge_invariants,foundations_hamiltonian_pn_pm,candidate; needs human triage,candidate,X,no,preserved from data/eob_arxiv_candidates.csv; match_terms=effective-one-body,effective-one-body
1404.1543,A conservative effect of the second-order gravitational self-force on quasicircular orbits in Schwarzschild spacetime,Adam Pound,2014,2014-04-06,,gr-qc,gr-qc;astro-ph.HE,,https://arxiv.org/abs/1404.1543,https://arxiv.org/pdf/1404.1543,EOB,foundations_hamiltonian_pn_pm;gsf_gauge_invariants,foundations_hamiltonian_pn_pm,candidate; needs human triage,candidate,X,no,preserved from data/eob_arxiv_candidates.csv; match_terms=effective-one-body,effective-one-body
1404.1819,Small mass plunging into a Kerr black hole: Anatomy of the inspiral-merger-ringdown waveforms,Andrea Taracchini; Alessandra Buonanno; Gaurav Khanna; Scott A. Hughes,2014,2014-04-07,,gr-qc,gr-qc,,https://arxiv.org/abs/1404.1819,https://arxiv.org/pdf/1404.1819,EOB,resummation_flux_waveform;spin_precession;emri_test_mass_teukolsky,resummation_flux_waveform,candidate; needs human triage,candidate,X,no,preserved from data/eob_arxiv_candidates.csv; match_terms=effective-one-body,effective-one-body
1404.2747,Two-body gravitational spin-orbit interaction at linear order in the mass ratio,Donato Bini; Thibault Damour,2014,2014-04-10,,gr-qc,gr-qc,,https://arxiv.org/abs/1404.2747,https://arxiv.org/pdf/1404.2747,EOB,foundations_hamiltonian_pn_pm;gsf_gauge_invariants;spin_precession;eccentric_hyperbolic_scattering,foundations_hamiltonian_pn_pm,candidate; needs human triage,candidate,X,no,preserved from data/eob_arxiv_candidates.csv; match_terms=effective-one-body,effective-one-body
1404.6133,Gravitational Self-Force Correction to the Innermost Stable Circular Equatorial Orbit of a Kerr Black Hole,Soichiro Isoyama; Leor Barack; Sam R. Dolan; Alexandre Le Tiec; Hiroyuki Nakano; Abhay G. Shah; Takahiro Tanaka; Niels Warburton,2014,2014-04-24,,gr-qc,gr-qc;astro-ph.HE,,https://arxiv.org/abs/1404.6133,https://arxiv.org/pdf/1404.6133,EOB,foundations_hamiltonian_pn_pm;gsf_gauge_invariants;spin_precession,foundations_hamiltonian_pn_pm,candidate; needs human triage,candidate,X,no,preserved from data/eob_arxiv_candidates.csv; match_terms=effective-one-body,effective-one-body
1406.0401,A new analytic representation of the ringdown waveform of coalescing spinning black hole binaries,Thibault Damour; Alessandro Nagar,2014,2014-06-02,,gr-qc,gr-qc,,https://arxiv.org/abs/1406.0401,https://arxiv.org/pdf/1406.0401,EOB,resummation_flux_waveform;spin_precession,resummation_flux_waveform,candidate; needs human triage,candidate,X,no,preserved from data/eob_arxiv_candidates.csv; match_terms=effective-one-body,effective-one-body
1406.4890,Tidal invariants for compact binaries on quasi-circular orbits,Sam R. Dolan; Patrick Nolan; Adrian C. Ottewill; Niels Warburton; Barry Wardell,2014,2014-06-18,,gr-qc,gr-qc,,https://arxiv.org/abs/1406.4890,https://arxiv.org/pdf/1406.4890,EOB,foundations_hamiltonian_pn_pm;nr_calibration_eobnr_seobnr_teobresums;gsf_gauge_invariants;tides_neutron_stars;data_analysis_lvkc,foundations_hamiltonian_pn_pm,candidate; needs human triage,candidate,X,no,preserved from data/eob_arxiv_candidates.csv; match_terms=effective-one-body,effective-one-body
1406.5983,A new gravitational wave generation algorithm for particle perturbations of the Kerr spacetime,Enno Harms; Sebastiano Bernuzzi; Alessandro Nagar; Anil Zenginoglu,2014,2014-06-23,,gr-qc,gr-qc,,https://arxiv.org/abs/1406.5983,https://arxiv.org/pdf/1406.5983,EOB,foundations_hamiltonian_pn_pm;resummation_flux_waveform;nr_calibration_eobnr_seobnr_teobresums;spin_precession;emri_test_mass_teukolsky,foundations_hamiltonian_pn_pm,candidate; needs human triage,candidate,X,no,preserved from data/eob_arxiv_candidates.csv; match_terms=effective-one-body,effective-one-body
1406.6913,A new effective-one-body description of coalescing nonprecessing spinning black-hole binaries,Thibault Damour; Alessandro Nagar,2014,2014-06-26,,gr-qc,gr-qc,,https://arxiv.org/abs/1406.6913,https://arxiv.org/pdf/1406.6913,EOB,foundations_hamiltonian_pn_pm;nr_calibration_eobnr_seobnr_teobresums;gsf_gauge_invariants;spin_precession,foundations_hamiltonian_pn_pm,candidate; needs human triage,candidate,X,no,preserved from data/eob_arxiv_candidates.csv; match_terms=effective-one-body;EOB,effective-one-body;EOB
1407.5033,The antikick strikes back: recoil velocities for nearly-extremal binary black hole mergers in the test-mass limit,Alessandro Nagar; Enno Harms; Sebastiano Bernuzzi; Anıl Zenginoğlu,2014,2014-07-18,,gr-qc,gr-qc,,https://arxiv.org/abs/1407.5033,https://arxiv.org/pdf/1407.5033,EOB,resummation_flux_waveform;nr_calibration_eobnr_seobnr_teobresums;spin_precession;eccentric_hyperbolic_scattering;emri_test_mass_teukolsky,resummation_flux_waveform,candidate; needs human triage,candidate,X,no,preserved from data/eob_arxiv_candidates.csv; match_terms=effective-one-body,effective-one-body
1408.5505,"The Overlap of Numerical Relativity, Perturbation Theory and Post-Newtonian Theory in the Binary Black Hole Problem",Alexandre Le Tiec,2014,2014-08-23,,gr-qc,gr-qc,,https://arxiv.org/abs/1408.5505,https://arxiv.org/pdf/1408.5505,EOB,foundations_hamiltonian_pn_pm;nr_calibration_eobnr_seobnr_teobresums;emri_test_mass_teukolsky,foundations_hamiltonian_pn_pm,candidate; needs human triage,candidate,X,no,preserved from data/eob_arxiv_candidates.csv; match_terms=effective-one-body,effective-one-body
1409.2349,Gravitational-wave observations of binary black holes: Effect of non-quadrupole modes,Vijay Varma; Parameswaran Ajith; Sascha Husa; Juan Calderon Bustillo; Mark Hannam; Michael Puerrer,2014,2014-09-08,,gr-qc,gr-qc,,https://arxiv.org/abs/1409.2349,https://arxiv.org/pdf/1409.2349,EOB,foundations_hamiltonian_pn_pm;nr_calibration_eobnr_seobnr_teobresums;spin_precession;data_analysis_lvkc,foundations_hamiltonian_pn_pm,candidate; needs human triage,candidate,X,no,preserved from data/eob_arxiv_candidates.csv; match_terms=effective-one-body,effective-one-body
1409.6933,Gravitational self-force corrections to two-body tidal interactions and the effective one-body formalism,Donato Bini; Thibault Damour,2014,2014-09-24,,gr-qc,gr-qc,,https://arxiv.org/abs/1409.6933,https://arxiv.org/pdf/1409.6933,EOB,foundations_hamiltonian_pn_pm;gsf_gauge_invariants;tides_neutron_stars;emri_test_mass_teukolsky;data_analysis_lvkc,foundations_hamiltonian_pn_pm,candidate; needs human triage,candidate,X,no,preserved from data/eob_arxiv_candidates.csv; match_terms=effective-one-body,effective-one-body
1412.1803,Improved methods for simulating nearly extremal binary black holes,Mark A. Scheel; Matthew Giesler; Daniel A. Hemberger; Geoffrey Lovelace; Kevin Kuper; Michael Boyle; Bela Szilagyi; Lawrence E. Kidder,2014,2014-12-04,,gr-qc,gr-qc,,https://arxiv.org/abs/1412.1803,https://arxiv.org/pdf/1412.1803,EOB,foundations_hamiltonian_pn_pm;nr_calibration_eobnr_seobnr_teobresums;spin_precession,foundations_hamiltonian_pn_pm,candidate; needs human triage,candidate,X,no,preserved from data/eob_arxiv_candidates.csv; match_terms=effective-one-body,effective-one-body
1412.4553,Modeling the dynamics of tidally-interacting binary neutron stars up to merger,Sebastiano Bernuzzi; Alessandro Nagar; Tim Dietrich; Thibault Damour,2014,2014-12-15,,gr-qc,gr-qc;astro-ph.CO;astro-ph.HE,,https://arxiv.org/abs/1412.4553,https://arxiv.org/pdf/1412.4553,EOB,foundations_hamiltonian_pn_pm;nr_calibration_eobnr_seobnr_teobresums;gsf_gauge_invariants;tides_neutron_stars;eccentric_hyperbolic_scattering;data_analysis_lvkc,foundations_hamiltonian_pn_pm,candidate; needs human triage,candidate,X,no,preserved from data/eob_arxiv_candidates.csv; match_terms=effective-one-body;EOB,effective-one-body;EOB
1501.04418,"Template-space metric for searches for gravitational waves from the inspiral, merger and ringdown of binary black holes",Chinmay Kalaghatgi; Parameswaran Ajith; K. G. Arun,2015,2015-01-19,,gr-qc,gr-qc;astro-ph.HE,,https://arxiv.org/abs/1501.04418,https://arxiv.org/pdf/1501.04418,EOB,foundations_hamiltonian_pn_pm;nr_calibration_eobnr_seobnr_teobresums;spin_precession;data_analysis_lvkc,foundations_hamiltonian_pn_pm,candidate; needs human triage,candidate,X,no,preserved from data/eob_arxiv_candidates.csv; match_terms=effective-one-body,effective-one-body
1502.01343,Effective-one-body Hamiltonian with next-to-leading order spin-spin coupling,Simone Balmelli; Philippe Jetzer,2015,2015-02-04,,gr-qc,gr-qc,,https://arxiv.org/abs/1502.01343,https://arxiv.org/pdf/1502.01343,EOB,foundations_hamiltonian_pn_pm;spin_precession,foundations_hamiltonian_pn_pm,candidate; needs human triage,candidate,X,no,preserved from data/eob_arxiv_candidates.csv; match_terms=effective-one-body;EOB,effective-one-body;EOB
1502.03457,Exploring tidal effects of coalescing binary neutron stars in numerical relativity II: Longterm simulations,Kenta Hotokezaka; Koutarou Kyutoku; Hirotada Okawa; Masaru Shibata,2015,2015-02-11,,gr-qc,gr-qc;astro-ph.HE,,https://arxiv.org/abs/1502.03457,https://arxiv.org/pdf/1502.03457,EOB,foundations_hamiltonian_pn_pm;nr_calibration_eobnr_seobnr_teobresums;gsf_gauge_invariants;tides_neutron_stars;eccentric_hyperbolic_scattering,foundations_hamiltonian_pn_pm,candidate; needs human triage,candidate,X,no,preserved from data/eob_arxiv_candidates.csv; match_terms=effective-one-body;EOB,effective-one-body;EOB
1502.04953,Numerical relativity reaching into post-Newtonian territory: a compact-object binary simulation spanning 350 gravitational-wave cycles,Bela Szilagyi; Jonathan Blackman; Alessandra Buonanno; Andrea Taracchini; Harald P. Pfeiffer; Mark A. Scheel; Tony Chu; Lawrence E. Kidder; Yi Pan,2015,2015-02-17,,gr-qc,gr-qc,,https://arxiv.org/abs/1502.04953,https://arxiv.org/pdf/1502.04953,EOB,foundations_hamiltonian_pn_pm;nr_calibration_eobnr_seobnr_teobresums;data_analysis_lvkc,foundations_hamiltonian_pn_pm,candidate; needs human triage,candidate,X,no,preserved from data/eob_arxiv_candidates.csv; match_terms=effective-one-body,effective-one-body
1502.07245,Fourth post-Newtonian effective one-body dynamics,Thibault Damour; Piotr Jaranowski; Gerhard Schäfer,2015,2015-02-25,,gr-qc,gr-qc,,https://arxiv.org/abs/1502.07245,https://arxiv.org/pdf/1502.07245,EOB,foundations_hamiltonian_pn_pm;gsf_gauge_invariants;spin_precession,foundations_hamiltonian_pn_pm,candidate; needs human triage,candidate,X,no,preserved from data/eob_arxiv_candidates.csv; match_terms=effective-one-body;EOB,effective-one-body;EOB
1502.07758,Fast and accurate prediction of numerical relativity waveforms from binary black hole coalescences using surrogate models,Jonathan Blackman; Scott E. Field; Chad R. Galley; Bela Szilagyi; Mark A. Scheel; Manuel Tiglio; Daniel A. Hemberger,2015,2015-02-26,,gr-qc,gr-qc;astro-ph.HE;cs.CE;physics.data-an,,https://arxiv.org/abs/1502.07758,https://arxiv.org/pdf/1502.07758,EOB,nr_calibration_eobnr_seobnr_teobresums;spin_precession;data_analysis_lvkc,nr_calibration_eobnr_seobnr_teobresums,candidate; needs human triage,candidate,X,no,preserved from data/eob_arxiv_candidates.csv; match_terms=effective-one-body,effective-one-body
1503.02414,Linear-in-mass-ratio contribution to spin precession and tidal invariants in Schwarzschild spacetime at very high post-Newtonian order,Abhay G. Shah; Adam Pound,2015,2015-03-09,,gr-qc,gr-qc,,https://arxiv.org/abs/1503.02414,https://arxiv.org/pdf/1503.02414,EOB,foundations_hamiltonian_pn_pm;nr_calibration_eobnr_seobnr_teobresums;gsf_gauge_invariants;spin_precession;tides_neutron_stars,foundations_hamiltonian_pn_pm,candidate; needs human triage,candidate,X,no,preserved from data/eob_arxiv_candidates.csv; match_terms=effective-one-body,effective-one-body
1503.04727,Is motion under the conservative self-force in black hole spacetimes an integrable Hamiltonian system?,Justin Vines; Éanna É. Flanagan,2015,2015-03-16,,gr-qc,gr-qc,,https://arxiv.org/abs/1503.04727,https://arxiv.org/pdf/1503.04727,EOB,foundations_hamiltonian_pn_pm;gsf_gauge_invariants;eccentric_hyperbolic_scattering,foundations_hamiltonian_pn_pm,candidate; needs human triage,candidate,X,no,preserved from data/eob_arxiv_candidates.csv; match_terms=effective-one-body,effective-one-body
1503.05953,Measuring intermediate mass black hole binaries with advanced gravitational wave detectors,John Veitch; Michael Pürrer; Ilya Mandel,2015,2015-03-19,,astro-ph.HE,astro-ph.HE;gr-qc,,https://arxiv.org/abs/1503.05953,https://arxiv.org/pdf/1503.05953,EOB,nr_calibration_eobnr_seobnr_teobresums;spin_precession;emri_test_mass_teukolsky;data_analysis_lvkc,nr_calibration_eobnr_seobnr_teobresums,candidate; needs human triage,candidate,X,no,preserved from data/eob_arxiv_candidates.csv; match_terms=effective-one-body;SEOBNR,effective-one-body;SEOBNR
1504.04766,The Missing Link: Bayesian Detection and Measurement of Intermediate-Mass Black-Hole Binaries,Philip B. Graff; Alessandra Buonanno; B. S. Sathyaprakash,2015,2015-04-18,,gr-qc,gr-qc,,https://arxiv.org/abs/1504.04766,https://arxiv.org/pdf/1504.04766,EOB,nr_calibration_eobnr_seobnr_teobresums;spin_precession;data_analysis_lvkc,nr_calibration_eobnr_seobnr_teobresums,candidate; needs human triage,candidate,X,no,preserved from data/eob_arxiv_candidates.csv; match_terms=effective-one-body,effective-one-body
1505.04447,Octupolar invariants for compact binaries on quasi-circular orbits,Patrick Nolan; Chris Kavanagh; Sam R Dolan; Adrian C Ottewill; Niels Warburton; Barry Wardell,2015,2015-05-17,,gr-qc,gr-qc,,https://arxiv.org/abs/1505.04447,https://arxiv.org/pdf/1505.04447,EOB,foundations_hamiltonian_pn_pm;gsf_gauge_invariants;tides_neutron_stars,foundations_hamiltonian_pn_pm,candidate; needs human triage,candidate,X,no,preserved from data/eob_arxiv_candidates.csv; match_terms=effective-one-body,effective-one-body
1506.05648,First Law of Mechanics for Compact Binaries on Eccentric Orbits,Alexandre Le Tiec,2015,2015-06-18,,gr-qc,gr-qc,,https://arxiv.org/abs/1506.05648,https://arxiv.org/pdf/1506.05648,EOB,foundations_hamiltonian_pn_pm;gsf_gauge_invariants;eccentric_hyperbolic_scattering,foundations_hamiltonian_pn_pm,candidate; needs human triage,candidate,X,no,preserved from data/eob_arxiv_candidates.csv; match_terms=effective-one-body,effective-one-body
1506.08457,Energetics and phasing of nonprecessing spinning coalescing black hole binaries,Alessandro Nagar; Thibault Damour; Christian Reisswig; Denis Pollney,2015,2015-06-28,,gr-qc,gr-qc,,https://arxiv.org/abs/1506.08457,https://arxiv.org/pdf/1506.08457,EOB,foundations_hamiltonian_pn_pm;resummation_flux_waveform;nr_calibration_eobnr_seobnr_teobresums;gsf_gauge_invariants;spin_precession;data_analysis_lvkc,foundations_hamiltonian_pn_pm,candidate; needs human triage,candidate,X,no,preserved from data/eob_arxiv_candidates.csv; match_terms=effective-one-body;EOB,effective-one-body;EOB
1507.00103,Accuracy and precision of gravitational-wave models of inspiraling neutron star -- black hole binaries with spin: comparison with numerical relativity in the low-frequency regime,Prayush Kumar; Kevin Barkett; Swetha Bhagwat; Nousha Afshari; Duncan A. Brown; Geoffrey Lovelace; Mark A. Scheel; Béla Szilágyi,2015,2015-07-01,,gr-qc,gr-qc,,https://arxiv.org/abs/1507.00103,https://arxiv.org/pdf/1507.00103,EOB,foundations_hamiltonian_pn_pm;nr_calibration_eobnr_seobnr_teobresums;spin_precession;tides_neutron_stars;data_analysis_lvkc,foundations_hamiltonian_pn_pm,candidate; needs human triage,candidate,X,no,preserved from data/eob_arxiv_candidates.csv; match_terms=effective-one-body;SEOBNR,effective-one-body;SEOBNR
1508.07253,Frequency-domain gravitational waves from non-precessing black-hole binaries. II. A phenomenological model for the advanced detector era,Sebastian Khan; Sascha Husa; Mark Hannam; Frank Ohme; Michael Pürrer; Xisco Jiménez Forteza; Alejandro Bohé,2015,2015-08-28,,gr-qc,gr-qc,,https://arxiv.org/abs/1508.07253,https://arxiv.org/pdf/1508.07253,EOB,foundations_hamiltonian_pn_pm;nr_calibration_eobnr_seobnr_teobresums;spin_precession;data_analysis_lvkc,foundations_hamiltonian_pn_pm,candidate; needs human triage,candidate,X,no,preserved from data/eob_arxiv_candidates.csv; match_terms=effective-one-body;SEOBNR,effective-one-body;SEOBNR
1509.06366,Estimating effective higher order terms in the post-Newtonian binding energy and gravitational-wave flux: Non-spinning compact binary inspiral,Shasvath J. Kapadia; Nathan K. Johnson-McDaniel; Parameswaran Ajith,2015,2015-09-21,,gr-qc,gr-qc,,https://arxiv.org/abs/1509.06366,https://arxiv.org/pdf/1509.06366,EOB,foundations_hamiltonian_pn_pm;resummation_flux_waveform;nr_calibration_eobnr_seobnr_teobresums;spin_precession;data_analysis_lvkc,foundations_hamiltonian_pn_pm,candidate; needs human triage,candidate,X,no,preserved from data/eob_arxiv_candidates.csv; match_terms=effective-one-body;EOBNR,effective-one-body;EOBNR
1509.08135,A new effective-one-body Hamiltonian with next-to-leading order spin-spin coupling,Simone Balmelli; Thibault Damour,2015,2015-09-27,,gr-qc,gr-qc,,https://arxiv.org/abs/1509.08135,https://arxiv.org/pdf/1509.08135,EOB,foundations_hamiltonian_pn_pm;nr_calibration_eobnr_seobnr_teobresums;spin_precession,foundations_hamiltonian_pn_pm,candidate; needs human triage,candidate,X,no,preserved from data/eob_arxiv_candidates.csv; match_terms=effective-one-body;EOB,effective-one-body;EOB
1510.06230,Spin-dependent two-body interactions from gravitational self-force computations,Donato Bini; Thibault Damour; Andrea Geralico,2015,2015-10-21,,gr-qc,gr-qc,,https://arxiv.org/abs/1510.06230,https://arxiv.org/pdf/1510.06230,EOB,foundations_hamiltonian_pn_pm;nr_calibration_eobnr_seobnr_teobresums;gsf_gauge_invariants;spin_precession,foundations_hamiltonian_pn_pm,candidate; needs human triage,candidate,X,no,preserved from data/eob_arxiv_candidates.csv; match_terms=effective-one-body,effective-one-body
1511.04533,Confirming and improving post-Newtonian and effective-one-body results from self-force computations along eccentric orbits around a Schwarzschild black hole,Donato Bini; Thibault Damour; Andrea Geralico,2015,2015-11-14,,gr-qc,gr-qc,,https://arxiv.org/abs/1511.04533,https://arxiv.org/pdf/1511.04533,EOB,foundations_hamiltonian_pn_pm;nr_calibration_eobnr_seobnr_teobresums;gsf_gauge_invariants;eccentric_hyperbolic_scattering,foundations_hamiltonian_pn_pm,candidate; needs human triage,candidate,X,no,preserved from data/eob_arxiv_candidates.csv; match_terms=effective-one-body,effective-one-body
1512.01556,Analytic self-force calculations in the post-Newtonian regime: eccentric orbits on a Schwarzschild background,Seth Hopper; Chris Kavanagh; Adrian C. Ottewill,2015,2015-12-04,,gr-qc,gr-qc,,https://arxiv.org/abs/1512.01556,https://arxiv.org/pdf/1512.01556,EOB,foundations_hamiltonian_pn_pm;gsf_gauge_invariants;eccentric_hyperbolic_scattering,foundations_hamiltonian_pn_pm,candidate; needs human triage,candidate,X,no,preserved from data/eob_arxiv_candidates.csv; match_terms=effective-one-body,effective-one-body
1512.02248,Frequency domain reduced order model of aligned-spin effective-one-body waveforms with generic mass-ratios and spins,Michael Pürrer,2015,2015-12-07,,gr-qc,gr-qc,,https://arxiv.org/abs/1512.02248,https://arxiv.org/pdf/1512.02248,EOB,nr_calibration_eobnr_seobnr_teobresums;gsf_gauge_invariants;spin_precession;data_analysis_lvkc,nr_calibration_eobnr_seobnr_teobresums,candidate; needs human triage,candidate,X,no,preserved from data/eob_arxiv_candidates.csv; match_terms=effective-one-body;EOB;SEOBNR,effective-one-body;EOB;SEOBNR
1512.03392,Numerical computation of the EOB potential q using self-force results,Sarp Akcay; Maarten van de Meent,2015,2015-12-09,,gr-qc,gr-qc,,https://arxiv.org/abs/1512.03392,https://arxiv.org/pdf/1512.03392,EOB,foundations_hamiltonian_pn_pm;nr_calibration_eobnr_seobnr_teobresums;gsf_gauge_invariants;spin_precession;eccentric_hyperbolic_scattering;emri_test_mass_teukolsky,foundations_hamiltonian_pn_pm,candidate; needs human triage,candidate,X,no,preserved from data/eob_arxiv_candidates.csv; match_terms=effective-one-body;EOB,effective-one-body;EOB
1601.01283,Conservative dynamics of two-body systems at the fourth post-Newtonian approximation of general relativity,Thibault Damour; Piotr Jaranowski; Gerhard Schäfer,2016,2016-01-06,,gr-qc,gr-qc;hep-th,,https://arxiv.org/abs/1601.01283,https://arxiv.org/pdf/1601.01283,EOB,foundations_hamiltonian_pn_pm;gsf_gauge_invariants,foundations_hamiltonian_pn_pm,candidate; needs human triage,candidate,X,no,preserved from data/eob_arxiv_candidates.csv; match_terms=effective-one-body,effective-one-body
