name,url,language,main_use,status,installation_difficulty,theory_transparency,modifiable,relation_to_my_work,ai_evaluation,human_check,notes
pySEOBNR,https://git.ligo.org/waveforms/software/pyseobnr,Python,SEOBNRv5 waveform generation and diagnostics,active; verify current branch,medium,medium-high,"yes, but architecture constraints apply",Hamiltonian replacement diagnostics; not full self-consistent waveform replacement,B: highly relevant; must inspect internals,not yet,Verify install and exact API locally.
LALSuite / LALSimulation,https://git.ligo.org/lscsoft/lalsuite,C/Python,Production waveform models used by LVK,active,high,medium,possible but heavy,Reference implementation and validation target,"B: useful reference, high engineering overhead",not yet,Do not patch casually; use as benchmark.
TEOBResumS,https://bitbucket.org/eob_ihes/teobresums,C/Python,Alternative resummed EOB waveform family,active; needs verification,medium,high,yes,Compare resummation choices and tides/generic-orbit modeling,"A/B: very relevant, verify repository status",not yet,URL needs current-status verification.
TEOBResumS-Dali,https://bitbucket.org/eob_ihes/teobresums,C/Python,Generic-orbit EOB modeling,paper-level seed; needs repository mapping,medium,high,yes,Future comparison for eccentric/scattering extensions,B: relevant but needs human check,not yet,Confirm implementation location.
Black Hole Perturbation Toolkit,https://bhptoolkit.org,Mathematica/Python/C++ mix,"BHPT, GSF, Teukolsky and related resources",active portal,medium,high,yes,Possible source of Teukolsky/Sasaki-Nakamura flux tools,B: relevant for flux extension,not yet,Use for BHPT-GSF-EOB bridge.
SXS catalog,https://data.black-holes.org,HDF5/data,NR waveform catalog,active data resource,medium,high,data only,Gauge-invariant diagnostics and waveform comparison,B: useful validation data,not yet,Verify data access path.
