year,published,arxiv_id,title,authors,url,categories,match_terms,technical_tags
1998,1998-11-26,gr-qc/9811091,Effective one-body approach to general relativistic two-body dynamics,A. Buonanno; T. Damour,https://arxiv.org/abs/gr-qc/9811091,gr-qc;astro-ph,effective-one-body,foundations_hamiltonian_pn_pm;nr_calibration_eobnr_seobnr_teobresums
2000,2000-01-07,gr-qc/0001013,Transition from inspiral to plunge in binary black hole coalescences,Alessandra Buonanno; Thibault Damour,https://arxiv.org/abs/gr-qc/0001013,gr-qc,manual_eob_core,foundations_hamiltonian_pn_pm;nr_calibration_eobnr_seobnr_teobresums;data_analysis_lvkc
2000,2000-05-10,gr-qc/0005034,On the determination of the last stable orbit for circular general relativistic binaries at the third post-Newtonian approximation,Thibault Damour; Piotr Jaranowski; Gerhard Schaefer,https://arxiv.org/abs/gr-qc/0005034,gr-qc,effective-one-body,foundations_hamiltonian_pn_pm;resummation_flux_waveform;gsf_gauge_invariants
2000,2000-10-04,gr-qc/0010009,A Comparison of search templates for gravitational waves from binary inspiral,Thibault Damour; Bala R. Iyer; B. S. Sathyaprakash,https://arxiv.org/abs/gr-qc/0010009,gr-qc,effective-one-body,foundations_hamiltonian_pn_pm;resummation_flux_waveform;nr_calibration_eobnr_seobnr_teobresums;data_analysis_lvkc
2000,2000-10-27,gr-qc/0010104,Effective one-body approach to the relativistic two-body problem,P. P. Fiziev; I. T. Todorov,https://arxiv.org/abs/gr-qc/0010104,gr-qc,effective-one-body,foundations_hamiltonian_pn_pm;nr_calibration_eobnr_seobnr_teobresums
2001,2001-03-07,gr-qc/0103018,Coalescence of Two Spinning Black Holes: An Effective One-Body Approach,Thibault Damour,https://arxiv.org/abs/gr-qc/0103018,gr-qc,effective-one-body,foundations_hamiltonian_pn_pm;resummation_flux_waveform;spin_precession;data_analysis_lvkc
2001,2001-12-21,gr-qc/0112056,Innermost circular orbit of binary black holes at the third post-Newtonian approximation,Luc Blanchet,https://arxiv.org/abs/gr-qc/0112056,gr-qc,effective-one-body,foundations_hamiltonian_pn_pm;resummation_flux_waveform;nr_calibration_eobnr_seobnr_teobresums;spin_precession
2002,2002-04-03,gr-qc/0204011,Circular orbits of corotating binary black holes: comparison between analytical and numerical results,T. Damour; E. Gourgoulhon; P. Grandclement,https://arxiv.org/abs/gr-qc/0204011,gr-qc;astro-ph,effective-one-body;EOB,foundations_hamiltonian_pn_pm;resummation_flux_waveform;spin_precession
2002,2002-08-29,gr-qc/0208089,Numerically generated quasi-equilibrium orbits of black holes: Circular or eccentric?,Thierry Mora; Clifford M. Will,https://arxiv.org/abs/gr-qc/0208089,gr-qc,effective-one-body,foundations_hamiltonian_pn_pm;resummation_flux_waveform;nr_calibration_eobnr_seobnr_teobresums;spin_precession;eccentric_hyperbolic_scattering
2002,2002-11-12,gr-qc/0211041,Gravitational waves from black hole binary inspiral and merger: The span of third post-Newtonian effective-one-body templates,Thibault Damour; Bala R. Iyer; Piotr Jaranowski; B. S. Sathyaprakash,https://arxiv.org/abs/gr-qc/0211041,gr-qc,effective-one-body;EOB,foundations_hamiltonian_pn_pm;nr_calibration_eobnr_seobnr_teobresums;data_analysis_lvkc
2005,2005-08-16,gr-qc/0508067,Transition from inspiral to plunge in precessing binaries of spinning black holes,Alessandra Buonanno; Yanbei Chen; Thibault Damour,https://arxiv.org/abs/gr-qc/0508067,gr-qc,effective-one-body,foundations_hamiltonian_pn_pm;resummation_flux_waveform;nr_calibration_eobnr_seobnr_teobresums;spin_precession
2006,2006-02-28,gr-qc/0602117,Gravitational Recoil during Binary Black Hole Coalescence using the Effective One Body Approach,Thibault Damour; Achamveedu Gopakumar,https://arxiv.org/abs/gr-qc/0602117,gr-qc;astro-ph,effective-one-body,resummation_flux_waveform;spin_precession
2006,2006-12-15,gr-qc/0612096,Binary black hole merger in the extreme mass ratio limit,Alessandro Nagar; Thibault Damour; Angelo Tartaglia,https://arxiv.org/abs/gr-qc/0612096,gr-qc,effective-one-body;EOB,foundations_hamiltonian_pn_pm;resummation_flux_waveform;nr_calibration_eobnr_seobnr_teobresums;emri_test_mass_teukolsky
2006,2006-12-23,gr-qc/0612151,Binary black hole merger waveforms in the extreme mass ratio limit,Thibault Damour; Alessandro Nagar,https://arxiv.org/abs/gr-qc/0612151,gr-qc,effective-one-body,nr_calibration_eobnr_seobnr_teobresums;emri_test_mass_teukolsky
2007,2007-02-23,gr-qc/0702641,The Distribution of Recoil Velocities from Merging Black Holes,Jeremy D. Schnittman; Alessandra Buonanno,https://arxiv.org/abs/gr-qc/0702641,astro-ph;gr-qc,effective-one-body;EOB,resummation_flux_waveform;nr_calibration_eobnr_seobnr_teobresums;spin_precession
2007,2007-04-16,0704.1964,A data-analysis driven comparison of analytic and numerical coalescing binary waveforms: nonspinning case,Yi Pan; Alessandra Buonanno; John G. Baker; Joan Centrella; Bernard J. Kelly; Sean T. McWilliams; Frans Pretorius; James R. van Meter,https://arxiv.org/abs/0704.1964,gr-qc,effective-one-body,foundations_hamiltonian_pn_pm;spin_precession;data_analysis_lvkc
2007,2007-04-26,0704.3550,Final spin of a coalescing black-hole binary: an Effective-One-Body approach,Thibault Damour; Alessandro Nagar,https://arxiv.org/abs/0704.3550,gr-qc,effective-one-body;EOB,foundations_hamiltonian_pn_pm;spin_precession;eccentric_hyperbolic_scattering
2007,2007-05-17,0705.2519,Faithful Effective-One-Body waveforms of small-mass-ratio coalescing black-hole binaries,Thibault Damour; Alessandro Nagar,https://arxiv.org/abs/0705.2519,gr-qc,effective-one-body;EOB,foundations_hamiltonian_pn_pm;resummation_flux_waveform;nr_calibration_eobnr_seobnr_teobresums;spin_precession;data_analysis_lvkc
2007,2007-05-22,0705.3109,Black Hole and Neutron Star Binaries: Theoretical Challenges,Thibault Damour,https://arxiv.org/abs/0705.3109,gr-qc,effective-one-body,tides_neutron_stars
2007,2007-06-25,0706.3732,Toward faithful templates for non-spinning binary black holes using the effective-one-body approach,Alessandra Buonanno; Yi Pan; John G. Baker; Joan Centrella; Bernard J. Kelly; Sean T. McWilliams; James R. van Meter,https://arxiv.org/abs/0706.3732,gr-qc,effective-one-body;EOB,foundations_hamiltonian_pn_pm;nr_calibration_eobnr_seobnr_teobresums;spin_precession;eccentric_hyperbolic_scattering;data_analysis_lvkc
2007,2007-06-29,0706.4437,Gravitational waves from inspiralling compact binaries: hexagonal template placement and its efficiency in detecting physical signals,Thomas Cokelaer,https://arxiv.org/abs/0706.4437,gr-qc,effective-one-body,resummation_flux_waveform;nr_calibration_eobnr_seobnr_teobresums;spin_precession;tides_neutron_stars;data_analysis_lvkc
2007,2007-11-16,0711.2628,Comparing Effective-One-Body gravitational waveforms to accurate numerical data,Thibault Damour; Alessandro Nagar,https://arxiv.org/abs/0711.2628,gr-qc,effective-one-body;EOB,foundations_hamiltonian_pn_pm;resummation_flux_waveform;nr_calibration_eobnr_seobnr_teobresums
2007,2007-12-18,0712.3003,Faithful Effective-One-Body waveforms of equal-mass coalescing black-hole binaries,Thibault Damour; Alessandro Nagar; Ernst Nils Dorband; Denis Pollney; Luciano Rezzolla,https://arxiv.org/abs/0712.3003,gr-qc,effective-one-body;EOB,foundations_hamiltonian_pn_pm;resummation_flux_waveform;eccentric_hyperbolic_scattering
2008,2008-02-27,0802.4047,Introductory lectures on the Effective One Body formalism,Thibault Damour,https://arxiv.org/abs/0802.4047,gr-qc,effective-one-body;EOB,uncategorized_eob_candidate
2008,2008-03-06,0803.0915,Effective one body approach to the dynamics of two spinning black holes with next-to-leading order spin-orbit coupling,Thibault Damour; Piotr Jaranowski; Gerhard Schäfer,https://arxiv.org/abs/0803.0915,gr-qc,effective-one-body;EOB,foundations_hamiltonian_pn_pm;resummation_flux_waveform;nr_calibration_eobnr_seobnr_teobresums;spin_precession
2008,2008-03-16,0803.2348,Binary Black Hole Coalescence in Semi-Analytic Puncture Evolution,Achamveedu Gopakumar; Gerhard Schaefer,https://arxiv.org/abs/0803.2348,gr-qc,effective-one-body,foundations_hamiltonian_pn_pm;resummation_flux_waveform;nr_calibration_eobnr_seobnr_teobresums
2008,2008-03-21,0803.3162,Accurate Effective-One-Body waveforms of inspiralling and coalescing black-hole binaries,Thibault Damour; Alessandro Nagar; Mark Hannam; Sascha Husa; Bernd Brugmann,https://arxiv.org/abs/0803.3162,gr-qc,effective-one-body;EOB,foundations_hamiltonian_pn_pm;nr_calibration_eobnr_seobnr_teobresums;data_analysis_lvkc
2008,2008-04-25,0804.4184,High-accuracy numerical simulation of black-hole binaries: Computation of the gravitational-wave energy flux and comparisons with post-Newtonian approximants,Michael Boyle; Alessandra Buonanno; Lawrence E. Kidder; Abdul H. Mroué; Yi Pan; Harald P. Pfeiffer; Mark A. Scheel,https://arxiv.org/abs/0804.4184,gr-qc,effective-one-body;EOB,foundations_hamiltonian_pn_pm;resummation_flux_waveform;nr_calibration_eobnr_seobnr_teobresums;spin_precession
2008,2008-05-09,0805.1428,Mergers of nonspinning black-hole binaries: Gravitational radiation characteristics,John G. Baker; William D. Boggs; Joan Centrella; Bernard J. Kelly; Sean T. McWilliams; James R. van Meter,https://arxiv.org/abs/0805.1428,gr-qc,effective-one-body,resummation_flux_waveform;nr_calibration_eobnr_seobnr_teobresums;spin_precession;data_analysis_lvkc
2008,2008-05-15,0805.2390,Ineffectiveness of Padé resummation techniques in post-Newtonian approximations,Abdul H. Mroué; Lawrence E. Kidder; Saul A. Teukolsky,https://arxiv.org/abs/0805.2390,gr-qc,effective-one-body;EOB,foundations_hamiltonian_pn_pm;resummation_flux_waveform;spin_precession;emri_test_mass_teukolsky;data_analysis_lvkc
2008,2008-11-13,0811.2069,Improved resummation of post-Newtonian multipolar waveforms from circularized compact binaries,Thibault Damour; Bala R. Iyer; Alessandro Nagar,https://arxiv.org/abs/0811.2069,gr-qc,manual_eob_core,foundations_hamiltonian_pn_pm;resummation_flux_waveform
2008,2008-11-21,0811.3451,Gravitational-wave memory revisited: memory from the merger and recoil of binary black holes,Marc Favata,https://arxiv.org/abs/0811.3451,astro-ph;gr-qc,effective-one-body,foundations_hamiltonian_pn_pm;resummation_flux_waveform;nr_calibration_eobnr_seobnr_teobresums;emri_test_mass_teukolsky
2009,2009-01-08,0901.0993,Numerical black hole initial data with low eccentricity based on post-Newtonian orbital parameters,Benny Walther; Bernd Bruegmann; Doreen Mueller,https://arxiv.org/abs/0901.0993,gr-qc,effective-one-body,foundations_hamiltonian_pn_pm;resummation_flux_waveform;nr_calibration_eobnr_seobnr_teobresums;spin_precession;eccentric_hyperbolic_scattering
2009,2009-02-02,0902.0136,An improved analytical description of inspiralling and coalescing black-hole binaries,Thibault Damour; Alessandro Nagar,https://arxiv.org/abs/0902.0136,gr-qc,effective-one-body,resummation_flux_waveform;nr_calibration_eobnr_seobnr_teobresums;spin_precession;data_analysis_lvkc
2009,2009-02-02,0902.0307,Searching for binary coalescences with inspiral templates: Detection and parameter estimation,Benjamin Farr; Stephen Fairhurst; B. S. Sathyaprakash,https://arxiv.org/abs/0902.0307,gr-qc,effective-one-body,foundations_hamiltonian_pn_pm;nr_calibration_eobnr_seobnr_teobresums;data_analysis_lvkc
2009,2009-02-04,0902.0790,"Effective-one-body waveforms calibrated to numerical relativity simulations: coalescence of non-spinning, equal-mass black holes",Alessandra Buonanno; Yi Pan; Harald P. Pfeiffer; Mark A. Scheel; Luisa T. Buchman; Lawrence E. Kidder,https://arxiv.org/abs/0902.0790,gr-qc,effective-one-body;EOB,nr_calibration_eobnr_seobnr_teobresums;spin_precession;data_analysis_lvkc
2009,2009-02-23,0902.3660,Nonlinear gravitational-wave memory from binary black hole mergers,Marc Favata,https://arxiv.org/abs/0902.3660,astro-ph.SR;gr-qc,effective-one-body;EOB,nr_calibration_eobnr_seobnr_teobresums;gsf_gauge_invariants;emri_test_mass_teukolsky;data_analysis_lvkc
2009,2009-06-09,0906.1769,The Effective One Body description of the Two-Body problem,Thibault Damour; Alessandro Nagar,https://arxiv.org/abs/0906.1769,gr-qc,effective-one-body;EOB,foundations_hamiltonian_pn_pm;data_analysis_lvkc
2009,2009-07-03,0907.0700,Comparison of post-Newtonian templates for compact binary inspiral signals in gravitational-wave detectors,Alessandra Buonanno; Bala Iyer; Evan Ochsner; Yi Pan; B. S. Sathyaprakash,https://arxiv.org/abs/0907.0700,gr-qc,effective-one-body;EOB,foundations_hamiltonian_pn_pm;nr_calibration_eobnr_seobnr_teobresums;data_analysis_lvkc
2009,2009-09-23,0909.4263,Modeling Extreme Mass Ratio Inspirals within the Effective-One-Body Approach,Nicolas Yunes; Alessandra Buonanno; Scott A. Hughes; M. Coleman Miller; Yi Pan,https://arxiv.org/abs/0909.4263,gr-qc;astro-ph.CO;astro-ph.GA;astro-ph.HE,effective-one-body;EOB,foundations_hamiltonian_pn_pm;nr_calibration_eobnr_seobnr_teobresums;gsf_gauge_invariants;emri_test_mass_teukolsky
2009,2009-10-29,0910.5533,Gravitational Self Force in a Schwarzschild Background and the Effective One Body Formalism,Thibault Damour,https://arxiv.org/abs/0910.5533,gr-qc,effective-one-body;EOB,foundations_hamiltonian_pn_pm;nr_calibration_eobnr_seobnr_teobresums;gsf_gauge_invariants;eccentric_hyperbolic_scattering
2009,2009-11-27,0911.5041,Effective One Body description of tidal effects in inspiralling compact binaries,Thibault Damour; Alessandro Nagar,https://arxiv.org/abs/0911.5041,gr-qc,effective-one-body;EOB,foundations_hamiltonian_pn_pm;resummation_flux_waveform;nr_calibration_eobnr_seobnr_teobresums;tides_neutron_stars
2009,2009-12-17,0912.3466,"Effective-one-body waveforms calibrated to numerical relativity simulations: coalescence of non-precessing, spinning, equal-mass black holes",Yi Pan; Alessandra Buonanno; Luisa T. Buchman; Tony Chu; Lawrence E. Kidder; Harald P. Pfeiffer; Mark A. Scheel,https://arxiv.org/abs/0912.3466,gr-qc,effective-one-body;EOB,foundations_hamiltonian_pn_pm;nr_calibration_eobnr_seobnr_teobresums;spin_precession;data_analysis_lvkc
2009,2009-12-17,0912.3517,An improved effective-one-body Hamiltonian for spinning black-hole binaries,Enrico Barausse; Alessandra Buonanno,https://arxiv.org/abs/0912.3517,gr-qc;astro-ph.CO;astro-ph.GA,effective-one-body;EOB,foundations_hamiltonian_pn_pm;nr_calibration_eobnr_seobnr_teobresums;spin_precession
2010,2010-03-02,1003.0597,Binary black hole merger in the extreme-mass-ratio limit: a multipolar analysis,Sebastiano Bernuzzi; Alessandro Nagar,https://arxiv.org/abs/1003.0597,gr-qc,effective-one-body;EOB,foundations_hamiltonian_pn_pm;resummation_flux_waveform;nr_calibration_eobnr_seobnr_teobresums;spin_precession;emri_test_mass_teukolsky;data_analysis_lvkc
2010,2010-08-05,1008.0935,Precession effect of the gravitational self-force in a Schwarzschild spacetime and the effective one-body formalism,Leor Barack; Thibault Damour; Norichika Sago,https://arxiv.org/abs/1008.0935,gr-qc,effective-one-body;EOB,foundations_hamiltonian_pn_pm;resummation_flux_waveform;gsf_gauge_invariants;spin_precession;eccentric_hyperbolic_scattering
2010,2010-08-27,1008.4622,Conservative self-force correction to the innermost stable circular orbit: comparison with multiple post-Newtonian-based methods,Marc Favata,https://arxiv.org/abs/1008.4622,gr-qc;astro-ph.HE,effective-one-body;EOB,foundations_hamiltonian_pn_pm;resummation_flux_waveform;nr_calibration_eobnr_seobnr_teobresums;gsf_gauge_invariants
2010,2010-09-02,1009.0521,Analytic modelling of tidal effects in the relativistic inspiral of binary neutron stars,Luca Baiotti; Thibault Damour; Bruno Giacomazzo; Alessandro Nagar; Luciano Rezzolla,https://arxiv.org/abs/1009.0521,gr-qc,effective-one-body;EOB,foundations_hamiltonian_pn_pm;nr_calibration_eobnr_seobnr_teobresums;tides_neutron_stars
2010,2010-09-10,1009.1985,Intermediate-mass-ratio-inspirals in the Einstein Telescope: I. Signal-to-noise ratio calculations,E. A. Huerta; Jonathan R. Gair,https://arxiv.org/abs/1009.1985,gr-qc,effective-one-body;EOB,nr_calibration_eobnr_seobnr_teobresums;gsf_gauge_invariants;spin_precession;tides_neutron_stars;emri_test_mass_teukolsky;data_analysis_lvkc
2010,2010-09-29,1009.5998,"Accuracy and effectualness of closed-form, frequency-domain waveforms for non-spinning black hole binaries",T. Damour; A. Nagar; M. Trias,https://arxiv.org/abs/1009.5998,gr-qc,effective-one-body;EOB,foundations_hamiltonian_pn_pm;nr_calibration_eobnr_seobnr_teobresums;spin_precession;data_analysis_lvkc
2010,2010-09-29,1009.6013,"Extreme Mass-Ratio Inspirals in the Effective-One-Body Approach: Quasi-Circular, Equatorial Orbits around a Spinning Black Hole",Nicolas Yunes; Alessandra Buonanno; Scott A. Hughes; Yi Pan; Enrico Barausse; M. Coleman Miller; William Throwe,https://arxiv.org/abs/1009.6013,gr-qc,effective-one-body,foundations_hamiltonian_pn_pm;resummation_flux_waveform;nr_calibration_eobnr_seobnr_teobresums;spin_precession;emri_test_mass_teukolsky;data_analysis_lvkc
2010,2010-10-13,1010.2553,"Conservative corrections to the innermost stable circular orbit (ISCO) of a Kerr black hole: a new gauge-invariant post-Newtonian ISCO condition, and the ISCO shift due to test-particle spin and the gravitational self-force",Marc Favata,https://arxiv.org/abs/1010.2553,gr-qc;astro-ph.HE,effective-one-body,foundations_hamiltonian_pn_pm;resummation_flux_waveform;nr_calibration_eobnr_seobnr_teobresums;gsf_gauge_invariants;spin_precession;emri_test_mass_teukolsky
2010,2010-11-01,1011.0421,Intermediate-mass-ratio-inspirals in the Einstein Telescope. II. Parameter estimation errors,E. A. Huerta; Jonathan R. Gair,https://arxiv.org/abs/1011.0421,gr-qc;astro-ph.CO,effective-one-body;EOB,spin_precession;emri_test_mass_teukolsky;data_analysis_lvkc
2010,2010-12-11,1012.2456,Binary black hole coalescence in the extreme-mass-ratio limit: testing and improving the effective-one-body multipolar waveform,Sebastiano Bernuzzi; Alessandro Nagar; Anil Zenginoglu,https://arxiv.org/abs/1012.2456,gr-qc;astro-ph.CO,effective-one-body;EOB,foundations_hamiltonian_pn_pm;resummation_flux_waveform;nr_calibration_eobnr_seobnr_teobresums;spin_precession;emri_test_mass_teukolsky
2011,2011-03-20,1103.3874,Accurate numerical simulations of inspiralling binary neutron stars and their comparison with effective-one-body analytical models,Luca Baiotti; Thibault Damour; Bruno Giacomazzo; Alessandro Nagar; Luciano Rezzolla,https://arxiv.org/abs/1103.3874,gr-qc,effective-one-body;EOB,foundations_hamiltonian_pn_pm;nr_calibration_eobnr_seobnr_teobresums;tides_neutron_stars
2011,2011-04-12,1104.2322,Observable Signatures of EMRI Black Hole Binaries Embedded in Thin Accretion Disks,Bence Kocsis; Nicolas Yunes; Abraham Loeb,https://arxiv.org/abs/1104.2322,astro-ph.GA;astro-ph.CO;astro-ph.HE;gr-qc,effective-one-body,foundations_hamiltonian_pn_pm;nr_calibration_eobnr_seobnr_teobresums;tides_neutron_stars;emri_test_mass_teukolsky
2011,2011-06-06,1106.1021,Inspiral-merger-ringdown multipolar waveforms of nonspinning black-hole binaries using the effective-one-body formalism,Yi Pan; Alessandra Buonanno; Michael Boyle; Luisa T. Buchman; Lawrence E. Kidder; Harald P. Pfeiffer; Mark A. Scheel,https://arxiv.org/abs/1106.1021,gr-qc,effective-one-body;EOB,resummation_flux_waveform;nr_calibration_eobnr_seobnr_teobresums;spin_precession;data_analysis_lvkc
2011,2011-06-16,1106.3278,Periastron Advance in Black-Hole Binaries,Alexandre Le Tiec; Abdul H. Mroué; Leor Barack; Alessandra Buonanno; Harald P. Pfeiffer; Norichika Sago; Andrea Taracchini,https://arxiv.org/abs/1106.3278,gr-qc;astro-ph.HE,effective-one-body,foundations_hamiltonian_pn_pm;nr_calibration_eobnr_seobnr_teobresums;gsf_gauge_invariants;spin_precession;data_analysis_lvkc
2011,2011-06-21,1106.4349,Effective one body Hamiltonian of two spinning black-holes with next-to-next-to-leading order spin-orbit coupling,Alessandro Nagar,https://arxiv.org/abs/1106.4349,gr-qc,effective-one-body;EOB,foundations_hamiltonian_pn_pm;spin_precession
2011,2011-07-14,1107.2904,Extending the effective-one-body Hamiltonian of black-hole binaries to include next-to-next-to-leading spin-orbit couplings,Enrico Barausse; Alessandra Buonanno,https://arxiv.org/abs/1107.2904,gr-qc;astro-ph.CO;astro-ph.GA,effective-one-body;EOB,foundations_hamiltonian_pn_pm;spin_precession
2011,2011-07-27,1107.5402,Binary black hole coalescence in the large-mass-ratio limit: the hyperboloidal layer method and waveforms at null infinity,Sebastiano Bernuzzi; Alessandro Nagar; Anil Zenginoglu,https://arxiv.org/abs/1107.5402,gr-qc,effective-one-body;EOB,foundations_hamiltonian_pn_pm;resummation_flux_waveform;nr_calibration_eobnr_seobnr_teobresums;data_analysis_lvkc
2011,2011-08-04,1108.0995,Constructing EOB dynamics with numerical energy flux for intermediate-mass-ratio inspirals,Wen-Biao Han; Zhoujian Cao,https://arxiv.org/abs/1108.0995,gr-qc,effective-one-body;EOB,foundations_hamiltonian_pn_pm;resummation_flux_waveform;nr_calibration_eobnr_seobnr_teobresums;spin_precession;emri_test_mass_teukolsky
2011,2011-09-30,1109.6848,"Perturbative, Post-Newtonian, and General Relativistic Dynamics of Black Hole Binaries",Alexandre Le Tiec,https://arxiv.org/abs/1109.6848,gr-qc,effective-one-body,foundations_hamiltonian_pn_pm;nr_calibration_eobnr_seobnr_teobresums;spin_precession
2011,2011-10-13,1110.2938,Energy versus Angular Momentum in Black Hole Binaries,Thibault Damour; Alessandro Nagar; Denis Pollney; Christian Reisswig,https://arxiv.org/abs/1110.2938,gr-qc;astro-ph.HE,effective-one-body,foundations_hamiltonian_pn_pm;resummation_flux_waveform;nr_calibration_eobnr_seobnr_teobresums;gsf_gauge_invariants;spin_precession
2011,2011-10-13,1110.3081,Modeling multipolar gravitational-wave emission from small mass-ratio mergers,Enrico Barausse; Alessandra Buonanno; Scott A. Hughes; Gaurav Khanna; Stephen O'Sullivan; Yi Pan,https://arxiv.org/abs/1110.3081,gr-qc;astro-ph.GA,effective-one-body;EOB,resummation_flux_waveform;nr_calibration_eobnr_seobnr_teobresums;spin_precession;emri_test_mass_teukolsky
2011,2011-11-23,1111.5610,The complete non-spinning effective-one-body metric at linear order in the mass ratio,Enrico Barausse; Alessandra Buonanno; Alexandre Le Tiec,https://arxiv.org/abs/1111.5610,gr-qc;astro-ph.CO;astro-ph.GA,effective-one-body;EOB,foundations_hamiltonian_pn_pm;resummation_flux_waveform;gsf_gauge_invariants;spin_precession;emri_test_mass_teukolsky
2011,2011-12-13,1112.2840,"Horizon-absorbed energy flux in circularized, nonspinning black-hole binaries and its effective-one-body representation",Alessandro Nagar; Sarp Akcay,https://arxiv.org/abs/1112.2840,gr-qc,effective-one-body;EOB,foundations_hamiltonian_pn_pm;resummation_flux_waveform;nr_calibration_eobnr_seobnr_teobresums;spin_precession;emri_test_mass_teukolsky
2011,2011-12-14,1112.3351,Gravitational Waves from Quasicircular Extreme Mass-Ratio Inspirals as Probes of Scalar-Tensor Theories,Nicolas Yunes; Paolo Pani; Vitor Cardoso,https://arxiv.org/abs/1112.3351,gr-qc;astro-ph.HE,effective-one-body,foundations_hamiltonian_pn_pm;resummation_flux_waveform;nr_calibration_eobnr_seobnr_teobresums;spin_precession;emri_test_mass_teukolsky;data_analysis_lvkc
2012,2012-02-03,1202.0790,Prototype effective-one-body model for nonprecessing spinning inspiral-merger-ringdown waveforms,Andrea Taracchini; Yi Pan; Alessandra Buonanno; Enrico Barausse; Michael Boyle; Tony Chu; Geoffrey Lovelace; Harald P. Pfeiffer; Mark A. Scheel,https://arxiv.org/abs/1202.0790,gr-qc,effective-one-body;EOB,foundations_hamiltonian_pn_pm;nr_calibration_eobnr_seobnr_teobresums;spin_precession;emri_test_mass_teukolsky;data_analysis_lvkc
2012,2012-02-16,1202.3565,Effective action approach to higher-order relativistic tidal interactions in binary systems and their effective one body description,Donato Bini; Thibault Damour; Guillaume Faye,https://arxiv.org/abs/1202.3565,gr-qc,effective-one-body,resummation_flux_waveform;nr_calibration_eobnr_seobnr_teobresums;tides_neutron_stars
2012,2012-03-20,1203.4352,Measurability of the tidal polarizability of neutron stars in late-inspiral gravitational-wave signals,Thibault Damour; Alessandro Nagar; Loic Villain,https://arxiv.org/abs/1203.4352,gr-qc;astro-ph.HE,effective-one-body,nr_calibration_eobnr_seobnr_teobresums;tides_neutron_stars;data_analysis_lvkc
2012,2012-05-15,1205.3403,Tidal effects in binary neutron star coalescence,Sebastiano Bernuzzi; Alessandro Nagar; Marcus Thierfelder; Bernd Bruegmann,https://arxiv.org/abs/1205.3403,gr-qc;astro-ph.HE,effective-one-body;EOB,foundations_hamiltonian_pn_pm;nr_calibration_eobnr_seobnr_teobresums;tides_neutron_stars
2012,2012-05-24,1205.5562,Accurate modeling of intermediate-mass-ratio inspirals: Exploring the form of the self-force in the intermediate-mass-ratio regime,E. A. Huerta; Prayush Kumar; Duncan A. Brown,https://arxiv.org/abs/1205.5562,gr-qc;astro-ph.CO,effective-one-body;EOB,nr_calibration_eobnr_seobnr_teobresums;gsf_gauge_invariants;eccentric_hyperbolic_scattering;emri_test_mass_teukolsky
2012,2012-06-17,1206.3803,On the mass radiated by coalescing black-hole binaries,Enrico Barausse; Viktoriya Morozova; Luciano Rezzolla,https://arxiv.org/abs/1206.3803,gr-qc;astro-ph.CO,effective-one-body,nr_calibration_eobnr_seobnr_teobresums;gsf_gauge_invariants;spin_precession;emri_test_mass_teukolsky
2012,2012-07-03,1207.0769,Horizon-absorption effects in coalescing black-hole binaries: An effective-one-body study of the non-spinning case,Sebastiano Bernuzzi; Alessandro Nagar; Anil Zenginoglu,https://arxiv.org/abs/1207.0769,gr-qc,effective-one-body;EOB,resummation_flux_waveform;nr_calibration_eobnr_seobnr_teobresums;spin_precession;emri_test_mass_teukolsky;data_analysis_lvkc
