year,published,arxiv_id,title,authors,url,categories,match_terms,technical_tags
2022,2022-07-28,2207.14346,A Rosetta Stone for eccentric gravitational waveform models,Alan M. Knee; Isobel M. Romero-Shaw; Paul D. Lasky; Jess McIver; Eric Thrane,https://arxiv.org/abs/2207.14346,gr-qc;astro-ph.HE,SEOBNR;TEOBResumS,nr_calibration_eobnr_seobnr_teobresums;eccentric_hyperbolic_scattering
2022,2022-08-01,2208.01049,"Comparing second-order gravitational self-force, numerical relativity and effective one body waveforms from inspiralling, quasi-circular and nonspinning black hole binaries",Angelica Albertini; Alessandro Nagar; Adam Pound; Niels Warburton; Barry Wardell; Leanne Durkan; Jeremy Miller,https://arxiv.org/abs/2208.01049,gr-qc,effective-one-body;EOB;TEOBResumS,resummation_flux_waveform;nr_calibration_eobnr_seobnr_teobresums;gsf_gauge_invariants;spin_precession;emri_test_mass_teukolsky;data_analysis_lvkc
2022,2022-08-03,2208.02055,"Comparing second-order gravitational self-force and effective one body waveforms from inspiralling, quasi-circular and nonspinning black hole binaries II: the large-mass-ratio case",Angelica Albertini; Alessandro Nagar; Adam Pound; Niels Warburton; Barry Wardell; Leanne Durkan; Jeremy Miller,https://arxiv.org/abs/2208.02055,gr-qc,effective-one-body;EOB,foundations_hamiltonian_pn_pm;resummation_flux_waveform;nr_calibration_eobnr_seobnr_teobresums;gsf_gauge_invariants;spin_precession;eccentric_hyperbolic_scattering;emri_test_mass_teukolsky;data_analysis_lvkc
2022,2022-08-04,2208.02420,New self-consistent effective one-body theory for spinless binaries based on the post-Minkowskian approximation,Jiliang Jing; Sheng Long; Weike Deng; Mengjie Wang; Jieci Wang,https://arxiv.org/abs/2208.02420,gr-qc,effective-one-body,foundations_hamiltonian_pn_pm;nr_calibration_eobnr_seobnr_teobresums;spin_precession
2022,2022-08-09,2208.04552,Gravity in binary systems at the fifth and sixth post-Newtonian order,J. Blümlein; A. Maier; P. Marquard; G. Schäfer,https://arxiv.org/abs/2208.04552,gr-qc;hep-ph,effective-one-body,foundations_hamiltonian_pn_pm
2022,2022-09-01,2209.00374,Spin contributions to the gravitational-waveform modes for spin-aligned binaries at the 3.5PN order,Quentin Henry; Sylvain Marsat; Mohammed Khalil,https://arxiv.org/abs/2209.00374,gr-qc,effective-one-body,foundations_hamiltonian_pn_pm;resummation_flux_waveform;nr_calibration_eobnr_seobnr_teobresums;spin_precession;emri_test_mass_teukolsky
2022,2022-09-08,2209.03836,Self-force in hyperbolic black hole encounters,Oliver Long,https://arxiv.org/abs/2209.03836,gr-qc;astro-ph.HE,effective-one-body,foundations_hamiltonian_pn_pm;nr_calibration_eobnr_seobnr_teobresums;gsf_gauge_invariants;eccentric_hyperbolic_scattering;emri_test_mass_teukolsky
2022,2022-10-04,2210.01852,"Numerical relativity higher order gravitational waveforms of eccentric, spinning, non-precessing binary black hole mergers",Abhishek V. Joshi; Shawn G. Rosofsky; Roland Haas; E. A. Huerta,https://arxiv.org/abs/2210.01852,gr-qc,SEOBNR;TEOBResumS,nr_calibration_eobnr_seobnr_teobresums;gsf_gauge_invariants;spin_precession;eccentric_hyperbolic_scattering;data_analysis_lvkc
2022,2022-10-27,2210.15602,Complete gravitational-waveform amplitude modes for quasi-circular compact binaries to the 3.5PN order,Quentin Henry,https://arxiv.org/abs/2210.15602,gr-qc,EOB,foundations_hamiltonian_pn_pm;resummation_flux_waveform;spin_precession
2022,2022-10-27,2210.15684,Combining effective-one-body accuracy and reduced-order-quadrature speed for binary neutron star merger parameter estimation with machine learning,Jacopo Tissino; Gregorio Carullo; Matteo Breschi; Rossella Gamba; Stefano Schmidt; Sebastiano Bernuzzi,https://arxiv.org/abs/2210.15684,gr-qc,effective-one-body;TEOBResumS,nr_calibration_eobnr_seobnr_teobresums;tides_neutron_stars;data_analysis_lvkc
2022,2022-11-02,2211.01399,Strong-field scattering of two black holes: Numerical Relativity meets Post-Minkowskian gravity,Thibault Damour; Piero Rettegno,https://arxiv.org/abs/2211.01399,gr-qc;hep-th,effective-one-body,foundations_hamiltonian_pn_pm;nr_calibration_eobnr_seobnr_teobresums;spin_precession;eccentric_hyperbolic_scattering
2022,2022-11-28,2211.15580,Effective one body Hamiltonian in scalar-tensor gravity at third post-Newtonian order,Tamanna Jain; Piero Rettegno; Michalis Agathos; Alessandro Nagar; Lorenzo Turco,https://arxiv.org/abs/2211.15580,gr-qc,effective-one-body;EOB,foundations_hamiltonian_pn_pm;nr_calibration_eobnr_seobnr_teobresums
2022,2022-12-07,2212.03909,Numerical-Relativity-Informed Effective-One-Body model for Black-Hole-Neutron-Star Mergers with Higher Modes and Spin Precession,Alejandra Gonzalez; Rossella Gamba; Matteo Breschi; Francesco Zappa; Gregorio Carullo; Sebastiano Bernuzzi; Alessandro Nagar,https://arxiv.org/abs/2212.03909,gr-qc,effective-one-body;EOB,spin_precession;tides_neutron_stars;data_analysis_lvkc
2022,2022-12-19,2212.09655,Tests of general relativity in the nonlinear regime: a parametrized plunge-merger-ringdown gravitational waveform model,Elisa Maggio; Hector O. Silva; Alessandra Buonanno; Abhirup Ghosh,https://arxiv.org/abs/2212.09655,gr-qc;astro-ph.HE,effective-one-body,nr_calibration_eobnr_seobnr_teobresums;spin_precession
2022,2022-12-20,2212.10486,Effective-one-body formalism for leading-order radiative effects in the post-linear framework,Karthik Rajeev; S. Shankaranarayanan,https://arxiv.org/abs/2212.10486,gr-qc;hep-th,effective-one-body;EOB,foundations_hamiltonian_pn_pm;resummation_flux_waveform;nr_calibration_eobnr_seobnr_teobresums;eccentric_hyperbolic_scattering
2022,2022-12-28,2212.13802,Third post-Newtonian effective-one-body Hamiltonian in scalar-tensor and Einstein-scalar-Gauss-Bonnet gravity,Félix-Louis Julié; Vishal Baibhav; Emanuele Berti; Alessandra Buonanno,https://arxiv.org/abs/2212.13802,gr-qc,effective-one-body;EOB,foundations_hamiltonian_pn_pm;nr_calibration_eobnr_seobnr_teobresums;gsf_gauge_invariants;eccentric_hyperbolic_scattering
2023,2023-01-03,2301.01070,Nonlocal-in-time effective one body Hamiltonian in scalar-tensor gravity at third post-Newtonian order,Tamanna Jain,https://arxiv.org/abs/2301.01070,gr-qc,effective-one-body;EOB,foundations_hamiltonian_pn_pm
2023,2023-01-18,2301.08318,Gravitational-wave equation in effective one-body background for spinless binary,Ya Guo; Hiroaki Nakajima; Wenbin Lin,https://arxiv.org/abs/2301.08318,gr-qc;astro-ph.HE,effective-one-body,spin_precession
2023,2023-02-22,2302.11257,Defining eccentricity for gravitational wave astronomy,Md Arif Shaikh; Vijay Varma; Harald P. Pfeiffer; Antoni Ramos-Buades; Maarten van de Meent,https://arxiv.org/abs/2302.11257,gr-qc;astro-ph.HE,effective-one-body,foundations_hamiltonian_pn_pm;nr_calibration_eobnr_seobnr_teobresums;spin_precession;eccentric_hyperbolic_scattering;emri_test_mass_teukolsky;data_analysis_lvkc
2023,2023-03-01,2303.00317,Charged test-particle scattering and effective one-body metrics with spin,Jitze Hoogeveen,https://arxiv.org/abs/2303.00317,hep-th;gr-qc,effective-one-body,foundations_hamiltonian_pn_pm;resummation_flux_waveform;nr_calibration_eobnr_seobnr_teobresums;spin_precession;eccentric_hyperbolic_scattering
2023,2023-03-24,2303.13749,Influence of mass-ratio corrections in extreme-mass-ratio inspirals for testing general relativity,Ping Shen; Wen-Biao Han; Chen Zhang; Shu-Cheng Yang; Xing-Yu Zhong; Ye Jiang; Qiuxin Cui,https://arxiv.org/abs/2303.13749,gr-qc,effective-one-body,resummation_flux_waveform;nr_calibration_eobnr_seobnr_teobresums;emri_test_mass_teukolsky
2023,2023-03-31,2303.18026,Enhancing the SEOBNRv5 effective-one-body waveform model with second-order gravitational self-force fluxes,Maarten van de Meent; Alessandra Buonanno; Deyan P. Mihaylov; Serguei Ossokine; Lorenzo Pompili; Niels Warburton; Adam Pound; Barry Wardell; Leanne Durkan; Jeremy Miller,https://arxiv.org/abs/2303.18026,gr-qc,effective-one-body;EOB;SEOBNR,resummation_flux_waveform;nr_calibration_eobnr_seobnr_teobresums;gsf_gauge_invariants;spin_precession;data_analysis_lvkc
2023,2023-03-31,2303.18039,Laying the foundation of the effective-one-body waveform models SEOBNRv5: improved accuracy and efficiency for spinning non-precessing binary black holes,Lorenzo Pompili; Alessandra Buonanno; Héctor Estellés; Mohammed Khalil; Maarten van de Meent; Deyan P. Mihaylov; Serguei Ossokine; Michael Pürrer; Antoni Ramos-Buades; Ajit Kumar Mehta; Roberto Cotesta; Sylvain Marsat; et al.,https://arxiv.org/abs/2303.18039,gr-qc,effective-one-body;EOB;EOBNR;SEOBNR,resummation_flux_waveform;nr_calibration_eobnr_seobnr_teobresums;gsf_gauge_invariants;spin_precession;eccentric_hyperbolic_scattering;data_analysis_lvkc
2023,2023-03-31,2303.18046,SEOBNRv5PHM: Next generation of accurate and efficient multipolar precessing-spin effective-one-body waveforms for binary black holes,Antoni Ramos-Buades; Alessandra Buonanno; Héctor Estellés; Mohammed Khalil; Deyan P. Mihaylov; Serguei Ossokine; Lorenzo Pompili; Mahlet Shiferaw,https://arxiv.org/abs/2303.18046,gr-qc;astro-ph.HE,effective-one-body;EOB;SEOBNR,resummation_flux_waveform;nr_calibration_eobnr_seobnr_teobresums;gsf_gauge_invariants;spin_precession;data_analysis_lvkc
2023,2023-03-31,2303.18143,Theoretical groundwork supporting the precessing-spin two-body dynamics of the effective-one-body waveform models SEOBNRv5,Mohammed Khalil; Alessandra Buonanno; Héctor Estellés; Deyan P. Mihaylov; Serguei Ossokine; Lorenzo Pompili; Antoni Ramos-Buades,https://arxiv.org/abs/2303.18143,gr-qc,effective-one-body;EOB;SEOBNR,foundations_hamiltonian_pn_pm;resummation_flux_waveform;nr_calibration_eobnr_seobnr_teobresums;spin_precession;tides_neutron_stars;emri_test_mass_teukolsky;data_analysis_lvkc
2023,2023-03-31,2303.18203,pySEOBNR: a software package for the next generation of effective-one-body multipolar waveform models,Deyan P. Mihaylov; Serguei Ossokine; Alessandra Buonanno; Hector Estelles; Lorenzo Pompili; Michael Pürrer; Antoni Ramos-Buades,https://arxiv.org/abs/2303.18203,gr-qc,effective-one-body;EOB;SEOBNR,resummation_flux_waveform;nr_calibration_eobnr_seobnr_teobresums;gsf_gauge_invariants;spin_precession;tides_neutron_stars;data_analysis_lvkc
2023,2023-04-18,2304.09052,Gravitational scattering upto third post-Newtonian approximation for conservative dynamics: Scalar-Tensor theories,Tamanna Jain,https://arxiv.org/abs/2304.09052,gr-qc,effective-one-body,foundations_hamiltonian_pn_pm;gsf_gauge_invariants;eccentric_hyperbolic_scattering
2023,2023-04-19,2304.09662,Analytic systematics in next-generation of effective-one-body gravitational waveform models for future observations,Alessandro Nagar; Piero Rettegno; Rossella Gamba; Simone Albanesi; Angelica Albertini; Sebastiano Bernuzzi,https://arxiv.org/abs/2304.09662,gr-qc,effective-one-body;EOB;EOBNR;TEOBResumS,foundations_hamiltonian_pn_pm;resummation_flux_waveform;nr_calibration_eobnr_seobnr_teobresums;spin_precession;eccentric_hyperbolic_scattering;data_analysis_lvkc
2023,2023-05-05,2305.03225,Self-consistent effective-one-body theory for spinning binaries based on post-Minkowskian approximation,Jiliang Jing; Weike Deng; Sheng Long; Jieci Wang,https://arxiv.org/abs/2305.03225,gr-qc,effective-one-body,foundations_hamiltonian_pn_pm;resummation_flux_waveform;spin_precession;data_analysis_lvkc
2023,2023-05-23,2305.14440,2.5PN accurate waveform information for generic-planar-orbit binaries in effective one-body models,Andrea Placidi; Gianluca Grignani; Troels Harmark; Marta Orselli; Sara Gliorio; Alessandro Nagar,https://arxiv.org/abs/2305.14440,gr-qc,effective-one-body;EOB;TEOBResumS,foundations_hamiltonian_pn_pm;nr_calibration_eobnr_seobnr_teobresums
2023,2023-05-30,2305.19336,"Faithful effective-one-body waveform of small-mass-ratio coalescing black hole binaries: the eccentric, nonspinning, case",Simone Albanesi; Sebastiano Bernuzzi; Thibault Damour; Alessandro Nagar; Andrea Placidi,https://arxiv.org/abs/2305.19336,gr-qc,effective-one-body;EOB,foundations_hamiltonian_pn_pm;resummation_flux_waveform;nr_calibration_eobnr_seobnr_teobresums;spin_precession;eccentric_hyperbolic_scattering;emri_test_mass_teukolsky
2023,2023-06-05,2306.03148,Numerical relativity surrogate model with memory effects and post-Newtonian hybridization,Jooheon Yoo; Keefe Mitman; Vijay Varma; Michael Boyle; Scott E. Field; Nils Deppe; François Hébert; Lawrence E. Kidder; Jordan Moxon; Harald P. Pfeiffer; Mark A. Scheel; Leo C. Stein; et al.,https://arxiv.org/abs/2306.03148,gr-qc,effective-one-body;EOB,foundations_hamiltonian_pn_pm;nr_calibration_eobnr_seobnr_teobresums;spin_precession;eccentric_hyperbolic_scattering;data_analysis_lvkc
2023,2023-06-27,2306.15277,Upgraded waveform model of eccentric binary black hole based on effective-one-body-numerical-relativity for spin-aligned binary black holes,Xiaolin Liu; Zhoujian Cao; Lijing Shao,https://arxiv.org/abs/2306.15277,gr-qc,effective-one-body;SEOBNR,nr_calibration_eobnr_seobnr_teobresums;spin_precession;eccentric_hyperbolic_scattering
2023,2023-06-28,2306.16488,"The gravitational eikonal: from particle, string and brane collisions to black-hole encounters",Paolo Di Vecchia; Carlo Heissenberg; Rodolfo Russo; Gabriele Veneziano,https://arxiv.org/abs/2306.16488,hep-th;gr-qc;hep-ph,effective-one-body,foundations_hamiltonian_pn_pm;nr_calibration_eobnr_seobnr_teobresums
2023,2023-07-12,2307.05971,Effective metric of spinless binaries with radiation-reaction effect up to fourth Post-Minkowskian order in effective-one-body theory,Jiliang Jing; Weike Deng; Sheng Long; Jieci Wang,https://arxiv.org/abs/2307.05971,gr-qc;hep-th,effective-one-body,foundations_hamiltonian_pn_pm;spin_precession;eccentric_hyperbolic_scattering
2023,2023-07-13,2307.06999,Strong-field scattering of two spinning black holes: Numerical Relativity versus post-Minkowskian gravity,Piero Rettegno; Geraint Pratten; Lucy Thomas; Patricia Schmidt; Thibault Damour,https://arxiv.org/abs/2307.06999,gr-qc;hep-th,effective-one-body,foundations_hamiltonian_pn_pm;resummation_flux_waveform;nr_calibration_eobnr_seobnr_teobresums;spin_precession;eccentric_hyperbolic_scattering
2023,2023-07-17,2307.08697,Towards numerical-relativity informed effective-one-body waveforms for dynamical capture black hole binaries,Tomas Andrade; Juan Trenado; Simone Albanesi; Rossella Gamba; Sebastiano Bernuzzi; Alessandro Nagar; Juan Calderon-Bustillo; Nicolas Sanchis-Gual; Jose A. Font; William Cook; Boris Daszuta; Francesco Zappa; et al.,https://arxiv.org/abs/2307.08697,gr-qc;astro-ph.HE,effective-one-body;EOB;EOBNR;TEOBResumS,nr_calibration_eobnr_seobnr_teobresums;spin_precession;eccentric_hyperbolic_scattering
2023,2023-07-26,2307.15086,Measuring source properties and quasi-normal-mode frequencies of heavy massive black-hole binaries with LISA,Alexandre Toubiana; Lorenzo Pompili; Alessandra Buonanno; Jonathan R. Gair; Michael L. Katz,https://arxiv.org/abs/2307.15086,gr-qc,effective-one-body;SEOBNR,resummation_flux_waveform;nr_calibration_eobnr_seobnr_teobresums;spin_precession
2023,2023-07-27,2307.15125,Analytically improved and numerical-relativity informed effective-one-body model for coalescing binary neutron stars,Rossella Gamba; Matteo Breschi; Sebastiano Bernuzzi; Alessandro Nagar; William Cook; Georgios Doulis; Francesco Fabbri; Néstor Ortiz; Amit Poudel; Alireza Rashti; Wolfgang Tichy; Maximiliano Ujevic,https://arxiv.org/abs/2307.15125,gr-qc;astro-ph.HE,effective-one-body;EOB;TEOBResumS,foundations_hamiltonian_pn_pm;resummation_flux_waveform;nr_calibration_eobnr_seobnr_teobresums;spin_precession;tides_neutron_stars;eccentric_hyperbolic_scattering;data_analysis_lvkc
2023,2023-09-13,2309.07228,Unveiling the merger structure of black hole binaries in generic planar orbits,Gregorio Carullo; Simone Albanesi; Alessandro Nagar; Rossella Gamba; Sebastiano Bernuzzi; Tomas Andrade; Juan Trenado,https://arxiv.org/abs/2309.07228,gr-qc;astro-ph.HE,effective-one-body,foundations_hamiltonian_pn_pm;nr_calibration_eobnr_seobnr_teobresums;gsf_gauge_invariants;eccentric_hyperbolic_scattering;emri_test_mass_teukolsky
2023,2023-09-21,2309.12505,Balance Laws as Test of Gravitational Waveforms,Lavinia Heisenberg,https://arxiv.org/abs/2309.12505,gr-qc;astro-ph.CO;astro-ph.HE;hep-ph;hep-th,effective-one-body,foundations_hamiltonian_pn_pm;nr_calibration_eobnr_seobnr_teobresums;data_analysis_lvkc
2023,2023-09-27,2309.15528,Bayesian inference of binary black holes with inspiral-merger-ringdown waveforms using two eccentric parameters,Antoni Ramos-Buades; Alessandra Buonanno; Jonathan Gair,https://arxiv.org/abs/2309.15528,gr-qc;astro-ph.HE;astro-ph.IM,effective-one-body;EOB;SEOBNR,resummation_flux_waveform;nr_calibration_eobnr_seobnr_teobresums;spin_precession;eccentric_hyperbolic_scattering;data_analysis_lvkc
2023,2023-09-28,2309.16638,Blind spots and biases: the dangers of ignoring eccentricity in gravitational-wave signals from binary black holes, Divyajyoti; Sumit Kumar; Snehal Tibrewal; Isobel M. Romero-Shaw; Chandra Kant Mishra,https://arxiv.org/abs/2309.16638,gr-qc,EOB;TEOBResumS,nr_calibration_eobnr_seobnr_teobresums;spin_precession;eccentric_hyperbolic_scattering;data_analysis_lvkc
2023,2023-10-06,2310.04552,Effective-One-Body Numerical-Relativity waveform model for Eccentric spin-precessing binary black hole coalescence,Xiaolin Liu; Zhoujian Cao; Zong-Hong Zhu,https://arxiv.org/abs/2310.04552,gr-qc,effective-one-body;EOB;SEOBNR,nr_calibration_eobnr_seobnr_teobresums;spin_precession;eccentric_hyperbolic_scattering;data_analysis_lvkc
2023,2023-10-20,2310.13578,Effective-one-body waveforms for extreme-mass-ratio binaries: Consistency with second-order gravitational self-force quasicircular results and extension to nonprecessing spins and eccentricity,Angelica Albertini; Rossella Gamba; Alessandro Nagar; Sebastiano Bernuzzi,https://arxiv.org/abs/2310.13578,gr-qc,effective-one-body;EOB;TEOBResumS,foundations_hamiltonian_pn_pm;resummation_flux_waveform;nr_calibration_eobnr_seobnr_teobresums;gsf_gauge_invariants;spin_precession;eccentric_hyperbolic_scattering;emri_test_mass_teukolsky
2023,2023-11-19,2311.11311,Actively Learning Numerical Relativity,Tomas Andrade; Rossella Gamba; Juan Trenado,https://arxiv.org/abs/2311.11311,gr-qc;hep-th,TEOBResumS,nr_calibration_eobnr_seobnr_teobresums;data_analysis_lvkc
2023,2023-11-20,2311.11764,Microscopic State of BHs and an Exact One Body Method for Binary Dynamics in General Relativity,Ding-fang Zeng,https://arxiv.org/abs/2311.11764,gr-qc;hep-th,effective-one-body,foundations_hamiltonian_pn_pm;nr_calibration_eobnr_seobnr_teobresums
2023,2023-12-03,2312.01478,"Double copy, Kerr-Schild gauges and the Effective-One-Body formalism",Anna Ceresole; Thibault Damour; Alessandro Nagar; Piero Rettegno,https://arxiv.org/abs/2312.01478,gr-qc;hep-th,effective-one-body,foundations_hamiltonian_pn_pm;eccentric_hyperbolic_scattering
2024,2024-01-22,2401.12290,Gravitational spin-orbit coupling through the third-subleading post-Newtonian order: exploring spin-gauge flexibility,Andrea Placidi; Piero Rettegno; Alessandro Nagar,https://arxiv.org/abs/2401.12290,gr-qc,effective-one-body;EOB,foundations_hamiltonian_pn_pm;resummation_flux_waveform;gsf_gauge_invariants;spin_precession
2024,2024-02-09,2402.06781,A Survey of Four Precessing Waveform Models for Binary Black Hole Systems,Jake Mac Uilliam; Sarp Akcay; Jonathan E. Thompson,https://arxiv.org/abs/2402.06781,gr-qc;astro-ph.IM,SEOBNR;TEOBResumS,foundations_hamiltonian_pn_pm;nr_calibration_eobnr_seobnr_teobresums;spin_precession;data_analysis_lvkc
2024,2024-02-12,2402.08039,Parameter Estimation for Low-Mass Eccentric Black Hole Binaries,Katelyn J. Wagner; Richard O'Shaughnessy,https://arxiv.org/abs/2402.08039,gr-qc;astro-ph.IM,TEOBResumS,nr_calibration_eobnr_seobnr_teobresums;spin_precession;eccentric_hyperbolic_scattering;data_analysis_lvkc
2024,2024-02-14,2402.08883,Analytical model of precessing binaries using post-Newtonian theory in the extreme mass-ratio limit I: General Formalism,Nicholas Loutrel; Sajal Mukherjee; Andrea Maselli; Paolo Pani,https://arxiv.org/abs/2402.08883,gr-qc,effective-one-body,foundations_hamiltonian_pn_pm;nr_calibration_eobnr_seobnr_teobresums;gsf_gauge_invariants;spin_precession;emri_test_mass_teukolsky
2024,2024-02-19,2402.12342,Post-Minkowskian Theory Meets the Spinning Effective-One-Body Approach for Two-Body Scattering,Alessandra Buonanno; Gustav Uhre Jakobsen; Gustav Mogull,https://arxiv.org/abs/2402.12342,gr-qc;hep-th,effective-one-body;EOB,foundations_hamiltonian_pn_pm;resummation_flux_waveform;nr_calibration_eobnr_seobnr_teobresums;gsf_gauge_invariants;spin_precession;eccentric_hyperbolic_scattering;emri_test_mass_teukolsky;data_analysis_lvkc
2024,2024-02-29,2402.19397,Testing gravitational waveforms in full General Relativity,Fabio D'Ambrosio; Francesco Gozzini; Lavinia Heisenberg; Henri Inchauspé; David Maibach; Jann Zosso,https://arxiv.org/abs/2402.19397,gr-qc;astro-ph.CO;hep-ph;hep-th,EOB,nr_calibration_eobnr_seobnr_teobresums;spin_precession
2024,2024-03-14,2403.09211,Energy flux and waveforms by coalescing spinless binary system in effective one-body theory,Sheng Long; Weike Deng; Jiliang Jing,https://arxiv.org/abs/2403.09211,gr-qc;hep-th,effective-one-body,foundations_hamiltonian_pn_pm;resummation_flux_waveform;nr_calibration_eobnr_seobnr_teobresums;gsf_gauge_invariants;spin_precession
2024,2024-04-08,2404.05288,"Effective-one-body waveform model for non-circularized, planar, coalescing black hole binaries: the importance of radiation reaction",Alessandro Nagar; Rossella Gamba; Piero Rettegno; Veronica Fantini; Sebastiano Bernuzzi,https://arxiv.org/abs/2404.05288,gr-qc,effective-one-body;EOB;EOBNR;TEOBResumS,foundations_hamiltonian_pn_pm;resummation_flux_waveform;nr_calibration_eobnr_seobnr_teobresums;spin_precession;eccentric_hyperbolic_scattering;data_analysis_lvkc
2024,2024-04-23,2404.15408,"Towards efficient Effective One Body models for generic, non-planar orbits",Rossella Gamba; Danilo Chiaramello; Sayan Neogi,https://arxiv.org/abs/2404.15408,gr-qc,effective-one-body;EOB,foundations_hamiltonian_pn_pm;nr_calibration_eobnr_seobnr_teobresums;spin_precession;eccentric_hyperbolic_scattering
2024,2024-04-25,2404.16599,Waveform systematics in gravitational-wave inference of signals from binary neutron star merger models incorporating higher order modes information,A. B. Yelikar; R. O' Shaughnessy; J. Lange; A. Z. Jan,https://arxiv.org/abs/2404.16599,gr-qc,TEOBResumS,nr_calibration_eobnr_seobnr_teobresums;tides_neutron_stars;data_analysis_lvkc
2024,2024-04-29,2404.18875,Mapping eccentricity evolutions between numerical relativity and effective-one-body gravitational waveforms,Alice Bonino; Patricia Schmidt; Geraint Pratten,https://arxiv.org/abs/2404.18875,gr-qc,effective-one-body,foundations_hamiltonian_pn_pm;nr_calibration_eobnr_seobnr_teobresums;spin_precession;eccentric_hyperbolic_scattering
2024,2024-04-30,2405.00170,Self-force framework for transition-to-plunge waveforms,Lorenzo Küchler; Geoffrey Compère; Leanne Durkan; Adam Pound,https://arxiv.org/abs/2405.00170,gr-qc,effective-one-body,nr_calibration_eobnr_seobnr_teobresums;gsf_gauge_invariants;spin_precession;data_analysis_lvkc
2024,2024-05-03,2405.01991,Gaussian orbital perturbation theory in Schwarzschild space-time in terms of elliptic functions,Oleksii Yanchyshen; Claus Lämmerzahl,https://arxiv.org/abs/2405.01991,gr-qc,effective-one-body,foundations_hamiltonian_pn_pm;gsf_gauge_invariants
2024,2024-05-23,2405.15087,"Comparing eccentric waveform models based on post-Newtonian and effective-one-body approaches, over an observationally relevant parameter space",Balázs Kacskovics; Dániel Barta,https://arxiv.org/abs/2405.15087,gr-qc,effective-one-body;SEOBNR,foundations_hamiltonian_pn_pm;nr_calibration_eobnr_seobnr_teobresums;spin_precession;eccentric_hyperbolic_scattering
2024,2024-05-26,2405.16423,Energy flux and waveform of gravitational wave generated by coalescing slow-spinning binary system in effective one-body theory,Weike Deng; Sheng Long; Jiliang Jing,https://arxiv.org/abs/2405.16423,gr-qc,effective-one-body,resummation_flux_waveform;spin_precession;data_analysis_lvkc
2024,2024-05-29,2405.19006,Testing eccentric corrections to the radiation-reaction force in the test-mass limit of effective-one-body models,Guglielmo Faggioli; Maarten van de Meent; Alessandra Buonanno; Aldo Gamboa; Mohammed Khalil; Gaurav Khanna,https://arxiv.org/abs/2405.19006,gr-qc,effective-one-body,foundations_hamiltonian_pn_pm;resummation_flux_waveform;spin_precession;eccentric_hyperbolic_scattering;emri_test_mass_teukolsky
2024,2024-05-29,2405.19181,Post-Minkowskian Theory Meets the Spinning Effective-One-Body Approach for Bound-Orbit Waveforms,Alessandra Buonanno; Gustav Mogull; Raj Patil; Lorenzo Pompili,https://arxiv.org/abs/2405.19181,gr-qc;hep-th,effective-one-body;EOB;SEOBNR,foundations_hamiltonian_pn_pm;nr_calibration_eobnr_seobnr_teobresums;spin_precession;eccentric_hyperbolic_scattering;data_analysis_lvkc
2024,2024-05-30,2405.20398,Scattering and dynamical capture of two black holes: synergies between numerical and analytical methods,Simone Albanesi; Alireza Rashti; Francesco Zappa; Rossella Gamba; William Cook; Boris Daszuta; Sebastiano Bernuzzi; Alessandro Nagar; David Radice,https://arxiv.org/abs/2405.20398,gr-qc,effective-one-body;EOB;TEOBResumS,foundations_hamiltonian_pn_pm;nr_calibration_eobnr_seobnr_teobresums;spin_precession;eccentric_hyperbolic_scattering;emri_test_mass_teukolsky;data_analysis_lvkc
