year,published,arxiv_id,title,authors,url,categories,match_terms,technical_tags
2019,2019-10-02,1910.00784,Validating the Effective-One-Body Numerical-Relativity Waveform Models for Spin-aligned Binary Black Holes along Eccentric Orbits,Xiaolin Liu; Zhoujian Cao; Lijing Shao,https://arxiv.org/abs/1910.00784,gr-qc;astro-ph.GA;astro-ph.HE,effective-one-body;EOB;SEOBNR,nr_calibration_eobnr_seobnr_teobresums;spin_precession;eccentric_hyperbolic_scattering;data_analysis_lvkc
2019,2019-11-25,1911.10818,Comparing Effective One Body Hamiltonians for spin-aligned coalescing binaries,Piero Rettegno; Fabio Martinetti; Alessandro Nagar; Donato Bini; Gunnar Riemenschneider; Thibault Damour,https://arxiv.org/abs/1911.10818,gr-qc,effective-one-body;EOB;SEOBNR;TEOBResumS,foundations_hamiltonian_pn_pm;resummation_flux_waveform;nr_calibration_eobnr_seobnr_teobresums;gsf_gauge_invariants;spin_precession
2019,2019-12-04,1912.01920,Tidal effects in the equations of motion of compact binary systems to next-to-next-to-leading post-Newtonian order,Quentin Henry; Guillaume Faye; Luc Blanchet,https://arxiv.org/abs/1912.01920,gr-qc,effective-one-body;EOB,foundations_hamiltonian_pn_pm;resummation_flux_waveform;spin_precession;tides_neutron_stars
2019,2019-12-04,1912.02139,Classical and quantum scattering in post-Minkowskian gravity,Thibault Damour,https://arxiv.org/abs/1912.02139,gr-qc,effective-one-body;EOB,foundations_hamiltonian_pn_pm;nr_calibration_eobnr_seobnr_teobresums;gsf_gauge_invariants;eccentric_hyperbolic_scattering
2020,2020-01-19,2001.06763,Analytical effective-one-body formalism for extreme-mass-ratio inspirals: eccentric orbits,Chen Zhang; Wen-Biao Han; Shu-Cheng Yang,https://arxiv.org/abs/2001.06763,gr-qc,effective-one-body,foundations_hamiltonian_pn_pm;resummation_flux_waveform;nr_calibration_eobnr_seobnr_teobresums;eccentric_hyperbolic_scattering;emri_test_mass_teukolsky;data_analysis_lvkc
2020,2020-01-24,2001.09082,A multipolar effective one body waveform model for spin-aligned black hole binaries,Alessandro Nagar; Gunnar Riemenschneider; Geraint Pratten; Piero Rettegno; Francesco Messina,https://arxiv.org/abs/2001.09082,gr-qc,effective-one-body;EOB;TEOBResumS,resummation_flux_waveform;nr_calibration_eobnr_seobnr_teobresums;spin_precession;emri_test_mass_teukolsky;data_analysis_lvkc
2020,2020-01-29,2001.10914,IMRPhenomXHM: A multi-mode frequency-domain model for the gravitational wave signal from non-precessing black-hole binaries,Cecilio García-Quirós; Marta Colleoni; Sascha Husa; Héctor Estellés; Geraint Pratten; Antoni Ramos-Buades; Maite Mateu-Lucena; Rafel Jaume,https://arxiv.org/abs/2001.10914,gr-qc,effective-one-body,foundations_hamiltonian_pn_pm;nr_calibration_eobnr_seobnr_teobresums;spin_precession;emri_test_mass_teukolsky
2020,2020-01-30,2001.11470,Distinguishing high-mass binary neutron stars from binary black holes with second- and third-generation gravitational wave observatories,An Chen; Nathan K. Johnson-McDaniel; Tim Dietrich; Reetika Dudi,https://arxiv.org/abs/2001.11470,astro-ph.HE;astro-ph.SR;gr-qc,effective-one-body,nr_calibration_eobnr_seobnr_teobresums;spin_precession;tides_neutron_stars;data_analysis_lvkc
2020,2020-01-31,2001.11736,"A faithful analytical effective one body waveform model for spin-aligned, moderately eccentric, coalescing black hole binaries",Danilo Chiaramello; Alessandro Nagar,https://arxiv.org/abs/2001.11736,gr-qc,effective-one-body;EOB;TEOBResumS,foundations_hamiltonian_pn_pm;resummation_flux_waveform;nr_calibration_eobnr_seobnr_teobresums;spin_precession;eccentric_hyperbolic_scattering;data_analysis_lvkc
2020,2020-02-20,2002.08682,Investigating eccentricities of the binary black hole signals from the LIGO-Virgo catalog GWTC-1,Qian-Yun Yun; Wen-Biao Han; Gang Wang; Shu-Cheng Yang,https://arxiv.org/abs/2002.08682,gr-qc,SEOBNR,nr_calibration_eobnr_seobnr_teobresums;spin_precession;eccentric_hyperbolic_scattering;data_analysis_lvkc
2020,2020-03-03,2003.01692,Fourth post-Newtonian Hamiltonian dynamics of two-body systems from an effective field theory approach,J. Blümlein; A. Maier; P. Marquard; G. Schäfer,https://arxiv.org/abs/2003.01692,gr-qc;astro-ph.HE;hep-th,effective-one-body;EOB,foundations_hamiltonian_pn_pm;nr_calibration_eobnr_seobnr_teobresums
2020,2020-03-10,2003.04469,Fourth post-Newtonian effective-one-body Hamiltonians with generic spins,Mohammed Khalil; Jan Steinhoff; Justin Vines; Alessandra Buonanno,https://arxiv.org/abs/2003.04469,gr-qc,effective-one-body;EOB,foundations_hamiltonian_pn_pm;nr_calibration_eobnr_seobnr_teobresums;spin_precession;tides_neutron_stars;data_analysis_lvkc
2020,2020-03-14,2003.06600,Complete Hamiltonian for spinning binary systems at first post-Minkowskian order,Ming-Zhi Chung; Yu-tin Huang; Jung-Wook Kim; Sangmin Lee,https://arxiv.org/abs/2003.06600,hep-th;gr-qc,effective-one-body,foundations_hamiltonian_pn_pm;nr_calibration_eobnr_seobnr_teobresums;spin_precession
2020,2020-03-16,2003.07145,Testing binary dynamics in gravity at the sixth post-Newtonian level,J. Blümlein; A. Maier; P. Marquard; G. Schäfer,https://arxiv.org/abs/2003.07145,gr-qc;astro-ph.SR;hep-th,EOB,foundations_hamiltonian_pn_pm;nr_calibration_eobnr_seobnr_teobresums;eccentric_hyperbolic_scattering
2020,2020-03-26,2003.11891,Binary dynamics at the fifth and fifth-and-a-half post-Newtonian orders,Donato Bini; Thibault Damour; Andrea Geralico,https://arxiv.org/abs/2003.11891,gr-qc;hep-th,effective-one-body,foundations_hamiltonian_pn_pm;resummation_flux_waveform;gsf_gauge_invariants;eccentric_hyperbolic_scattering
2020,2020-03-26,2003.12079,Frequency domain reduced order model of aligned-spin effective-one-body waveforms with higher-order modes,Roberto Cotesta; Sylvain Marsat; Michael Pürrer,https://arxiv.org/abs/2003.12079,gr-qc,effective-one-body;EOB;SEOBNR,nr_calibration_eobnr_seobnr_teobresums;spin_precession;eccentric_hyperbolic_scattering;data_analysis_lvkc
2020,2020-04-11,2004.05407,Sixth post-Newtonian local-in-time dynamics of binary systems,Donato Bini; Thibault Damour; Andrea Geralico,https://arxiv.org/abs/2004.05407,gr-qc,effective-one-body,foundations_hamiltonian_pn_pm;resummation_flux_waveform;gsf_gauge_invariants;eccentric_hyperbolic_scattering
2020,2020-04-20,2004.09288,An alternative interpretation of GW190412 as a binary black hole merger with a rapidly spinning secondary,Ilya Mandel; Tassos Fragos,https://arxiv.org/abs/2004.09288,astro-ph.HE;astro-ph.SR;gr-qc,EOBNR,nr_calibration_eobnr_seobnr_teobresums;spin_precession;data_analysis_lvkc
2020,2020-04-20,2004.09442,Multipolar Effective-One-Body Waveforms for Precessing Binary Black Holes: Construction and Validation,Serguei Ossokine; Alessandra Buonanno; Sylvain Marsat; Roberto Cotesta; Stanislav Babak; Tim Dietrich; Roland Haas; Ian Hinder; Harald P. Pfeiffer; Michael Pürrer; Charles J. Woodford; Michael Boyle; et al.,https://arxiv.org/abs/2004.09442,gr-qc,effective-one-body;EOB;SEOBNR,resummation_flux_waveform;nr_calibration_eobnr_seobnr_teobresums;spin_precession;data_analysis_lvkc
2020,2020-04-21,2004.10001,An aligned-spin neutron-star--black-hole waveform model based on the effective-one-body approach and numerical-relativity simulations,Andrew Matas; Tim Dietrich; Alessandra Buonanno; Tanja Hinderer; Michael Pürrer; Francois Foucart; Michael Boyle; Matthew D. Duez; Lawrence E. Kidder; Harald P. Pfeiffer; Mark A. Scheel,https://arxiv.org/abs/2004.10001,gr-qc,effective-one-body,resummation_flux_waveform;nr_calibration_eobnr_seobnr_teobresums;gsf_gauge_invariants;spin_precession;tides_neutron_stars;data_analysis_lvkc
2020,2020-05-11,2005.05338,A hybrid post-Newtonian -- effective-one-body scheme for spin-precessing compact-binary waveforms,Sarp Akcay; Rossella Gamba; Sebastiano Bernuzzi,https://arxiv.org/abs/2005.05338,gr-qc,effective-one-body;SEOBNR;TEOBResumS,foundations_hamiltonian_pn_pm;nr_calibration_eobnr_seobnr_teobresums;spin_precession;data_analysis_lvkc
2020,2020-08-23,2008.09957,Investigating the effect of in-plane spin directions for Precessing BBH systems,Chinmay Kalaghatgi; Mark Hannam,https://arxiv.org/abs/2008.09957,gr-qc,SEOBNR,nr_calibration_eobnr_seobnr_teobresums;spin_precession;data_analysis_lvkc
2020,2020-09-14,2009.06351,Inferring the gravitational wave memory for binary coalescence events,Neev Khera; Badri Krishnan; Abhay Ashtekar; Tommaso De Lorenzo,https://arxiv.org/abs/2009.06351,gr-qc,effective-one-body,spin_precession;eccentric_hyperbolic_scattering;data_analysis_lvkc
2020,2020-09-27,2009.12857,Effective-one-body waveforms from dynamical captures in black hole binaries,Alessandro Nagar; Piero Rettegno; Rossella Gamba; Sebastiano Bernuzzi,https://arxiv.org/abs/2009.12857,gr-qc;astro-ph.HE,effective-one-body;EOB,foundations_hamiltonian_pn_pm;resummation_flux_waveform;nr_calibration_eobnr_seobnr_teobresums;spin_precession;eccentric_hyperbolic_scattering;data_analysis_lvkc
2020,2020-10-02,2010.02018,Gravitational spin-orbit and aligned spin$_1$-spin$_2$ couplings through third-subleading post-Newtonian orders,Andrea Antonelli; Chris Kavanagh; Mohammed Khalil; Jan Steinhoff; Justin Vines,https://arxiv.org/abs/2010.02018,gr-qc,effective-one-body,foundations_hamiltonian_pn_pm;gsf_gauge_invariants;spin_precession;eccentric_hyperbolic_scattering
2020,2020-11-03,2011.01958,Machine Learning Gravitational Waves from Binary Black Hole Mergers,Stefano Schmidt; Matteo Breschi; Rossella Gamba; Giulia Pagano; Piero Rettegno; Gunnar Riemenschneider; Sebastiano Bernuzzi; Alessandro Nagar; Walter Del Pozzo,https://arxiv.org/abs/2011.01958,gr-qc,effective-one-body;SEOBNR;TEOBResumS,nr_calibration_eobnr_seobnr_teobresums;spin_precession;data_analysis_lvkc
2020,2020-11-26,2011.13286,Higher-order effects in the dynamics of hierarchical triple systems. Quadrupole-squared terms,Clifford M. Will,https://arxiv.org/abs/2011.13286,astro-ph.EP;astro-ph.GA;astro-ph.SR;gr-qc,effective-one-body,resummation_flux_waveform;nr_calibration_eobnr_seobnr_teobresums
2020,2020-11-30,2012.00027,"Fast, faithful, frequency-domain effective-one-body waveforms for compact binary coalescences",Rossella Gamba; Sebastiano Bernuzzi; Alessandro Nagar,https://arxiv.org/abs/2012.00027,gr-qc;astro-ph.HE,effective-one-body,foundations_hamiltonian_pn_pm;resummation_flux_waveform;nr_calibration_eobnr_seobnr_teobresums;tides_neutron_stars
2020,2020-12-02,2012.01350,Post-Newtonian templates for gravitational waves from compact binary inspirals,Soichiro Isoyama; Riccardo Sturani; Hiroyuki Nakano,https://arxiv.org/abs/2012.01350,gr-qc;astro-ph.HE,effective-one-body,foundations_hamiltonian_pn_pm;resummation_flux_waveform;nr_calibration_eobnr_seobnr_teobresums;spin_precession;data_analysis_lvkc
2020,2020-12-13,2012.07147,Up-down instability of binary black holes in numerical relativity,Vijay Varma; Matthew Mould; Davide Gerosa; Mark A. Scheel; Lawrence E. Kidder; Harald P. Pfeiffer,https://arxiv.org/abs/2012.07147,gr-qc;astro-ph.HE,effective-one-body,foundations_hamiltonian_pn_pm;nr_calibration_eobnr_seobnr_teobresums;spin_precession
2021,2021-01-14,2101.05685,Deep Learning Model on Gravitational Waveforms in Merging and Ringdown Phases of Binary Black Hole Coalescences,Joongoo Lee; Sang Hoon Oh; Kyungmin Kim; Gihyuk Cho; John J. Oh; Edwin J. Son; Hyung Mok Lee,https://arxiv.org/abs/2101.05685,astro-ph.IM;gr-qc,effective-one-body,nr_calibration_eobnr_seobnr_teobresums;spin_precession;data_analysis_lvkc
2021,2021-01-17,2101.06685,Deep Generative Models of Gravitational Waveforms via Conditional Autoencoder,Chung-Hao Liao; Feng-Li Lin,https://arxiv.org/abs/2101.06685,astro-ph.IM;astro-ph.HE;gr-qc;hep-th,EOBNR,nr_calibration_eobnr_seobnr_teobresums;data_analysis_lvkc
2021,2021-01-20,2101.08289,GRAthena++: puncture evolutions on vertex-centered oct-tree AMR,Boris Daszuta; Francesco Zappa; William Cook; David Radice; Sebastiano Bernuzzi; Viktoriya Morozova,https://arxiv.org/abs/2101.08289,gr-qc;astro-ph.HE,effective-one-body,nr_calibration_eobnr_seobnr_teobresums;tides_neutron_stars
2021,2021-01-21,2101.08624,"Effective one body multipolar waveform model for spin-aligned, quasi-circular, eccentric, hyperbolic black hole binaries",Alessandro Nagar; Alice Bonino; Piero Rettegno,https://arxiv.org/abs/2101.08624,gr-qc,effective-one-body;EOB,foundations_hamiltonian_pn_pm;resummation_flux_waveform;nr_calibration_eobnr_seobnr_teobresums;spin_precession;eccentric_hyperbolic_scattering;data_analysis_lvkc
2021,2021-01-29,2102.00017,"${\tt bajes}$: Bayesian inference of multimessenger astrophysical data, methods and application to gravitational-waves",Matteo Breschi; Rossella Gamba; Sebastiano Bernuzzi,https://arxiv.org/abs/2102.00017,gr-qc;astro-ph.HE,effective-one-body;TEOBResumS,foundations_hamiltonian_pn_pm;nr_calibration_eobnr_seobnr_teobresums;tides_neutron_stars;data_analysis_lvkc
2021,2021-02-10,2102.05391,Geometrized effective-one-body formalism for extreme-mass-ratio limits: Generic orbits,Chen Zhang; Wen-Biao Han; Xing-Yu Zhong; Gang Wang,https://arxiv.org/abs/2102.05391,gr-qc,effective-one-body,resummation_flux_waveform;eccentric_hyperbolic_scattering;emri_test_mass_teukolsky;data_analysis_lvkc
2021,2021-02-17,2102.08614,A higher-multipole gravitational waveform model for an eccentric binary black holes based on the effective-one-body-numerical-relativity formalism,Xiaolin Liu; Zhoujian Cao; Zong-Hong Zhu,https://arxiv.org/abs/2102.08614,gr-qc,effective-one-body;EOB;SEOBNR,resummation_flux_waveform;nr_calibration_eobnr_seobnr_teobresums;spin_precession;eccentric_hyperbolic_scattering;data_analysis_lvkc
2021,2021-04-05,2104.01906,Constraints on quasi-normal-mode frequencies with LIGO-Virgo binary-black-hole observations,Abhirup Ghosh; Richard Brito; Alessandra Buonanno,https://arxiv.org/abs/2104.01906,gr-qc;astro-ph.HE,effective-one-body,nr_calibration_eobnr_seobnr_teobresums;spin_precession;data_analysis_lvkc
2021,2021-04-08,2104.03789,A surrogate model for gravitational waveforms of spin-aligned binary black holes with eccentricities,Qianyun Yun; Wen-Biao Han; Xingyu Zhong; Carlos A. Benavides-Gallego,https://arxiv.org/abs/2104.03789,gr-qc,SEOBNR,nr_calibration_eobnr_seobnr_teobresums;spin_precession;eccentric_hyperbolic_scattering;data_analysis_lvkc
2021,2021-04-15,2104.07533,TEOBResumS: assessment of consistent next-to-quasicircular corrections and post-adiabatic approximation in multipolar binary black holes waveforms,Gunnar Riemenschneider; Piero Rettegno; Matteo Breschi; Angelica Albertini; Rossella Gamba; Sebastiano Bernuzzi; Alessandro Nagar,https://arxiv.org/abs/2104.07533,gr-qc,effective-one-body;EOB;TEOBResumS,foundations_hamiltonian_pn_pm;resummation_flux_waveform;nr_calibration_eobnr_seobnr_teobresums;data_analysis_lvkc
2021,2021-04-21,2104.10559,Effective one-body model for extreme-mass-ratio spinning binaries on eccentric equatorial orbits: testing radiation reaction and waveform,Simone Albanesi; Alessandro Nagar; Sebastiano Bernuzzi,https://arxiv.org/abs/2104.10559,gr-qc,effective-one-body;EOB,resummation_flux_waveform;nr_calibration_eobnr_seobnr_teobresums;spin_precession;eccentric_hyperbolic_scattering;emri_test_mass_teukolsky
2021,2021-04-23,2104.11705,"Radiation-reaction force and multipolar waveforms for eccentric, spin-aligned binaries in the effective-one-body formalism",Mohammed Khalil; Alessandra Buonanno; Jan Steinhoff; Justin Vines,https://arxiv.org/abs/2104.11705,gr-qc,effective-one-body;EOB;SEOBNR,foundations_hamiltonian_pn_pm;resummation_flux_waveform;nr_calibration_eobnr_seobnr_teobresums;spin_precession;eccentric_hyperbolic_scattering;data_analysis_lvkc
2021,2021-04-24,2104.11848,Black-Hole Perturbation Plus Post-Newtonian Theory: Hybrid Waveform for Neutron Star Binaries,Xuefeng Feng; Zhenwei Lyu; Huan Yang,https://arxiv.org/abs/2104.11848,gr-qc,effective-one-body;EOB,foundations_hamiltonian_pn_pm;resummation_flux_waveform;nr_calibration_eobnr_seobnr_teobresums;spin_precession;tides_neutron_stars
2021,2021-05-12,2105.05630,Time-domain metric reconstruction for hyperbolic scattering,Oliver Long; Leor Barack,https://arxiv.org/abs/2105.05630,gr-qc;astro-ph.HE,effective-one-body,foundations_hamiltonian_pn_pm;nr_calibration_eobnr_seobnr_teobresums;gsf_gauge_invariants;eccentric_hyperbolic_scattering;emri_test_mass_teukolsky
2021,2021-05-14,2105.06983,Fast post-adiabatic waveforms in the time domain: Applications to compact binary coalescences in LIGO and Virgo,Deyan P. Mihaylov; Serguei Ossokine; Alessandra Buonanno; Abhirup Ghosh,https://arxiv.org/abs/2105.06983,gr-qc,effective-one-body;EOB,foundations_hamiltonian_pn_pm;resummation_flux_waveform;spin_precession;tides_neutron_stars;data_analysis_lvkc
2021,2021-07-19,2107.08876,The final twist: A model of gravitational waves from precessing black-hole binaries through merger and ringdown,Eleanor Hamilton; Lionel London; Jonathan E. Thompson; Edward Fauchon-Jones; Mark Hannam; Chinmay Kalaghatgi; Sebastian Khan; Francesco Pannarale; Alex Vano-Vinuales,https://arxiv.org/abs/2107.08876,gr-qc,EOBNR,nr_calibration_eobnr_seobnr_teobresums;spin_precession;data_analysis_lvkc
2021,2021-08-03,2108.01284,Signs of eccentricity in two gravitational-wave signals may indicate a sub-population of dynamically assembled binary black holes,Isobel M. Romero-Shaw; Paul D. Lasky; Eric Thrane,https://arxiv.org/abs/2108.01284,astro-ph.HE,SEOBNR,nr_calibration_eobnr_seobnr_teobresums;spin_precession;eccentric_hyperbolic_scattering;data_analysis_lvkc
2021,2021-08-04,2108.02043,"The next generation: Impact of high-order analytical information on effective one body waveform models for noncircularized, spin-aligned black hole binaries",Alessandro Nagar; Piero Rettegno,https://arxiv.org/abs/2108.02043,gr-qc,effective-one-body;EOB;TEOBResumS,foundations_hamiltonian_pn_pm;nr_calibration_eobnr_seobnr_teobresums;spin_precession;eccentric_hyperbolic_scattering
2021,2021-08-25,2108.11248,Remodeling the Effective One-Body Formalism in Post-Minkowskian Gravity,Poul H. Damgaard; Pierre Vanhove,https://arxiv.org/abs/2108.11248,hep-th;gr-qc,effective-one-body,foundations_hamiltonian_pn_pm;eccentric_hyperbolic_scattering
2021,2021-10-25,2110.12813,Gravitational spin-orbit dynamics at the fifth-and-a-half post-Newtonian order,Mohammed Khalil,https://arxiv.org/abs/2110.12813,gr-qc,effective-one-body,foundations_hamiltonian_pn_pm;nr_calibration_eobnr_seobnr_teobresums;gsf_gauge_invariants;spin_precession;eccentric_hyperbolic_scattering;data_analysis_lvkc
2021,2021-10-26,2110.13822,The fifth-order post-Newtonian Hamiltonian dynamics of two-body systems from an effective field theory approach,J. Blümlein; A. Maier; P. Marquard; G. Schäfer,https://arxiv.org/abs/2110.13822,gr-qc,effective-one-body;EOB,foundations_hamiltonian_pn_pm;nr_calibration_eobnr_seobnr_teobresums;gsf_gauge_invariants;eccentric_hyperbolic_scattering
2021,2021-11-05,2111.03675,Effective-one-body waveforms for precessing coalescing compact binaries with post-newtonian Twist,Rossella Gamba; Sarp Akçay; Sebastiano Bernuzzi; Jake Williams,https://arxiv.org/abs/2111.03675,gr-qc;astro-ph.HE,effective-one-body;EOB,foundations_hamiltonian_pn_pm;nr_calibration_eobnr_seobnr_teobresums;spin_precession;tides_neutron_stars;data_analysis_lvkc
2021,2021-11-28,2111.14149,"Waveforms and fluxes: Towards a self-consistent effective one body waveform model for nonprecessing, coalescing black-hole binaries for third generation detectors",Angelica Albertini; Alessandro Nagar; Piero Rettegno; Simone Albanesi; Rossella Gamba,https://arxiv.org/abs/2111.14149,gr-qc,effective-one-body;EOB;TEOBResumS,resummation_flux_waveform;nr_calibration_eobnr_seobnr_teobresums;spin_precession;data_analysis_lvkc
2021,2021-12-10,2112.05448,"Exploiting Newton-factorized, 2PN-accurate, waveform multipoles in effective-one-body models for spin-aligned noncircularized binaries",Andrea Placidi; Simone Albanesi; Alessandro Nagar; Marta Orselli; Sebastiano Bernuzzi; Gianluca Grignani,https://arxiv.org/abs/2112.05448,gr-qc,effective-one-body;EOB,foundations_hamiltonian_pn_pm;resummation_flux_waveform;nr_calibration_eobnr_seobnr_teobresums;spin_precession;eccentric_hyperbolic_scattering;emri_test_mass_teukolsky
2021,2021-12-13,2112.06952,Effective-one-body multipolar waveforms for eccentric binary black holes with non-precessing spins,Antoni Ramos-Buades; Alessandra Buonanno; Mohammed Khalil; Serguei Ossokine,https://arxiv.org/abs/2112.06952,gr-qc;astro-ph.HE,effective-one-body;SEOBNR,resummation_flux_waveform;nr_calibration_eobnr_seobnr_teobresums;spin_precession;eccentric_hyperbolic_scattering;data_analysis_lvkc
2021,2021-12-18,2112.09838,Self-consistent Effective-one-body theory for spinless binaries based on post-Minkowskian approximation I: Hamiltonian and decoupled equation for $ψ^B_{4}$,Jiliang Jing; Shuai Chen; Manman Sun; Xiaokai He; Mengjie Wang; Jieci Wang,https://arxiv.org/abs/2112.09838,gr-qc,effective-one-body;EOB,foundations_hamiltonian_pn_pm;spin_precession
2022,2022-01-04,2201.01259,Gauge Invariant Perturbations of General Spherically Symmetric Spacetimes,Wentao Liu; Xiongjun Fang; Jiliang Jing; Anzhong Wang,https://arxiv.org/abs/2201.01259,gr-qc,effective-one-body,gsf_gauge_invariants
2022,2022-01-10,2201.03428,Multipolar gravitational waveforms for spinning binary black holes and their impact on source characterization,Roberto Cotesta,https://arxiv.org/abs/2201.03428,gr-qc,effective-one-body,resummation_flux_waveform;nr_calibration_eobnr_seobnr_teobresums;spin_precession;tides_neutron_stars;data_analysis_lvkc
2022,2022-02-11,2202.05643,Numerical-relativity validation of effective-one-body waveforms in the intermediate-mass-ratio regime,Alessandro Nagar; James Healy; Carlos O. Lousto; Sebastiano Bernuzzi; Angelica Albertini,https://arxiv.org/abs/2202.05643,gr-qc,effective-one-body;EOB;TEOBResumS,foundations_hamiltonian_pn_pm;resummation_flux_waveform;nr_calibration_eobnr_seobnr_teobresums;emri_test_mass_teukolsky
2022,2022-02-21,2202.10063,Assessment of Effective-One-Body Radiation Reactions for Generic Planar Orbits,Simone Albanesi; Alessandro Nagar; Sebastiano Bernuzzi; Andrea Placidi; Marta Orselli,https://arxiv.org/abs/2202.10063,gr-qc,effective-one-body;EOB,foundations_hamiltonian_pn_pm;resummation_flux_waveform;eccentric_hyperbolic_scattering;emri_test_mass_teukolsky
2022,2022-03-01,2203.00381,A fully precessing higher-mode surrogate model of effective-one-body waveforms,Bhooshan Gadre; Michael Pürrer; Scott E. Field; Serguei Ossokine; Vijay Varma,https://arxiv.org/abs/2203.00381,gr-qc,effective-one-body;SEOBNR,nr_calibration_eobnr_seobnr_teobresums;spin_precession;data_analysis_lvkc
2022,2022-03-30,2203.16286,New Avenue for Accurate Analytical Waveforms and Fluxes for Eccentric Compact Binaries,Simone Albanesi; Andrea Placidi; Alessandro Nagar; Marta Orselli; Sebastiano Bernuzzi,https://arxiv.org/abs/2203.16286,gr-qc,effective-one-body;EOB,foundations_hamiltonian_pn_pm;resummation_flux_waveform;spin_precession;eccentric_hyperbolic_scattering;emri_test_mass_teukolsky;data_analysis_lvkc
2022,2022-04-11,2204.05047,Energetics and scattering of gravitational two-body systems at fourth post-Minkowskian order,Mohammed Khalil; Alessandra Buonanno; Jan Steinhoff; Justin Vines,https://arxiv.org/abs/2204.05047,gr-qc,effective-one-body;EOB,foundations_hamiltonian_pn_pm;nr_calibration_eobnr_seobnr_teobresums;eccentric_hyperbolic_scattering;data_analysis_lvkc
2022,2022-04-21,2204.10299,Strong-field scattering of two spinning black holes: Numerics versus Analytics,Seth Hopper; Alessandro Nagar; Piero Rettegno,https://arxiv.org/abs/2204.10299,gr-qc,effective-one-body,foundations_hamiltonian_pn_pm;nr_calibration_eobnr_seobnr_teobresums;spin_precession;eccentric_hyperbolic_scattering
2022,2022-05-10,2205.05132,Black-hole ringdown as a probe of higher-curvature gravity theories,Hector O. Silva; Abhirup Ghosh; Alessandra Buonanno,https://arxiv.org/abs/2205.05132,gr-qc;astro-ph.HE;hep-th,effective-one-body,nr_calibration_eobnr_seobnr_teobresums;spin_precession;data_analysis_lvkc
2022,2022-06-22,2206.10966,Resonant Islands of Effective-One-Body Dynamics,Che-Yu Chen; Feng-Li Lin; Avani Patel,https://arxiv.org/abs/2206.10966,gr-qc;astro-ph.HE;hep-th,effective-one-body;EOB,foundations_hamiltonian_pn_pm;spin_precession
2022,2022-06-28,2206.14006,Gravitational-wave inference for eccentric binaries: the argument of periapsis,Teagan A. Clarke; Isobel M. Romero-Shaw; Paul D. Lasky; Eric Thrane,https://arxiv.org/abs/2206.14006,gr-qc;astro-ph.HE,SEOBNR;TEOBResumS,nr_calibration_eobnr_seobnr_teobresums;spin_precession;eccentric_hyperbolic_scattering;data_analysis_lvkc
2022,2022-07-21,2207.10474,Inferring eccentricity evolution from observations of coalescing binary black holes,Alice Bonino; Rossella Gamba; Patricia Schmidt; Alessandro Nagar; Geraint Pratten; Matteo Breschi; Piero Rettegno; Sebastiano Bernuzzi,https://arxiv.org/abs/2207.10474,gr-qc,TEOBResumS,nr_calibration_eobnr_seobnr_teobresums;spin_precession;eccentric_hyperbolic_scattering;data_analysis_lvkc
2022,2022-07-26,2207.13106,Resonant tides in binary neutron star mergers: analytical-numerical relativity study,Rossella Gamba; Sebastiano Bernuzzi,https://arxiv.org/abs/2207.13106,gr-qc;astro-ph.HE,effective-one-body;EOB;TEOBResumS,resummation_flux_waveform;nr_calibration_eobnr_seobnr_teobresums;tides_neutron_stars;eccentric_hyperbolic_scattering;data_analysis_lvkc
2022,2022-07-28,2207.14002,"Towards a gravitational self force-informed effective-one-body waveform model for nonprecessing, eccentric, large-mass-ratio inspirals",Alessandro Nagar; Simone Albanesi,https://arxiv.org/abs/2207.14002,gr-qc;astro-ph.HE,effective-one-body;EOB;TEOBResumS,foundations_hamiltonian_pn_pm;resummation_flux_waveform;nr_calibration_eobnr_seobnr_teobresums;gsf_gauge_invariants;spin_precession;eccentric_hyperbolic_scattering;data_analysis_lvkc
