year,published,arxiv_id,title,authors,url,categories,match_terms,technical_tags
2016,2016-04-04,1604.00782,Simulations of inspiraling and merging double neutron stars using the Spectral Einstein Code,Roland Haas; Christian D. Ott; Bela Szilagyi; Jeffrey D. Kaplan; Jonas Lippuner; Mark A. Scheel; Kevin Barkett; Curran D. Muhlberger; Tim Dietrich; Matthew D. Duez; Francois Foucart; Harald P. Pfeiffer; et al.,https://arxiv.org/abs/1604.00782,gr-qc,effective-one-body,nr_calibration_eobnr_seobnr_teobresums;tides_neutron_stars;data_analysis_lvkc
2016,2016-06-01,1606.00207,iResum: a new paradigm for resumming gravitational wave amplitudes,Alessandro Nagar; Abhay G. Shah,https://arxiv.org/abs/1606.00207,gr-qc,effective-one-body;EOB;EOBNR,foundations_hamiltonian_pn_pm;resummation_flux_waveform;nr_calibration_eobnr_seobnr_teobresums;spin_precession;emri_test_mass_teukolsky
2016,2016-06-03,1606.01210,An improved analysis of GW150914 using a fully spin-precessing waveform model, The LIGO Scientific Collaboration;  the Virgo Collaboration; B. P. Abbott; R. Abbott; T. D. Abbott; M. R. Abernathy; F. Acernese; K. Ackley; C. Adams; T. Adams; P. Addesso; R. X. Adhikari; et al.,https://arxiv.org/abs/1606.01210,gr-qc;astro-ph.HE,effective-one-body;EOB;EOBNR,nr_calibration_eobnr_seobnr_teobresums;spin_precession;data_analysis_lvkc
2016,2016-07-19,1607.05661,"Validating the effective-one-body model of spinning, precessing binary black holes against numerical relativity",Stanislav Babak; Andrea Taracchini; Alessandra Buonanno,https://arxiv.org/abs/1607.05661,gr-qc,effective-one-body;EOB;EOBNR,nr_calibration_eobnr_seobnr_teobresums;spin_precession;data_analysis_lvkc
2016,2016-08-05,1608.01907,Dynamical Tides in General Relativity: Effective Action and Effective-One-Body Hamiltonian,Jan Steinhoff; Tanja Hinderer; Alessandra Buonanno; Andrea Taracchini,https://arxiv.org/abs/1608.01907,gr-qc;astro-ph.HE,effective-one-body,foundations_hamiltonian_pn_pm;tides_neutron_stars;data_analysis_lvkc
2016,2016-08-16,1608.04811,Spin-orbit precession for eccentric black hole binaries at first order in the mass ratio,Sarp Akcay; David Dempsey; Sam Dolan,https://arxiv.org/abs/1608.04811,gr-qc,effective-one-body,foundations_hamiltonian_pn_pm;gsf_gauge_invariants;spin_precession;eccentric_hyperbolic_scattering
2016,2016-09-01,1609.00354,"Gravitational scattering, post-Minkowskian approximation and Effective One-Body theory",Thibault Damour,https://arxiv.org/abs/1609.00354,gr-qc,effective-one-body,foundations_hamiltonian_pn_pm;eccentric_hyperbolic_scattering
2016,2016-09-01,1609.00356,Spinning test-body orbiting around Schwarzschild black hole: circular dynamics and gravitational-wave fluxes,Enno Harms; Georgios Lukes-Gerakopoulos; Sebastiano Bernuzzi; Alessandro Nagar,https://arxiv.org/abs/1609.00356,gr-qc,effective-one-body,foundations_hamiltonian_pn_pm;resummation_flux_waveform;nr_calibration_eobnr_seobnr_teobresums;gsf_gauge_invariants;spin_precession;emri_test_mass_teukolsky
2016,2016-09-08,1609.02604,On gravitational waves from classical three body problem,Plamen P Fiziev,https://arxiv.org/abs/1609.02604,astro-ph.HE;gr-qc;hep-th,effective-one-body,nr_calibration_eobnr_seobnr_teobresums
2016,2016-09-19,1609.05933,Complete waveform model for compact binaries on eccentric orbits,E. A. Huerta; Prayush Kumar; Bhanu Agarwal; Daniel George; Hsi-Yu Schive; Harald P. Pfeiffer; Roland Haas; Wei Ren; Tony Chu; Michael Boyle; Daniel A. Hemberger; Lawrence E. Kidder; et al.,https://arxiv.org/abs/1609.05933,gr-qc;astro-ph.GA;astro-ph.HE,effective-one-body,foundations_hamiltonian_pn_pm;resummation_flux_waveform;nr_calibration_eobnr_seobnr_teobresums;gsf_gauge_invariants;spin_precession;eccentric_hyperbolic_scattering;data_analysis_lvkc
2016,2016-09-22,1609.06817,Fast Evolution and Waveform Generator for Extreme-Mass-Ratio Inspirals in Equatorial-Circular Orbits,Wen-Biao Han,https://arxiv.org/abs/1609.06817,gr-qc,effective-one-body;EOB,foundations_hamiltonian_pn_pm;resummation_flux_waveform;nr_calibration_eobnr_seobnr_teobresums;spin_precession;emri_test_mass_teukolsky;data_analysis_lvkc
2016,2016-10-15,1610.04742,Effective-one-body waveforms for binary neutron stars using surrogate models,Benjamin D. Lackey; Sebastiano Bernuzzi; Chad R. Galley; Jeroen Meidam; Chris Van Den Broeck,https://arxiv.org/abs/1610.04742,gr-qc,effective-one-body,nr_calibration_eobnr_seobnr_teobresums;spin_precession;tides_neutron_stars;data_analysis_lvkc
2016,2016-11-11,1611.03703,"An improved effective-one-body model of spinning, nonprecessing binary black holes for the era of gravitational-wave astrophysics with advanced detectors",Alejandro Bohé; Lijing Shao; Andrea Taracchini; Alessandra Buonanno; Stanislav Babak; Ian W. Harry; Ian Hinder; Serguei Ossokine; Michael Pürrer; Vivien Raymond; Tony Chu; Heather Fong; et al.,https://arxiv.org/abs/1611.03703,gr-qc,effective-one-body;EOB;EOBNR,nr_calibration_eobnr_seobnr_teobresums;spin_precession;data_analysis_lvkc
2016,2016-12-16,1612.05608,Effects of nonquadrupole modes in the detection and parameter estimation of black hole binaries with nonprecessing spins,Vijay Varma; Parameswaran Ajith,https://arxiv.org/abs/1612.05608,gr-qc,effective-one-body,foundations_hamiltonian_pn_pm;nr_calibration_eobnr_seobnr_teobresums;spin_precession;data_analysis_lvkc
2017,2017-01-04,1701.01137,An architecture for efficient gravitational wave parameter estimation with multimodal linear surrogate models,Richard O'Shaughnessy; Jonathan Blackman; Scott E. Field,https://arxiv.org/abs/1701.01137,gr-qc,effective-one-body,nr_calibration_eobnr_seobnr_teobresums;data_analysis_lvkc
2017,2017-02-07,1702.02053,Comprehensive numerical relativity -- effective-one-body comparison to inform improvements in waveform models for binary neutron star systems,Tim Dietrich; Tanja Hinderer,https://arxiv.org/abs/1702.02053,gr-qc;astro-ph.HE,effective-one-body;EOB,nr_calibration_eobnr_seobnr_teobresums;gsf_gauge_invariants;spin_precession;tides_neutron_stars
2017,2017-03-15,1703.05360,Two-body problem in Scalar-Tensor theories as a deformation of General Relativity : an Effective-One-Body approach,Félix-Louis Julié; Nathalie Deruelle,https://arxiv.org/abs/1703.05360,gr-qc,effective-one-body;EOB,foundations_hamiltonian_pn_pm;resummation_flux_waveform;nr_calibration_eobnr_seobnr_teobresums;gsf_gauge_invariants;tides_neutron_stars
2017,2017-03-20,1703.06814,Impact of Numerical Relativity information on effective-one-body waveform models,Alessandro Nagar; Gunnar Riemenschneider; Geraint Pratten,https://arxiv.org/abs/1703.06814,gr-qc,effective-one-body;EOB;EOBNR,nr_calibration_eobnr_seobnr_teobresums;spin_precession;data_analysis_lvkc
2017,2017-03-23,1703.08107,Parametrized-4.5PN TaylorF2 approximant(s) and tail effects to quartic nonlinear order from the effective one body formalism,Francesco Messina; Alessandro Nagar,https://arxiv.org/abs/1703.08107,gr-qc,effective-one-body;EOB,foundations_hamiltonian_pn_pm;resummation_flux_waveform;nr_calibration_eobnr_seobnr_teobresums;spin_precession;emri_test_mass_teukolsky;data_analysis_lvkc
2017,2017-05-04,1705.01845,Designing a template bank to observe compact binary coalescences in Advanced LIGO's second observing run,Tito Dal Canton; Ian W. Harry,https://arxiv.org/abs/1705.01845,gr-qc,effective-one-body,foundations_hamiltonian_pn_pm;nr_calibration_eobnr_seobnr_teobresums;spin_precession;tides_neutron_stars;eccentric_hyperbolic_scattering;data_analysis_lvkc
2017,2017-06-01,1706.00459,Spin-orbit precession along eccentric orbits for extreme mass ratio black hole binaries and its effective-one-body transcription,Chris Kavanagh; Donato Bini; Thibault Damour; Seth Hopper; Adrian C. Ottewill; Barry Wardell,https://arxiv.org/abs/1706.00459,gr-qc,effective-one-body;EOB,foundations_hamiltonian_pn_pm;gsf_gauge_invariants;spin_precession;eccentric_hyperbolic_scattering;emri_test_mass_teukolsky
2017,2017-06-13,1706.03884,Accurate recalibated waveforms for extreme-mass-ratio inspirals in effective-one-body frame,Ran Cheng; Wen-Biao Han,https://arxiv.org/abs/1706.03884,gr-qc,effective-one-body;EOB,resummation_flux_waveform;nr_calibration_eobnr_seobnr_teobresums;emri_test_mass_teukolsky;data_analysis_lvkc
2017,2017-06-21,1706.06877,Gravitational scattering of two black holes at the fourth post-Newtonian approximation,Donato Bini; Thibault Damour,https://arxiv.org/abs/1706.06877,gr-qc,effective-one-body,foundations_hamiltonian_pn_pm;gsf_gauge_invariants;spin_precession;eccentric_hyperbolic_scattering
2017,2017-07-26,1707.08426,Foundations of an effective-one-body model for coalescing binaries on eccentric orbits,Tanja Hinderer; Stanislav Babak,https://arxiv.org/abs/1707.08426,gr-qc,effective-one-body;EOB,foundations_hamiltonian_pn_pm;resummation_flux_waveform;nr_calibration_eobnr_seobnr_teobresums;gsf_gauge_invariants;spin_precession;eccentric_hyperbolic_scattering
2017,2017-08-01,1708.00166,A waveform model for eccentric binary black hole based on effective-one-body-numerical-relativity (EOBNR) formalism,Zhoujian Cao; Wen-Biao Han,https://arxiv.org/abs/1708.00166,gr-qc,effective-one-body;EOBNR,nr_calibration_eobnr_seobnr_teobresums;spin_precession;eccentric_hyperbolic_scattering;emri_test_mass_teukolsky;data_analysis_lvkc
2017,2017-08-11,1708.03501,Accurate inspiral-merger-ringdown gravitational waveforms for non-spinning black-hole binaries including the effect of subdominant modes,Ajit Kumar Mehta; Chandra Kant Mishra; Vijay Varma; Parameswaran Ajith,https://arxiv.org/abs/1708.03501,gr-qc,effective-one-body,foundations_hamiltonian_pn_pm;nr_calibration_eobnr_seobnr_teobresums;spin_precession
2017,2017-08-29,1708.08926,Sub-radian-accuracy gravitational waveforms of coalescing binary neutron stars in numerical relativity,Kenta Kiuchi; Kyohei Kawaguchi; Koutarou Kyutoku; Yuichiro Sekiguchi; Masaru Shibata; Keisuke Taniguchi,https://arxiv.org/abs/1708.08926,astro-ph.HE;astro-ph.CO;gr-qc,effective-one-body,nr_calibration_eobnr_seobnr_teobresums;tides_neutron_stars
2017,2017-09-02,1709.00590,"Gravitational spin-orbit coupling in binary systems, post-Minkowskian approximation and effective one-body theory",Donato Bini; Thibault Damour,https://arxiv.org/abs/1709.00590,gr-qc,effective-one-body,foundations_hamiltonian_pn_pm;nr_calibration_eobnr_seobnr_teobresums;gsf_gauge_invariants;spin_precession;eccentric_hyperbolic_scattering
2017,2017-09-18,1709.06016,"Scattering of two spinning black holes in post-Minkowskian gravity, to all orders in spin, and effective-one-body mappings",Justin Vines,https://arxiv.org/abs/1709.06016,gr-qc,effective-one-body,foundations_hamiltonian_pn_pm;gsf_gauge_invariants;spin_precession;eccentric_hyperbolic_scattering
2017,2017-09-27,1709.09742,Reducing the two-body problem in scalar-tensor theories to the motion of a test particle : a scalar-tensor effective-one-body approach,Félix-Louis Julié,https://arxiv.org/abs/1709.09742,gr-qc,effective-one-body;EOB,foundations_hamiltonian_pn_pm;resummation_flux_waveform;nr_calibration_eobnr_seobnr_teobresums;gsf_gauge_invariants;emri_test_mass_teukolsky
2017,2017-09-30,1710.00147,Excitation of high frequency voices from intermediate-mass-ratio inspirals with large eccentricity,Wen-Biao Han; Zhoujian Cao; Yi-Ming Hu,https://arxiv.org/abs/1710.00147,gr-qc,effective-one-body,nr_calibration_eobnr_seobnr_teobresums;eccentric_hyperbolic_scattering;emri_test_mass_teukolsky;data_analysis_lvkc
2017,2017-10-29,1710.10599,High-energy gravitational scattering and the general relativistic two-body problem,Thibault Damour,https://arxiv.org/abs/1710.10599,gr-qc,effective-one-body,foundations_hamiltonian_pn_pm;nr_calibration_eobnr_seobnr_teobresums;gsf_gauge_invariants;eccentric_hyperbolic_scattering
2017,2017-12-18,1712.06533,Assessing the Energetics of Spinning Binary Black Hole Systems,Serguei Ossokine; Tim Dietrich; Evan Foley; Reza Katebi; Geoffrey Lovelace,https://arxiv.org/abs/1712.06533,gr-qc,effective-one-body,foundations_hamiltonian_pn_pm;nr_calibration_eobnr_seobnr_teobresums;gsf_gauge_invariants;spin_precession
2018,2018-01-08,1801.02366,Factorization and resummation: A new paradigm to improve gravitational wave amplitudes. II: the higher multipolar modes,Francesco Messina; Alberto Maldarella; Alessandro Nagar,https://arxiv.org/abs/1801.02366,gr-qc,effective-one-body,foundations_hamiltonian_pn_pm;resummation_flux_waveform;spin_precession
2018,2018-01-11,1801.03704,Spin-orbit precession along eccentric orbits: improving the knowledge of self-force corrections and of their effective-one-body counterparts,Donato Bini; Thibault Damour; Andrea Geralico,https://arxiv.org/abs/1801.03704,gr-qc,effective-one-body,foundations_hamiltonian_pn_pm;gsf_gauge_invariants;spin_precession;eccentric_hyperbolic_scattering
2018,2018-03-06,1803.02350,Degeneracy of gravitational waveforms in the context of GW150914,James Creswell; Hao Liu; Andrew D. Jackson; Sebastian von Hausegger; Pavel Naselsky,https://arxiv.org/abs/1803.02350,gr-qc;astro-ph.CO,effective-one-body,nr_calibration_eobnr_seobnr_teobresums;spin_precession;data_analysis_lvkc
2018,2018-03-16,1803.06346,Improving performance of SEOBNRv3 by $\sim$300x,Tyler D. Knowles; Caleb Devine; David A. Buch; Serdar A. Bilgili; Thomas R. Adams; Zachariah B. Etienne; Sean T. McWilliams,https://arxiv.org/abs/1803.06346,gr-qc,effective-one-body;SEOBNR,nr_calibration_eobnr_seobnr_teobresums;spin_precession;data_analysis_lvkc
2018,2018-03-28,1803.10701,Enriching the Symphony of Gravitational Waves from Binary Black Holes by Tuning Higher Harmonics,Roberto Cotesta; Alessandra Buonanno; Alejandro Bohé; Andrea Taracchini; Ian Hinder; Serguei Ossokine,https://arxiv.org/abs/1803.10701,gr-qc,effective-one-body,foundations_hamiltonian_pn_pm;resummation_flux_waveform;nr_calibration_eobnr_seobnr_teobresums;spin_precession;data_analysis_lvkc
2018,2018-04-06,1804.02235,Matter imprints in waveform models for neutron star binaries: tidal and self-spin effects,Tim Dietrich; Sebastian Khan; Reetika Dudi; Shasvath J. Kapadia; Prayush Kumar; Alessandro Nagar; Frank Ohme; Francesco Pannarale; Anuradha Samajdar; Sebastiano Bernuzzi; Gregorio Carullo; Walter Del Pozzo; et al.,https://arxiv.org/abs/1804.02235,gr-qc;astro-ph.HE,effective-one-body;SEOBNR;TEOBResumS,foundations_hamiltonian_pn_pm;nr_calibration_eobnr_seobnr_teobresums;spin_precession;tides_neutron_stars
2018,2018-05-01,1805.00293,Black-hole Spectroscopy by Making Full Use of Gravitational-Wave Modeling,Richard Brito; Alessandra Buonanno; Vivien Raymond,https://arxiv.org/abs/1805.00293,gr-qc,effective-one-body;EOBNR,resummation_flux_waveform;nr_calibration_eobnr_seobnr_teobresums;spin_precession;data_analysis_lvkc
2018,2018-05-10,1805.03891,Rush the inspiral: efficient Effective One Body time-domain gravitational waveforms,Alessandro Nagar; Piero Rettegno,https://arxiv.org/abs/1805.03891,gr-qc,effective-one-body;EOB;TEOBResumS,foundations_hamiltonian_pn_pm;resummation_flux_waveform;nr_calibration_eobnr_seobnr_teobresums;spin_precession;tides_neutron_stars;data_analysis_lvkc
2018,2018-05-28,1805.10809,Gravitational spin-orbit coupling in binary systems at the second post-Minkowskian approximation,Donato Bini; Thibault Damour,https://arxiv.org/abs/1805.10809,gr-qc;hep-th,effective-one-body;EOB,foundations_hamiltonian_pn_pm;resummation_flux_waveform;spin_precession;eccentric_hyperbolic_scattering
2018,2018-06-05,1806.01625,CoRe database of binary neutron star merger waveforms and its application in waveform development,Tim Dietrich; David Radice; Sebastiano Bernuzzi; Francesco Zappa; Albino Perego; Bernd Brueugmann; Swami Vivekanandji Chaurasia; Reetika Dudi; Wolfgang Tichy; Maximiliano Ujevic,https://arxiv.org/abs/1806.01625,gr-qc;astro-ph.HE,effective-one-body,nr_calibration_eobnr_seobnr_teobresums;spin_precession;tides_neutron_stars;eccentric_hyperbolic_scattering;data_analysis_lvkc
2018,2018-06-05,1806.01772,"Time-domain effective-one-body gravitational waveforms for coalescing compact binaries with nonprecessing spins, tides and self-spin effects",Alessandro Nagar; Sebastiano Bernuzzi; Walter Del Pozzo; Gunnar Riemenschneider; Sarp Akcay; Gregorio Carullo; Philipp Fleig; Stanislav Babak; Ka Wa Tsang; Marta Colleoni; Francesco Messina; Geraint Pratten; et al.,https://arxiv.org/abs/1806.01772,gr-qc,effective-one-body;EOB;TEOBResumS,foundations_hamiltonian_pn_pm;resummation_flux_waveform;nr_calibration_eobnr_seobnr_teobresums;gsf_gauge_invariants;spin_precession;tides_neutron_stars;eccentric_hyperbolic_scattering;data_analysis_lvkc
2018,2018-08-20,1808.06582,Hamiltonians and canonical coordinates for spinning particles in curved space-time,Vojtěch Witzany; Jan Steinhoff; Georgios Lukes-Gerakopoulos,https://arxiv.org/abs/1808.06582,gr-qc;astro-ph.HE,effective-one-body,foundations_hamiltonian_pn_pm;spin_precession;eccentric_hyperbolic_scattering;emri_test_mass_teukolsky
2018,2018-08-29,1808.09749,Relevance of tidal effects and post-merger dynamics for binary neutron star parameter estimation,Reetika Dudi; Francesco Pannarale; Tim Dietrich; Mark Hannam; Sebastiano Bernuzzi; Frank Ohme; Bernd Bruegmann,https://arxiv.org/abs/1808.09749,gr-qc,effective-one-body,nr_calibration_eobnr_seobnr_teobresums;spin_precession;tides_neutron_stars;data_analysis_lvkc
2018,2018-09-03,1809.03109,Hairy binary black holes in Einstein-Maxwell-dilaton theory and their effective-one-body description,Mohammed Khalil; Noah Sennett; Jan Steinhoff; Justin Vines; Alessandra Buonanno,https://arxiv.org/abs/1809.03109,gr-qc;astro-ph.HE;hep-th,effective-one-body;EOB,foundations_hamiltonian_pn_pm;nr_calibration_eobnr_seobnr_teobresums;data_analysis_lvkc
2018,2018-09-07,1809.02516,Gravitational self-force corrections to gyroscope precession along circular orbits in the Kerr spacetime,Donato Bini; Thibault Damour; Andrea Geralico; Chris Kavanagh; Maarten van de Meent,https://arxiv.org/abs/1809.02516,gr-qc,effective-one-body,foundations_hamiltonian_pn_pm;nr_calibration_eobnr_seobnr_teobresums;gsf_gauge_invariants;spin_precession
2018,2018-09-12,1809.04349,Systematic effects from black hole-neutron star waveform model uncertainties on the neutron star equation of state,Kabir Chakravarti; Anuradha Gupta; Sukanta Bose; Matthew D. Duez; Jesus Caro; Wyatt Brege; Francois Foucart; Shaon Ghosh; Koutarou Kyutoku; Benjamin D. Lackey; Masaru Shibata; Daniel A. Hemberger; et al.,https://arxiv.org/abs/1809.04349,gr-qc;astro-ph.SR,effective-one-body;EOB,foundations_hamiltonian_pn_pm;nr_calibration_eobnr_seobnr_teobresums;spin_precession;tides_neutron_stars;data_analysis_lvkc
2018,2018-09-13,1809.05041,Gravitational radiation from compact binary systems in Einstein-Maxwell-dilaton theories,Félix-Louis Julié,https://arxiv.org/abs/1809.05041,gr-qc,effective-one-body;EOB,resummation_flux_waveform;nr_calibration_eobnr_seobnr_teobresums
2018,2018-12-03,1812.00956,Spinning-black-hole scattering and the test-black-hole limit at second post-Minkowskian order,Justin Vines; Jan Steinhoff; Alessandra Buonanno,https://arxiv.org/abs/1812.00956,gr-qc,effective-one-body,foundations_hamiltonian_pn_pm;spin_precession;eccentric_hyperbolic_scattering
2018,2018-12-06,1812.02744,Effective-one-body multipolar waveform for tidally interacting binary neutron stars up to merger,Sarp Akcay; Sebastiano Bernuzzi; Francesco Messina; Alessandro Nagar; Néstor Ortiz; Piero Rettegno,https://arxiv.org/abs/1812.02744,gr-qc,effective-one-body;EOB,foundations_hamiltonian_pn_pm;resummation_flux_waveform;nr_calibration_eobnr_seobnr_teobresums;gsf_gauge_invariants;spin_precession;tides_neutron_stars;eccentric_hyperbolic_scattering
2018,2018-12-19,1812.07865,Surrogate model of hybridized numerical relativity binary black hole waveforms,Vijay Varma; Scott E. Field; Mark A. Scheel; Jonathan Blackman; Lawrence E. Kidder; Harald P. Pfeiffer,https://arxiv.org/abs/1812.07865,gr-qc,effective-one-body,foundations_hamiltonian_pn_pm;nr_calibration_eobnr_seobnr_teobresums;spin_precession;data_analysis_lvkc
2018,2018-12-19,1812.07923,"Nonlinear-in-spin effects in effective-one-body waveform models of spin-aligned, inspiralling, neutron star binaries",Alessandro Nagar; Francesco Messina; Piero Rettegno; Donato Bini; Thibault Damour; Andrea Geralico; Sarp Akcay; Sebastiano Bernuzzi,https://arxiv.org/abs/1812.07923,gr-qc,effective-one-body;EOB;TEOBResumS,foundations_hamiltonian_pn_pm;nr_calibration_eobnr_seobnr_teobresums;gsf_gauge_invariants;spin_precession;tides_neutron_stars
2018,2018-12-20,1812.08643,Surrogate model for an aligned-spin effective one body waveform model of binary neutron star inspirals using Gaussian process regression,Benjamin D. Lackey; Michael Pürrer; Andrea Taracchini; Sylvain Marsat,https://arxiv.org/abs/1812.08643,gr-qc,effective-one-body;SEOBNR,nr_calibration_eobnr_seobnr_teobresums;spin_precession;tides_neutron_stars;data_analysis_lvkc
2019,2019-01-21,1901.07102,Energetics of two-body Hamiltonians in post-Minkowskian gravity,Andrea Antonelli; Alessandra Buonanno; Jan Steinhoff; Maarten van de Meent; Justin Vines,https://arxiv.org/abs/1901.07102,gr-qc;hep-th,effective-one-body;EOB,foundations_hamiltonian_pn_pm;resummation_flux_waveform;nr_calibration_eobnr_seobnr_teobresums;eccentric_hyperbolic_scattering;data_analysis_lvkc
2019,2019-04-21,1904.09550,A Multipolar Effective One Body Model for Non-Spinning Black Hole Binaries,Alessandro Nagar; Geraint Pratten; Gunnar Riemenschneider; Rossella Gamba,https://arxiv.org/abs/1904.09550,gr-qc,effective-one-body;EOB,foundations_hamiltonian_pn_pm;resummation_flux_waveform;nr_calibration_eobnr_seobnr_teobresums;spin_precession;emri_test_mass_teukolsky
2019,2019-04-21,1904.09558,Quasi-5.5PN TaylorF2 approximant for compact binaries: point-mass phasing and impact on the tidal polarizability inference,Francesco Messina; Reetika Dudi; Alessandro Nagar; Sebastiano Bernuzzi,https://arxiv.org/abs/1904.09558,gr-qc,effective-one-body;EOB,foundations_hamiltonian_pn_pm;resummation_flux_waveform;nr_calibration_eobnr_seobnr_teobresums;gsf_gauge_invariants;spin_precession;tides_neutron_stars;data_analysis_lvkc
2019,2019-05-02,1905.00818,Frequency domain model of $f$-mode dynamic tides in gravitational waveforms from compact binary inspirals,Patricia Schmidt; Tanja Hinderer,https://arxiv.org/abs/1905.00818,gr-qc;astro-ph.HE,effective-one-body,nr_calibration_eobnr_seobnr_teobresums;spin_precession;tides_neutron_stars;eccentric_hyperbolic_scattering
2019,2019-05-15,1905.06011,Improving the NRTidal model for binary neutron star systems,Tim Dietrich; Anuradha Samajdar; Sebastian Khan; Nathan K. Johnson-McDaniel; Reetika Dudi; Wolfgang Tichy,https://arxiv.org/abs/1905.06011,gr-qc;astro-ph.HE,effective-one-body;SEOBNR,foundations_hamiltonian_pn_pm;nr_calibration_eobnr_seobnr_teobresums;spin_precession;tides_neutron_stars
2019,2019-05-17,1905.07340,The two-body potential of Vainshtein screened theories,Adrien Kuntz,https://arxiv.org/abs/1905.07340,gr-qc;astro-ph.CO;hep-ph,effective-one-body,foundations_hamiltonian_pn_pm;nr_calibration_eobnr_seobnr_teobresums
2019,2019-07-26,1907.11597,Quasi-circular inspirals and plunges from non-spinning effective-one-body Hamiltonians with gravitational self-force information,Andrea Antonelli; Maarten van de Meent; Alessandra Buonanno; Jan Steinhoff; Justin Vines,https://arxiv.org/abs/1907.11597,gr-qc,effective-one-body;EOB,foundations_hamiltonian_pn_pm;resummation_flux_waveform;nr_calibration_eobnr_seobnr_teobresums;gsf_gauge_invariants;spin_precession
2019,2019-07-29,1907.12233,Factorization and resummation: A new paradigm to improve gravitational wave amplitudes. III: the spinning test-body terms,Alessandro Nagar; Francesco Messina; Chris Kavanagh; Georgios Lukes-Gerakopoulos; Niels Warburton; Sebastiano Bernuzzi; Enno Harms,https://arxiv.org/abs/1907.12233,gr-qc,effective-one-body,foundations_hamiltonian_pn_pm;resummation_flux_waveform;nr_calibration_eobnr_seobnr_teobresums;spin_precession;emri_test_mass_teukolsky
2019,2019-08-29,1908.11418,kiloHertz gravitational waves from binary neutron star remnants: time-domain model and constraints on extreme matter,Matteo Breschi; Sebastiano Bernuzzi; Francesco Zappa; Michalis Agathos; Albino Perego; David Radice; Alessandro Nagar,https://arxiv.org/abs/1908.11418,gr-qc;astro-ph.HE,effective-one-body,nr_calibration_eobnr_seobnr_teobresums;spin_precession;tides_neutron_stars
2019,2019-09-05,1909.02375,Novel approach to binary dynamics: application to the fifth post-Newtonian level,Donato Bini; Thibault Damour; Andrea Geralico,https://arxiv.org/abs/1909.02375,gr-qc,effective-one-body,foundations_hamiltonian_pn_pm;resummation_flux_waveform;gsf_gauge_invariants
2019,2019-09-12,1909.05466,Searching for Eccentricity: Signatures of Dynamical Formation in the First Gravitational-Wave Transient Catalogue of LIGO and Virgo,Isobel M. Romero-Shaw; Paul D. Lasky; Eric Thrane,https://arxiv.org/abs/1909.05466,astro-ph.HE;astro-ph.IM,SEOBNR,nr_calibration_eobnr_seobnr_teobresums;spin_precession;eccentric_hyperbolic_scattering;data_analysis_lvkc
2019,2019-09-13,1909.06103,Self-force effects on the marginally bound zoom-whirl orbit in Schwarzschild spacetime,Leor Barack; Marta Colleoni; Thibault Damour; Soichiro Isoyama; Norichika Sago,https://arxiv.org/abs/1909.06103,gr-qc;astro-ph.HE,effective-one-body,foundations_hamiltonian_pn_pm;nr_calibration_eobnr_seobnr_teobresums;gsf_gauge_invariants;eccentric_hyperbolic_scattering
2019,2019-09-22,1909.10010,Parameter Estimation with a spinning multi-mode waveform model: IMRPhenomHM,Chinmay Kalaghatgi; Mark Hannam; Vivien Raymond,https://arxiv.org/abs/1909.10010,gr-qc,EOB,nr_calibration_eobnr_seobnr_teobresums;spin_precession;data_analysis_lvkc
